author,content,description,publishedAt,source,title,url,urlToImage,source_id,source_name,types,yes_disaster
Andrew Freedman,"Thursday looks to be a pivotal, frightening day in Southern California's battle against a wildfire siege that began early this week and has since spread out of control. At least three large fires are currently burning in and around Los Angeles, including one — the Thomas Fire — which has already burned at least 90,000 acres near Ventura. Early Thursday morning, authorities closed the 101 Freeway in both directions due to strong winds pushing fire close to the road, cutting off movement between Santa Barbara and Ventura counties. Evacuation orders have gone out for idyllic communities in the Ojai Valley, as well as parts of Santa Barbara, as flames move toward the coast, according to the LA Times. More evacuations are likely on Thursday. SEE ALSO: Wildfires lead to hellish scenes for Los Angeles commuters The weather conditions on Thursday are downright dire, with strong, damaging winds rushing through mountain passes and down hillsides toward the coast. This will create extraordinarily dry air, and make any new fires or ones that are already in progress extremely difficult, if not impossible, to control. California’s fire history is replete with Santa Ana-driven, damaging blazes. However, the combination of factors present on Thursday — powerful winds, preexisting fires, desiccated vegetation, and also population growth — make it stand out as an especially risky day for the state. According to news reports, more than 200,000 people have been evacuated due to the fires, and this number may climb as the winds interact with the fires to push them in new directions at a faster clip. According to the Storm Prediction Center (SPC), which forecasts the risk of wildfires based on anticipated weather conditions, fire weather is likely to be ""extremely critical"" — a rare designation reserved for only the most threatening situations — in a swath of Southern California on Thursday. These combustible conditions are going to affect about 9.5 million people, the SPC forecasts. Another 10.7 million people reside in a ""critical"" fire weather zone, including the city of Los Angeles. Elevated fire risk is forecast for Southern California straight through Saturday. ""Large fire spread and extreme fire behavior will occur with any new/ongoing fires,"" the SPC said in a forecast discussion. Average temperatures across California during the summer months (June, July, and August) in 2017. Image: NOAA The high winds may prevent aircraft, including helicopters and heavy water bombers, from doing their work, as well. This further inhibits firefighters' ability to contain these blazes. The National Weather Service is predicting strong winds to last all day on Thursday. The winds have already exceeded hurricane force in some high elevation areas, with gusts above 75 miles per hour. While wildfires are a typical occurrence in Southern California each fall, when the dry, offshore Santa Ana winds blow, the current blazes are occurring later in the year than normal. In addition, conditions in the region are far drier than they normally would be. These fires are an illustration of how short-term weather variability can interact with longer-term climate trends to create a precedent-setting, potentially deadly extreme event. A fire sends embers all over residential neighborhoods north of Ventura, Calif. on Dec. 5, 2017. Image: Marcus Lam/LA Times via Getty Images ""The risk of large wildfires in coastal California typically peaks in Autumn after the long dry summers — typical of California’s Mediterranean climate — increase the flammability of the vegetation that fuels wildfires,"" LeRoy Westerling, a scientist researching climate and wildfire at the University of California at Merced, said in an email. ""The overlap between the dry fuels and these warm dry wind events marks the peak fire risk for the year in coastal California,"" Westerling said. ""Usually, Autumn rains put an end to the fire season by wetting fuels and raising humidity, even though wind events may continue to occur."" The problem is, Westerling noted, it hasn't rained much in Southern California since March. The state also had its hottest summer on record, which dried out the vegetation that grew after one of its wettest winters, forming a perfect weather whiplash combo that is conducive to igniting large fires. ""Southern California has remained unusually dry through November and into December this year, extending the high fire risk fueled by the confluence of dry conditions and Autumn winds that are driving the large fires burning in coastal Southern California,"" Westerling said. While these fires cannot be directly tied to climate change, since they were most likely ignited by downed power lines or arson, they are consistent with what scientists expect to occur more frequently from a warming, drying climate in much of California. The entire American West, in fact, is likely to see — and in many cases has already seen — an increase in the size and frequency of large wildfires. ""Climate change is increasing the variability of precipitation as well as increasing temperatures,"" Westerling said. ""This means that the probability of extremely large wind-driven fires in California occurring later in the year is increasing.""","Thursday looks to be a pivotal, frightening day in Southern California's battle against a wildfire siege that began early this week and has since spread out of control. At least three large fires are currently burning in and around Los Angeles, including one …",2017-12-07T15:30:01Z,"{'id': 'mashable', 'name': 'Mashable'}",Thursday is one of the most dangerous wildfire days in recent Southern California history,http://mashable.com/2017/12/07/southern-california-wildfires-most-dangerous-day-winds/,https://i.amz.mshcdn.com/31ewCc2jpdQBEOQNZoZk-AEahvA=/1200x630/2017%2F12%2F07%2F11%2F01ff1ee7bd9f4c1da7d512f263f4366e.6f11e.jpg,mashable,Mashable,wildfires,0
PATRICIA MAZZEI,"In September, following Hurricanes Harvey and Irma, Congress approved $15 billion in relief aid. Lawmakers signed off on another $36.5 billion for storm and wildfires assistance in October, after weeks of criticism leveled against the Trump administration for its response to Maria in Puerto Rico. The $90 billion disaster relief package outlined on Wednesday also includes aid for communities affected by hurricanes or wildfires in California, Florida, Texas and the Virgin Islands. When Hurricane Katrina hit the Gulf Coast in 2005, Congress approved $10 billion for the Federal Emergency Management Agency four days later, and another $50 billion six days later. The federal government is still spending money on Katrina assistance, more than 12 years after the storm’s landfall. Before Hurricane Maria, Puerto Rico’s worst natural disaster in nearly a century, the island was already grappling with insolvency. The government declared a form of bankruptcy last May, after years of borrowing money to pay for operating expenses after a painful recession that began in 2006. The relief package sets aside $4.8 billion for Medicaid in Puerto Rico and the Virgin Islands, helping to avoid a looming shortfall that could have left some 600,000 Medicaid beneficiaries in Puerto Rico without health insurance by April. Puerto Rican leaders worried some of the people left uninsured would migrate to the mainland seeking coverage. Compared to the states, territories receive only a fraction of funding for entitlement programs. The Senate deal would waive the requirement for Puerto Rico and the Virgin Islands to share in the cost of Medicaid for two years, placing the funding responsibility on the federal government instead. Louisiana received the same reprieve after Hurricane Katrina, but for only one year, said Representative Jenniffer González-Colón, Puerto Rico’s nonvoting delegate in Congress. Lawmakers approved relief packages for 10 years after that storm, she noted. Puerto Rico is not that far removed yet from Hurricane Maria. “Receiving these funds is important, and that will demonstrate that Puerto Rico will use them wisely and with transparency,” she said. “That’s an important issue here: We can be a model for how to invest in infrastructure on the island.” Puerto Rico’s governor, Ricardo A. Rosselló, said the $2 billion earmarked for power restoration in Puerto Rico and the Virgin Islands could help his island harden its battered grid. While funds from the previous aid packages went to FEMA and the Army Corps of Engineers, the latest relief package will give money directly to the Puerto Rican government. Twenty-eight percent of Puerto Ricans — more than 400,000 utility customers — still do not have power more than four months after Hurricane Maria slammed into Puerto Rico. “With these resources, we can begin rebuilding our housing and energy future, putting Puerto Rico on a new path forward,” Mr. Rosselló said in a statement. Follow Patricia Mazzei on Twitter: @PatriciaMazzei. Agustin Armendariz contributed reporting. Continue reading the main story","Damaged power lines in a residential area in Santurce district of San Juan, P.R., in November. Senate leaders allocated $2 billion for power restoration on Puerto Rico and the United States Virgin Islands, as part of a larger disaster relief fund.",2018-02-08T23:02:30Z,"{'id': 'the-new-york-times', 'name': 'The New York Times'}","What Puerto Rico Is, and Isn’t, Getting in Disaster Relief",https://www.nytimes.com/2018/02/08/us/puerto-rico-disaster-relief.html,https://static01.nyt.com/images/2018/02/09/us/09puerto1/09puerto1-facebookJumbo.jpg,the-new-york-times,The New York Times,wildfires,0
Mark Kaufman,"The flames scorching the Western U.S. aren't expected to relent anytime soon. The National Oceanic and Atmospheric Administration (NOAA) gave its monthly U.S. climate report on Thursday, and they used the opportunity to show that the next couple of months are ripe for an enhanced fire risk out West. SEE ALSO: The baking Pacific Ocean is changing the weather on the Southern California coast After noting the exceptionally hot and dry conditions that stoked destructive wildfires so far this summer, Tim Brown, director of the Western Regional Climate Center, said in a press call that it won't be until after October that ""we see a decline in significant fire potential."" A critical driver of this heightened fire potential is that trees, grasses, and shrubs, known collectively as fuels, are currently ""flirting with all-time record lows for fuel moisture,"" said Brown. In short, hot temperatures and multiple heat waves this summer have parched the land to extreme levels, turning it to tinder. Meaningful rains can solve the problem, but they don't usually show up in many portions of the West until November. What's more, the coming fall months have another potent fire factor that isn't usually seen in August: Strong offshore winds, blowing from the northeast. Called ""diablo winds"" in Northern California, these gusts are hot, dry, and fast and have historically whipped up fires. Case in point: The deadly firestorms that swept through Northern California neighborhoods last summer were stoked by October's diablo winds. On top of all this, Brown underscored that since 1895, there has been a trend in increasing temperatures at night, which ultimately won't allow fuels to cool off and recover. ""This can lead to longer fires and more smoke production,"" he said. But in the last couple decades, ""this trend has taken off,"" said Brown. Taken alone, each of these environmental conditions can stoke fires, but taken together, they invite major flames. Some of the largest fires in California history are burning through the ravaged state right now, and smoke from both the Western U.S. and Canada has traveled thousands of miles away to the Atlantic Ocean, actually engulfing a cyclone. Just out: NASA global temperature for July. It was the 3rd warmest July on record after 2016 and 2017. Since July is the warmest month of the year, the past July was one of the warmest recorded months ever. Likely among the warmest months since the Eemian 120,000 years ago. pic.twitter.com/KGZXh5ZXOS — Stefan Rahmstorf (@rahmstorf) August 15, 2018 Brown likened the profoundly parched vegetation in the West to a dying Christmas tree. During winter, the tree might be wet and green, but as time passes and the leaves brown, it becomes an increasing flammable object. And unfortunately, that's how we all should be thinking about the West right now.","The flames scorching the Western U.S. aren't expected to relent anytime soon. The National Oceanic and Atmospheric Administration (NOAA) gave its monthly U.S. climate report on Thursday, and they used the opportunity to show that the next couple of months are…",2018-08-17T09:00:00Z,"{'id': 'mashable', 'name': 'Mashable'}",We have some bad news about the future of the terrible wildfires in the Western U.S.,https://mashable.com/2018/08/17/wildfire-risk-2018-noaa/,https://i.amz.mshcdn.com/pxTUQJd9z9zrMjCPMuqID0lvvBI=/1200x630/2018%2F08%2F17%2Fed%2F51293f4a36074d03a99963b6aa3e30a8.77af9.jpg,mashable,Mashable,wildfires,0
Mark Kaufman,"It should come as no surprise that California is burning. On Wednesday, the National Oceanic and Atmospheric Administration (NOAA) reported that July was California's hottest month since record keeping began in 1895. Those scorching temperatures withered the land, creating profoundly parched forests primed to catch fire with just a spark. SEE ALSO: Engineering Earth's climate might quell global warming, but it could come with a cost Major wildfires are propelled by weather, notably strong winds, but they're also enhanced by overall rising global temperatures due to human-caused climate change, say scientists. This is a particularly stark reality in California, where even in early July, fire scientists noted that the state's vegetation reached near-record dryness. On Monday, the Mendocino Complex Fire became the largest blaze in state history, easily outpacing the Thomas Fire, which broke the record just this past winter. Nearly the entire Golden State experienced either record heat or temperatures ""much above average"" in July, said NOAA. However, California wasn't alone in experiencing scorching temperatures and multiple heat waves. Most of the West was abnormally warm, and in the contiguous U.S., May through July temperatures were also the warmest on record, eclipsing the previous record set in 1934. Image: noaa As climate and environmental scientists are quick to point out, individual temperature records are not too meaningful — it's the long-term trends that matter. And California's summer heat is certainly a continuation of accelerating warming trends in both the U.S. and around the globe. Heat waves and longer warming spells will certainly happen, regardless of what the climate is doing, as big blobs of warm air can settle over areas, like California or Europe, for extended periods of time. But the climate is simply warmer that it was a half century ago, giving hot temperatures an extra boost — which can mean vast swathes of land are turned to fire-ready tinder. Yet another heat wave continues this week in portions of California, like Los Angeles. As might be expected, this doesn't bode well for the already dry vegetation in the region. Southern California's Holly Fire is now actively growing near suburban neighborhoods. Relieving rains aren't expected in much of the state for months. California, like recently scorched Greece, experiences the dry, warm summers defined by the Mediterranean climate. Historically, fires happen during this time of year. But now — just like heat waves around the world — they're getting worse. And the consequences are plainly visible.","It should come as no surprise that California is burning. On Wednesday, the National Oceanic and Atmospheric Administration (NOAA) reported that July was California's hottest month since record keeping began in 1895. Those scorching temperatures withered the …",2018-08-08T21:34:51Z,"{'id': 'mashable', 'name': 'Mashable'}","California just had its hottest month on record, and that means more wildfires",https://mashable.com/2018/08/08/california-hottest-month-july-fires/,https://i.amz.mshcdn.com/0QgyZf8WKm0QfTX_7dSCCw_yr1Q=/1200x630/2018%2F08%2F08%2Fcb%2F2982b7dc51c34720b4716fc5823f8be4.322c3.png,mashable,Mashable,wildfires,0
https://www.facebook.com/bbcnews,"Media caption California wildfires continue to rage Thirteen more bodies have been recovered in California, bringing the death toll in the US state's deadliest wildfires to 42, officials say. The remains were found in and around the largely incinerated town of Paradise, in the north of the state. At least 228 people are missing, as the Camp Fire continues to rage. Nearly 7,200 structures have been destroyed, and another 15,500 are at risk. The fire has now surpassed the 1933 Griffith Park disaster that killed 31. In the south, the Woolsey Fire has claimed two lives as it damaged beach resorts, including Malibu. An estimated 250,000 people have been forced to flee their homes across the state. Speaking at a news conference on Monday evening, Butte County Sheriff Kory Honea confirmed the number of dead, and the official number of missing. Many more people are said to be unaccounted for. How did people die? Some bodies were found in gutted cars that were overrun by the fast-moving blaze. Paradise and its surrounding area bore the brunt of the inferno, which started in nearby forest on Thursday. Image copyright AFP/Getty Images Image caption The town of Paradise has been obliterated by the blaze ""It was very scary,"" Paradise Mayor Jody Jones told CNN, recounting her family's escape from the town. ""It took a long time to get out. There was fire on both sides of the car. You could feel the heat coming in through the car,"" she said. Among the victims were also elderly residents with mobility issues or people who decided to stay despite evacuation orders. Forensic experts are stepping up their search in the ruins of Paradise, but officials warn that finding the bodies could take weeks. Two mobile army morgues are being brought in to help to identify the dead. The fire has burned more than 111,000 acres (45,000 hectares) and is nearly 25% contained, fire officials said. Media caption Fleeing through flames: ""I'm so scared right now... so terrified"" What about further south? The separate Woosley Blaze started on Thursday near Thousand Oaks, about 40 miles (64km) north-west of central Los Angeles. It has consumed at least 85,500 acres and destroyed at least 177 buildings, officials said. It is only 10% contained. The smaller Hill Fire, nearby, has scorched 4,530 acres and is 75% contained. Luxury homes in Malibu and other beach communities are among the properties razed by the flames. Why are the fires so bad? Historically, California's ""wildfire season"" started in summer and ran into early autumn. But experts have warned that the risk is now year-round. The current fires are being blamed on a combination of climate change and weather conditions. Low humidity, warm Santa Ana winds, and dry ground after a rain-free month have produced a prime fire-spreading environment. The state's 40-million-strong population also helps explain the fires' deadliness. That number is almost double what it was in the 1970s, and people are living closer to at-risk forest areas. Image copyright Getty Images Image caption Population density has been growing in areas that used to be sparsely inhabited And then there's climate change. Recent years have produced record-breaking temperatures, earlier springs, and less reliable rainfall. Citing the role of a warming climate, Governor Brown declared: ""This is not the new normal, this is the new abnormal."" Musician Neil Young made the same link, writing on his website: ""I have lost my home before to a California wildfire, now another."" ""We are vulnerable because of climate change; the extreme weather events and our extended drought is part of it."" Have you been affected by the wildfires? If it is safe to do so please get in touch. Email haveyoursay@bbc.co.uk. Please include a contact number if you are willing to speak to a BBC journalist. You can also contact us in the following ways: WhatsApp: +44 7555 173285 Tweet: @BBC_HaveYourSay Send pictures/video to yourpics@bbc.co.uk Or Upload your pictures/video here Text an SMS or MMS to 61124 or +44 7624 800 100 Please read our terms &amp; conditions and privacy policy",The Camp Fire in the north of the US state has now surpassed the 1933 Griffith Park disaster.,2018-11-13T05:17:52Z,"{'id': 'bbc-news', 'name': 'BBC News'}",California wildfires: At least 42 are killed in deadliest blaze,https://www.bbc.co.uk/news/world-us-canada-46190118,https://ichef.bbci.co.uk/images/ic/1024x576/p06rk6sf.jpg,bbc-news,BBC News,wildfires,0
https://www.facebook.com/bbcnews,"Image copyright AFP Image caption Dogs are being used to search for human remains among the devastation US President Donald Trump is heading to California to survey the deadliest and most destructive wildfire in the state's history. The Camp Fire in northern California has killed at least 71 people. More than 1,000 people are reported to be missing, although officials say that figure could fluctuate. Leaving for California, Mr Trump again focused on forest management as a cause of the blazes, a claim that has been disputed by experts. On top of the Camp Fire, firefighters are also tackling several other blazes, including the Woolsey Fire near Los Angeles which has claimed at least three lives. And adding to the misery, scores of people have become sick after outbreaks of the norovirus at shelters and the air quality in northern California has been rated the world's worst. Heavy rain is forecast next week that could douse the flames but also bring mudslides and floods on hillsides stripped of vegetation. What's the latest on the Camp Fire? The death toll rose to 71 on Friday after seven more bodies were found in the town of Paradise, which has been all but destroyed by the fire. Military troops are assisting forensics teams and cadaver dogs as they continue to search for human remains eight days on after the Camp Fire first broke out. Image copyright AFP Image caption The town of Paradise is in ruins Butte County Sheriff Kory Honea put the number of people unaccounted for at 1,011, a sharp leap from the 631 reported just 24 hours earlier. However, he described the list as ""dynamic"", ""The information I am providing you is raw data and we find there is the likely possibility that the list contains duplicate names,"" he said. Some of those on the list may be fine but unaware they have been reported missing, or unable to call, authorities say. The Camp Fire is now about 50% contained but fire officials say they may not have it fully under control until the end of the month. What kind of welcome will the president get? Mr Trump is due to meet survivors and firefighters involved in tacking the blaze when he touches down. Asked on Fox News if he thought climate change had contributed to the wildfires, he said ""Maybe it contributes a little bit. The big problem we have is management."" California Governor Jerry Brown, who has criticised this argument as simplistic, said he would welcome the president to the state. ""Now is a time to pull together for the people of California,"" he tweeted. Media caption California wildfires survivor's tearful account of escape with son Others suggested the president faced a difficult reception. One woman who voted for Mr Trump and was forced to flee Paradise said she disagreed with his assessment. ""I would tell him that this fire has nothing to do with forest mismanagement. Thousands and thousands of homes got destroyed with no trees around,"" Roslyn Roberts told Reuters. Another woman, living in a shelter, told Associated Press: ""If you insult people, then you go visit them, how do you think you're going to be accepted? You're not going to have a parade."" Image copyright AFP Image caption Many of the victims were found dead, trapped in their cars Image copyright Getty Images Image caption The fires are being brought under control but it could be weeks before they are fully contained Historically, California's ""wildfire season"" started in summer and ran into early autumn - but experts have warned that the risk is now year-round. Low humidity, warm winds, and dry ground after a rain-free month have produced a prime fire-spreading environment. Have you been affected by the wildfires? If it is safe to do so please get in touch. Email haveyoursay@bbc.co.uk. Please include a contact number if you are willing to speak to a BBC journalist. You can also contact us in the following ways: WhatsApp: +44 7555 173285 Tweet: @BBC_HaveYourSay Send pictures/video to yourpics@bbc.co.uk Or Upload your pictures/video here Text an SMS or MMS to 61124 or +44 7624 800 100 Please read our terms &amp; conditions and privacy policy","The toll from the Camp Fire in California has risen to 71 with more than 1,000 people reported missing.",2018-11-17T15:00:57Z,"{'id': 'bbc-news', 'name': 'BBC News'}",California wildfires: Trump to visit state's deadliest wildfire,https://www.bbc.co.uk/news/world-us-canada-46248510,https://ichef.bbci.co.uk/news/1024/branded_news/A684/production/_104382624_mediaitem104382623.jpg,bbc-news,BBC News,wildfires,0
