author,content,description,publishedAt,source,title,url,urlToImage,source_id,source_name,types,yes_disaster
LISA FRIEDMAN and JOSE A. DEL REAL,"“To dismiss the role of climate change on these fires is simply incorrect,” said Mr. Wehner, who was a lead author on a chapter of the Fourth National Climate Assessment, a series of federal summaries of climate change data. He made the point, as most climate scientists do, that the cause of the wildfires is multifold, like in any complex event. And this trend promises to continue: According to the National Climate Assessment science report released last year, the number of large forest fires in the Western United States and Alaska is projected to rise as the climate continues to warm. So did the president capture the causes of the California wildfires accurately? Lisa: The president’s tweet said that the California wildfires were worsened by “bad environmental laws which aren’t allowing massive amounts of readily available water to be properly utilized.” Virtually every scientist and forest management expert agreed that Mr. Trump’s tweet was scientifically and factually inaccurate. Mr. Trump’s other admonition that California “must also tree clear to stop fire spreading!” raised fewer objections. But, state officials pointed out, California devoted more than $250 million in state funds this year alone on efforts to reduce the risk of wildfires. How about the president’s point about water policy? How is that related to wildfire management and firefighting? Is there any connection, as the president suggested?","Wednesday: Hazardous air quality in the San Joaquin Valley, accusations of slogan-stealing in the 10th district, and LeBron James excites bike activists.",2018-08-08T13:13:09Z,"{'id': 'the-new-york-times', 'name': 'The New York Times'}",California Today: California Today: Your Questions About Fires and Climate,https://www.nytimes.com/2018/08/08/us/california-today-fires-and-climate.html,https://static01.nyt.com/images/2018/08/07/us/07CALTODAY-01/merlin_142056570_ff8f2de5-3943-43a0-894e-84c0995be321-facebookJumbo.jpg,the-new-york-times,The New York Times,wildfires,0
https://www.facebook.com/bbcnews,"Image copyright Getty Images Image caption 24 July: Firefighters and volunteers try to extinguish flames during a wildfire at the Greek village of Kineta Wildfires have been sweeping through coastal towns east of the Greek capital, Athens. Dozens of people - including families with children - have died as they tried to escape the flames. But fires are also raging in Sweden, as far north as the Arctic Circle, and have caused huge damage in countries including Portugal, the UK and the US in recent months. So what is happening to cause these infernos and how can we tackle them? Flames take hold Fires can occur naturally in woodland or brush, ignited by heat from the sun or a lightning strike. However, the vast majority of wildfires - as many as 90% worldwide - are started by humans, according to experts. The cause could be barbecue charcoal, a discarded cigarette or even arson. As long as there is fuel and oxygen available, the flames can take hold easily. Image copyright Getty Images Image caption A strong wind blows embers in California Greece had an unusually dry winter and spring this year, leaving grass and scrubland particularly flammable, says Thomas Smith, assistant professor in environmental geography at the London School of Economics and Political Science (LSE). As well as a lack of rainfall, wind also determines how devastating the fire will be, depending on its strength and direction. ""Burning embers can travel quite far and start new fires that could spread for kilometres if they are big enough,"" says Smith. Image copyright Getty Images Image caption 23 July: Dry grass burns as fire crews tackle the flames in Greece Surface fires - burning on a forest floor, for instance - tend to spread slowly and can be more easily controlled. In fact some surface fires can be good, says Cathelijne Stoof, a wild land fire expert based in the Netherlands. ""It helps plants regenerate,"" she adds. ""The problem is when the flames can climb up low level branches and get to the tops of the trees. That's when you can't stop it."" Image copyright Getty Images Image caption 15 July: Due to the dry weather, about 80 wildfires have been burning in Sweden The most dangerous part of a blaze is called the head fire, explains Thomas Smith. It is driven forward by the wind and is very difficult to fight directly because it has long flame lengths. Image copyright AFP Image caption 17 July: This aerial view provided by the European Space Agency shows smoke billowing from several fires between the west coast of Norway to central Sweden. Head fires burn with blacker smoke But it is not just wood and grass that quickly become fuel for wildfires. Nearby homes and vehicles will combust because of the materials they contain, such as plastics and rubber. Hazardous In Greece, cars in the road caught fire before the surrounding verdant trees because they were more flammable. And they did not need to be directly licked by the flames to do so. ""It comes down to the amount of energy given off by the flames,"" says Smith. ""The cars could be tens of metres away and still be close enough to ignite."" Image copyright Getty Images Image caption 24 July: Burned cars are seen following a wildfire at the village of Mati near Athens Sadly, people are often killed by wildfires as they attempt to escape. Many of the victims in Greece were trapped in traffic jams as people tried to flee as fast as possible, according to forest risk management expert Alexander Held. But this could have been avoided with better evacuation plans in place, he says. Fine fuel such as dry shrubs should be cleared away from roadsides and houses to stop flames getting close, he adds. ""This was a bomb waiting to explode."" Image copyright Getty Images Image caption 23 July: The contents of a home, including dry wooden beams, go up in flames in Greece Heat and flames are the most immediate dangers people face in a wildfire. However, smoke can also be harmful if you have an existing condition such as asthma or lung disease, or are exposed for weeks or months. Image copyright Getty Images Image caption 23 July: A road block is set up as smoke fills the air near Athens Although smoke from burning vegetation is toxic, it will usually disappear quickly. Fumes produced by burning plastic or asbestos inside homes are much more hazardous. Image copyright Getty Images Image caption 25 March: Ruins of a house are out of bounds after a bushfire in Tathra, Australia As well as changing climates, the differing land use over the centuries has led to more wildfires in Europe, according to experts. ""There used to be small agricultural fields across Europe and people would manage the land,"" says Cathelijne Stoof. ""But in the 20th Century people moved away and the land became overgrown. So when you do have a fire it spreads much more easily."" In the case of the huge fire near Saddleworth Moor in North West England, it was not just the vegetation that caught fire. Image copyright Getty Images Image caption At its peak, the fire on Saddleworth Moor covered an area of 7 sq miles (18 sq km) and burned for three weeks ""This fire definitely did get into the soil,"" says Dr Thomas Smith. The moorland is made up of peat soil, which is carbon-rich and needs little oxygen to burn, he explains. ""The fire gets underground and smoulders away.... It makes it much more difficult to put out."" Fighting fire Image copyright PA Image caption 28 June: Firefighters tackle a wildfire with beaters on Winter Hill near Bolton, UK Firefighters have a range of techniques to try to tackle a blaze by depriving it of oxygen or fuel. They need to have the right training to know which one will work the best. In the recent UK wildfires, they used beaters and water hoses to extinguish the flames. Dropping water and fire retardant containing fertiliser from planes and helicopters may also slow the spread of flames. Image copyright Getty Images Image caption 7 December 2017: A plane drops fire retardant near a home near Los Alamos Road in Murrieta, California, last December Experts say one of the most effective methods of tackling wildfires is building firebreaks by clearing vegetation. But this is ""dirty and hard work"", says Alexander Held, and not an option that is always popular in public opinion. ""You can send a lot of helicopters and planes but without crews on the ground you won't put it out,"" he insists. Cathelijne Stoof agrees on the importance of creating firebreaks: in some places firefighters will create controlled fires to draw the energy out of the blaze they are battling. And she says fire prevention and land management should be ""sexier"" than it is now. Image copyright Getty Images Image caption 21 July: Firefighters create a firebreak in the Stanislaus National Forest, near Yosemite National Park, California Teams with the right training can understand fire behaviour and choose the best way to respond, she says. But fire also behaves very unpredictably. ""It's dangerous. So I very much respect the people that put everything on the line to save others."" Image copyright Getty Images Image caption 1 July: A fire service vehicle is surrounded by flames as the Pawnee wildfire jumps across a road in California.","Deadly wildfires in Greece follow huge blazes in Sweden, the US and the UK.",2018-07-24T23:51:53Z,"{'id': 'bbc-news', 'name': 'BBC News'}",Wildfires around the world: The photos that explain the flames,https://www.bbc.co.uk/news/world-44943143,https://ichef.bbci.co.uk/news/1024/branded_news/05BB/production/_102676410_greecefirefighters.jpg,bbc-news,BBC News,wildfires,0
CHRIS STANFORD,"• Quotation of the day “In our increasingly muggy and smoky discomfort, it’s now rote science to pinpoint how heat-trapping gases have cranked up the risks. It’s a shift we all are living together.” — Katherine Mach, a Stanford University climate scientist. • The Times, in other words Here’s an image of today’s front page, and links to our Opinion content and crossword puzzles. • What we’re reading Lauren Katzenberg, our At War editor, recommends this piece from ProPublica : “Isaac Arnsdorf’s investigation reveals the disturbing influence of three private sector executives, known as the Mar-a-Lago crowd, on Veterans Affairs. (One is the Marvel Entertainment chairman, Ike Perlmutter.) These ‘shadow rulers,’ as the headline calls them, are close allies of President Trump who have been bombarding V.A. officials with demands, and who have intervened in and stalled overhauls in veteran policy for their own personal benefit.” The Sarajevo Film Festival begins today in the capital of Bosnia and Herzegovina. The red carpets, more than 200 screenings and hundreds of thousands of euros in prizes are a far cry from the festival’s origins during the siege of Sarajevo and the Bosnian War in the 1990s. Setting up for an outdoor screening at last year’s Sarajevo Film Festival. Credit Elvis Barukcic/Agence France-Presse — Getty Images In 1993, Haris Pasovic, a Bosnian director, helped organize a gathering called “Beyond the End of the World,” a title inspired by one of the screened films: “Until the End of the World,” by the German director Wim Wenders. At the time, a reporter asked Mr. Pasovic, “Why are you holding a film festival in the middle of a war?”","A plane dropped fire retardant in Lake Elsinore, Calif., on Wednesday. Scientists say climate change is making wildfires like California’s more extreme.",2018-08-10T09:50:05Z,"{'id': 'the-new-york-times', 'name': 'The New York Times'}","California, N.F.L., ‘Insatiable’: Your Friday Briefing",https://www.nytimes.com/2018/08/10/briefing/california-nfl-insatiable.html,https://static01.nyt.com/images/2018/08/10/climate/10us-ambriefing-fire-AMCORE/10us-ambriefing-fire-facebookJumbo.jpg,the-new-york-times,The New York Times,wildfires,0
https://www.facebook.com/bbcnews,"Image copyright Santa Barbara County FD Image caption The Thomas fire has the potential to be one of the worst in California's history Fresh evacuations have been ordered after the largest of the wildfires raging in southern California burned out of control on Sunday. Fanned by winds, the resurgent Thomas fire now threatens the coastal city of Santa Barbara and nearby Carpinteria. Firefighters earlier reported progress in containing the blaze, said to have devastated an area the size of Chicago. But while other fires hitting the state are largely controlled, the Thomas fire is just 15% contained. Image copyright NASA/EPA Image caption Satellite imagery shows the vast Thomas Fire, north of Los Angeles, which has spread as far as the Pacific coast ""The winds are kind of squirrely right now,"" Santa Barbara county fire spokesman Mike Eliason was quoted by the Associated Press as saying. ""Some places the smoke is going straight up in the air, and others it's blowing sideways. Depends on what canyon we're in."" Evacuation orders were issued overnight for parts of Carpinteria close to Los Padres National Forest, about 100 miles (160km) northwest of Los Angeles. Forecasters said wind speeds were expected to increase throughout the day, before dying down again overnight. The local fire department tweeted pictures of a wall of flames advancing on homes on the outskirts of Carpinteria early on Sunday morning. Meanwhile, actor Rob Lowe, who lives in Santa Barbara, a city of close to 100,000 people, tweeted that he was praying for his town as fires closed in. ""Firefighters making brave stands. Could go either way. Packing to evacuate now,"" Lowe added. California has spent the past seven days battling wildfires. Six large blazes, and other smaller ones, erupted on Monday night in southern California. Fanned by high winds, they swept through tens of thousands of acres in a matter of hours, driven by extreme weather, including low humidity and parched ground. The authorities issued a purple alert - the highest level warning - amid what it called ""extremely critical fire weather"", while US President Donald Trump declared a state of emergency. Media caption Large parts of southern California have been affected On Saturday, California Governor Jerry Brown described the situation as ""the new normal"" and predicted vast fires, fuelled by climate change, ""could happen every year or every few years"". The current fires have forced the evacuation of some 200,000 people across the state, and seen more than 800 structures destroyed. Several firefighters have been injured, but only one person has died - a 70-year-old woman who was found dead in her car on an evacuation route. There are also fears the blaze will seriously hit California's multi-million dollar agricultural industry. Media caption Drivers filmed the flames from their cars near Bel Air",Fresh evacuations are ordered as the largest of the state's wildfires burns largely uncontrolled.,2017-12-10T22:51:35Z,"{'id': 'bbc-news', 'name': 'BBC News'}",California wildfires: Santa Barbara threatened by Thomas fire,http://www.bbc.co.uk/news/world-us-canada-42303203,https://ichef.bbci.co.uk/news/1024/cpsprodpb/9726/production/_99149683_sbcfd.jpg,bbc-news,BBC News,wildfires,0
Tom McKay,"Verizon throttled the Santa Clara County Fire Department’s supposedly “unlimited” data plan while the agency was fighting the record wildfires that have burned over one million acres of the state, Ars Technica reported on Tuesday. According to the report, Santa Clara County Fire Chief Anthony Bowden brought up the throttling in an addendum to a multi-state legal brief seeking the overturn of the Republican-controlled Federal Communications Commission’s decision to throw out Barack Obama-era net neutrality rules. Bowden alleged that Verizon had throttled a SIM card connecting a fire department mobile command vehicle named “OES 5262” to 1/200th of its normal speed, putting lives and property at risk, and that the company’s support team refused to lift the restrictions until fire officials purchased a new data plan at “more than twice the cost.” Ars Technica wrote: “County Fire has experienced throttling by its ISP, Verizon,” Santa Clara County Fire Chief Anthony Bowden wrote in a declaration. “This throttling has had a significant impact on our ability to provide emergency services. Verizon imposed these limitations despite being informed that throttling was actively impeding County Fire’s ability to provide crisis-response and essential emergency services.” Bowden’s declaration was submitted in an addendum to a brief filed by 22 state attorneys general, the District of Columbia, Santa Clara County, Santa Clara County Central Fire Protection District, and the California Public Utilities Commission. The government agencies are seeking to overturn the recent repeal of net neutrality rules in a lawsuit they filed against the Federal Communications Commission in the US Court of Appeals for the District of Columbia Circuit. According to Bowden, County Fire IT staff verified the connection was being throttled, which “severely interfered with the OES 5262's ability to function effectively.” When those staff reached out and said the throttling was impacting public safety, Verizon customer support personnel confirmed they had deliberately limited OES 5262's connection, but that it would only be restored if County Fire switched to a more expensive plan and contacted the billing department. As a result, fire personnel were forced to use other departments’ service providers as well as their personal devices until County Fire paid up. Bowden wrote those personnel were deployed to help fight the Mendocino Complex Fire, the largest in the state. The Los Angeles Times reported this week that fire is extremely hazardous to the nearly 3,500 firefighters currently fighting it, with Draper City, Utah fire department Battalion Chief Matthew Burchett dying this month while trying to help contain the blaze. In general, the blazes across the state have increasingly exhibited extreme behavior like immense fire tornadoes. Adding a service provider dispute to this situation is indisputably not helpful. Bowden further alleged that Verizon knew full well what it was doing and took advantage of the situation to “coerce” County Fire into paying more: While Verizon ultimately did lift the throttling, it was only after County Fire subscribed to a new, more expensive plan. In light of our experience, County Fire believes it is likely that Verizon will continue to use the exigent nature of public safety emergencies and catastrophic events to coerce public agencies into higher-cost plans, ultimately paying significantly more for mission-critical service—even if that means risking harm to public safety during negotiations. In a statement provided to Gizmodo as well as Ars Technica, a Verizon spokesperson wrote that the company “made a mistake in how we communicated with our customer about the terms of its plan,” which was a “government contract plan for a high-speed wireless data allotment at a set monthly cost.” The spokesperson wrote that while the plan offers “unlimited amount of data... speeds are reduced when they exceed their allotment until the next billing cycle”—though they added that Verizon maintains “a practice to remove data speed restrictions when contacted in emergency situations” and the incident was a “customer support mistake.” Verizon also stated that the matter had “nothing to do with net neutrality or the current proceeding in court.” It’s true that throttling a plan that goes over its data limits isn’t a net neutrality issue per se. The Obama-era rules prohibited service providers from artificially slowing down or blocking content in a discriminatory fashion, whether it’s to limit their customers’ access to rival services or just charge extortionate fees to access certain services. But Bowden’s argument appears to be that County Fire’s experience with Verizon led him to believe they are quite willing to do just that to emergency personnel. “Please work with us,” a fire official wrote to Verizon on July 30th, according to documents filed with Bowden’s addendum. “All we need is a plan that does not offer throttling or caps of any kind.” [ Ars Technica ]","Verizon throttled the Santa Clara County Fire Department’s supposedly “unlimited” data plan while the agency was fighting the record wildfires that have burned over one million acres of the state, Ars Technica reported on Tuesday. Read more...",2018-08-22T01:25:00Z,"{'id': None, 'name': 'Gizmodo.com'}",Verizon Throttled Fire Department's 'Unlimited' Plan While They Were Fighting Mendocino Complex Fire,https://gizmodo.com/verizon-throttled-fire-departments-unlimited-plan-while-1828509356,"https://i.kinja-img.com/gawker-media/image/upload/s--eA-pecqm--/c_fill,fl_progressive,g_center,h_900,q_80,w_1600/xuigrlukcvvfq31rlkqk.jpg",,Gizmodo.com,wildfires,0
Emily Price,"In addition to the obvious fire danger, all three fires are creating a substantial amount of smoke that can pose a health and safety risk to those who live nearby, even when that nearby in a few hundred miles from where the fire is burning. In San Francisco, for instance, the smoke smell is overwhelming at points despite the fires being rather far away. Those with asthma and other breathing issues have also been advised to use face masks when they go outside and limited their exposure to the smoky air. Hundreds of thousands of people could face property damage in Southern California thanks to a Read more Read Analytics company Esri has created two interactive maps to help people track the progression of the fires. Originally spotted by Fast Company, there are two maps: one showing real-time traffic information so if you need to evacuate you can determine the best route, and another showing a smoke forecast for the next 48 hours in the impacted areas. The smoke forecast uses information from The National Weather Service and can give those nearby a little insight into what the air outside might look like for the next few days. If you arent near the fires but just want to take a look at them, NASA released some pretty epic images this weekend showing the fires from space. The fires are already responsible for 11 deaths and a significant amount of property loss and damage across California.","In addition to the obvious fire danger, all three fires are creating a substantial amount of smoke that can pose a health and safety risk to those who live nearby, even when that “nearby” in a few hundred miles from where the fire is burning. In San Francisco…",2018-11-10T23:37:00Z,"{'id': None, 'name': 'Lifehacker.com'}",Get Real-Time Smoke Reports From the California Wildfires Using These Maps,https://lifehacker.com/get-real-time-smoke-reports-from-the-california-wildfir-1830362443,"https://i.kinja-img.com/gawker-media/image/upload/s--Cmi1Nv0C--/c_fill,fl_progressive,g_center,h_900,q_80,w_1600/rppy18a13t88qnxbeswe.png",,Lifehacker.com,wildfires,0
