author,content,description,publishedAt,source,title,url,urlToImage,source_id,source_name,types,yes_disaster
https://www.facebook.com/bbcnews,"Image copyright Getty Images Image caption People across northern California are snapping up masks to try to handle the smoke Northern California's air quality has become the worst in the world, according to monitoring groups, as the state battles devastating fires. Air quality network Purple Air said on Thursday the air is now worse than smoggy cities in India and China. Schools have cancelled classes, flights have been delayed, and internet searches for smoke masks are soaring. At least 63 people have died in the Camp Fire - the state's deadliest and most destructive blaze. The number of missing people has jumped to more than 600, local authorities said, doubling the size of the list in a day. Three more people have also died in the Woolsey Fire, further south. President Donald Trump will travel to California on Saturday to survey the damage and meet those affected. The Camp Fire - which broke out eight days ago - swept through a swathe of the north at high speed, leaving residents little time to escape. How bad is the air? The AirNow website ranks the air around San Francisco and Oakland as ""very unhealthy"", meaning everyone in the area could experience more serious health effects. Around Elk Grove and Sacramento, it is classed as ""hazardous"" - the whole population is likely to be affected, their website states. A San Francisco Chronicle reporter tweeted that breathing in San Francisco was equivalent to smoking nearly a dozen cigarettes. In Paradise, which was destroyed by the wildfire, it is closer to smoking 22 cigarettes. Internet searches for smoke masks have reportedly skyrocketed, while schools and universities have cancelled classes and held recesses for students inside. Flights have also been affected. Health officials warned people to stay indoors rather than risk the smoke. ""Wearing a mask may encourage outdoor activity when staying indoors is the best way to minimize exposure to smoke,"" the Sacramento County Public Health Office said Butte County released advice for residents about how to handle the poor air quality. What's the latest on the firefighting operation? The California Fire Department says it has now contained about 45% of the Camp Fire blaze. Officials say they do not expect to fully contain the blaze - which has razed 145,000 acres (56,600 ha) - until the end of the month. Media caption California wildfires survivor's tearful account of escape with son They are also battling several other fires, including the Morgan Fire in Contra Costa County, near San Francisco, the Woolsey Fire in Ventura County near Los Angeles and the smaller Hill Fire, also in Ventura County. The worst-hit area is the town of Paradise, with officials saying it will need a ""total rebuild"" job that will take several years. Brock Long, administrator of Federal Emergency Management Agency (Fema), said the damage to Paradise was ""one of the worst disasters"" he had ever seen. Military troops are assisting forensics teams and cadaver dogs as they continue to search for human remains. Officials have warned the search operation could take weeks. Why are the fires burning? Officials have not yet confirmed what started any of the blazes, as investigations are continuing. Several people have already filed a lawsuit against a local power company, alleging that the Camp Fire started when a high-voltage transmission line failed. Historically, California's ""wildfire season"" started in summer and ran into early autumn - but experts have warned that the risk is now year-round. Low humidity, warm winds, and dry ground after a rain-free month have produced a prime fire-spreading environment. What about climate change? Prof David Peterson of the University of Washington, a former senior researcher with the US Forest Service, told the BBC there is no hard evidence that climate change has affected US wildfires - yet. ""We expect that there will be significant effects in future decades as the climate continues to warm,"" he said. A warming climate, Prof Peterson explained, would increase the duration of the fire season, and more droughts would in turn create more wildfire fuel. Globally, the length of the wildfire season has already increased by nearly 19% between 1978 and 2013. ""By around 2050, fires may burn two to three times more area than they have historically."" As fire seasons worsen worldwide, all the carbon released as smoke into the atmosphere could have a serious impact on climate change, according to the National Aeronautics and Space Administration (NASA). Have you been affected by the wildfires? If it is safe to do so please get in touch. Email haveyoursay@bbc.co.uk. Please include a contact number if you are willing to speak to a BBC journalist. You can also contact us in the following ways: WhatsApp: +44 7555 173285 Tweet: @BBC_HaveYourSay Send pictures/video to yourpics@bbc.co.uk Or Upload your pictures/video here Text an SMS or MMS to 61124 or +44 7624 800 100 Please read our terms &amp; conditions and privacy policy",The air quality in northern California has plummeted as devastating fires continue to blaze.,2018-11-16T19:38:47Z,"{'id': 'bbc-news', 'name': 'BBC News'}",California wildfires: Air quality rated 'world's worst',https://www.bbc.co.uk/news/world-us-canada-46242253,https://ichef.bbci.co.uk/news/1024/branded_news/13549/production/_104377197_gettyimages-1062031374.jpg,bbc-news,BBC News,wildfires,0
"Anna Merlan on Earther, shared by Harrison Weber to Gizmodo","This month, California has been gripped by three devastating wildfires: Northern Californias Camp Fire, which recently became the deadliest in the states history, and, in Southern California, the Woolsey and Hill Fires. An emerging, deeply weird conspiracy theory holds that those fires arent caused by wind patterns, brutally dry conditions, the worsening effects of climate change, or possible downed power lines, but by a sinister scheme directed by nefarious elements within the government. The claim, being taken up by an increasing number of people in QAnon circles, is that the fires are caused by directed energy weaponsthat is, government-directed lasers bent on destroying homes, property, and lives. And if recent history is any judge, theres a chance the countrys biggest conspiracy-peddlers, up to and including the one who lives in the White House, will take up the cause. Directed energy weapons, or DEWs, have an interesting place in conspiratorial circles. DEWs are, to begin with, a real technology, but one still in its infancy: a report produced for Congress describes that term as an umbrella to refer to technologies that produce concentrated electromagnetic energy and atomic or subatomic particles. The consensus is that there are a number of logistical issues to work out before that the U.S. government will be able to build a laser system that would actually be workable on a battlefield, but that the Department of Defense and private contractors are eager to leverage laser power towards killing people and/or destroying enemy missiles, aircrafts, or satellites. If you ask people in the deep end of the conspiracy theory pool, though, DEWs are here already. Theres a small body of people who believe themselves to be targeted individualsstalked, harassed, and attacked by the government or other shadowy groupsand at least some of them believe those attacks are being carried out by DEWs. Now, through a strange confluence of forces, the paranoia over DEWs is making its way into the discussion about natural disasters. What were seeing is a convergence of longstanding American fears about government mind control and manipulation of the weather merging with climate change skepticism, as climate science becomes ever-more-politicized. Like many conspiracy theories, its not entirely possible to trace where the DEW theories came from. As best I can tell, one of the earliest promoters of that claim was a flat-earth YouTuber going by the name ODD Reality (real name Matt Procella), who started talking about DEWs during the devastating wildfires that raged across California in October 2017. Youll notice here that stores and restaurants are wiped out, while other things are still in perfect shape, Procella intones, over still images of fire damage, some of them sourced, he says, from a Serbian conspiracy site (and some of which appear to be computer-generated). Other buildings are fine, trees are untouched, but specific structures are just devastated. You gotta ask yourself, whats up with that... Is this the result of direct energy weapons? Ranged weapons that inflict damage on a target by emitting highly-focused energy? The answer is most likely yes. Theres actually a fair amount of research to explain why some structures are destroyed and some are spared during a wildfire that has nothing to do with laser weapons. But the broader point Procella is trying to make is about intent: Someone is deliberately destroying certain buildings. That point, though, gets a little mushy. He speculates that all these things are a distraction from the Vegas incident, by which he means the mass shooting in Las Vegas that month that killed 58 people. Elsewhere, the question of why the government would spend its time pointing lasers at peoples houses and Burger Kings has been made somewhat clearer. The left-leaning March Against Monsanto site, which often engages in conspiracy theorizing about GMOs, ran a speculative article about DEW s, reasoning that they could be just another form of government manipulation. People who believe in chemtrails are also concerned about DEWs, and have a more fully fleshed-out explanation for what theyre meant to do. (Chemtrails are harmless condensation trails left by aircrafts, but since the late 1990s, a conspiratorial community has been raising concerns that theyre actually toxic, potentially mind-controlling chemicals.) On one chemtrail-oriented site, Chemtrail Planet, an unnamed author speculates that last years fires were part of a joint plan by FEMA and the United Nations to institute more centralized global control, what they called Agenda 30. The United Nations 2030 Agenda for Sustainable Development is actually a resolution passed in 2015 by the General Assembly, promising to do a host of things to make the world better by 2030, including taking urgent action on climate change. Like every UN action, conspiracy theorists claim its mean to institute a centralized one-world government, and like always, that is not true. Theres also evidence that DEWs are becoming part of the cosmology of the QAnon crowd, a remarkably pliant group who have proven that theyre able to incorporate just about anything into their belief system. (QAnon, for the uninitiated, is the conspiracy theory that Donald Trump is secretly doing a really good job, and is this close to uncovering and disarming various evil forces working against him within the government.) The hashtag #DEW has begun to show up in QAnon-oriented Twitter conversations, with several much-retweeted Tweets imploring Trump to take action. Yet another version of the DEWs story claims that the wildfires were directed in such a way to destroy structures in order to make way for a high-speed rail system, part of a Democrat plot. Thats right: the government is destroying vast swaths of trees, houses and infrastructure to force people to ride the train. That tweeted idea is also tagged with several QAnon-related hashtags. Inevitably, the conspiracy theory is migrating to bigger and bigger accounts. On Thursday, a far-right internet personality and QAnon booster named Mike Tokes, who has 170,000 Twitter followers, aggressively took up the cause, using the same line of argument: some homes burned, others didnt, thus lasers must be at work. The DEW theory is inextricably tied to skepticism about the very idea of climate change, a sense that global warming is just the cover explanation for the various sinister plots at work against us. Its also, of course, tied to longstanding conspiracy theories about the government controlling the weather, such as the idea that the government already has a weather control tool called HAARP, which it also uses for electromagnetic warfare. (HAARP is actually a much less exciting research program that studies the uppermost levels of our atmosphere and was years run by the Air Force and University of Alaska Fairbanks. Since 2015, UAF has run it alone, albeit on Air Force land, and has produced a very patient FAQ explaining that HAARP does not exert mind control over people.) Weather and climate conspiracists are, though, not a big group of people, says John Cook, a research assistant professor at the Center for Climate Change Communication at George Mason University who also runs a site called Skeptical Science that outlines the shoddy science and arguments behind global warming skepticism. Climate change conspiracy theories may seem more popular but theyre still very marginal, Cook told Earther. The proportion of the US public who are dismissive about climate change is about nine percent. You dont want to overstate their importance because that can have a negative effect. That said, there may well be a broader swath of the public that is open to conspiracy theories and denialism, if not hardcore about them. For instance, a survey on chemtrails from last year that found up to 30 percent of people polled thought they may be somewhat real. And recent polls show most U.S. Republicans still believe global warming concerns are exaggerated, and that the partisan divide on the issue is growing. Climate change skepticism and other, more out-there forms of conspiracy theorizing about the weather have a few things in common, Cook said. There is a similarity in that its trying to make sense of disturbing events by imaging these patterns. But theres also an important distinction. Climate conspiracy theories tend to be an attempt to explain why theres a scientific consensus on climate change, usually by invoking a vast conspiracy among the worlds climate scientists. Whereas space laser wildfires arekind of Cook paused for a moment, politely. Theyre an isolated single event thing, he finished. As opposed to a more systematic, holistic explanation of the whole climate. Social media, particularly Twitter, has inarguably helped the spread of conspiracy theories about the climate, Cook said. He and his colleagues have studied how to inoculate people against misinformation (and even made a handy video about it), but he admits its an uphill battle. Its difficult, he said. Conspiracy theories are the hardest thing to counter. Theyre so nihilistic, and any attempt to rebut them is seen as more evidence of the conspiracy theory. But the general rule is the way to counter the myth is to replace it with a stickier fact. One issue, Cook said, is that conspiracy theories can cause people to shut down and stop looking for whats true: Theres a danger that theyll disengage and just stop believing in facts. And the facts are plenty terrifying on their own: These fires have already been hellaciously destructive, the deadliest in a century or more, with at least 63 people dead in the Camp Fire alone, three more killed in the Woolsey fire, more than 600 missing, thousands of acres burned, homes destroyed and lives devastated. The president is already engaged in smears and misinformation, bizarrely claiming that forest management was to blame for fires that didnt even originate in forests. Though the causes of the fires are still under investigation, theres evidence that a downed PG&amp;E power line could have potentially sparked the Camp Fire. Theres evidence that public policy and regulation simply arent working, given that PG&amp;E electrical equipment was found responsible for 17 of 21 wildfires in Northern California last fall, and that climate change is only making the situation worse. And theres deep inequality at work, given that working-class communities like Paradise are all but destroyed, while wealthier areas are able to hire their own firefighters to battle the blazes. This post was produced by the Special Projects Desk of Gizmodo Media. Email us at tips@gizmodomedia.com, or contact us securely using SecureDrop. And if those facts arent deemed worthy of engagementif people instead retreat into fantasy and rumor and innuendotheres the fact that the next fire isnt far away. Its simply waiting for its spark.","This month, California has been gripped by three devastating wildfires: Northern California’s Camp Fire, which recently became the deadliest in the state’s history, and, in Southern California, the Woolsey and Hill Fires. An emerging, deeply weird conspiracy …",2018-11-16T17:14:00Z,"{'id': None, 'name': 'Gizmodo.com'}",California's Wildfires Have Spawned a Truly Weird New Conspiracy Theory,https://earther.gizmodo.com/californias-wildfires-have-spawned-a-truly-wild-new-con-1830418656,"https://i.kinja-img.com/gawker-media/image/upload/s--cF1dZEtl--/c_fill,fl_progressive,g_center,h_900,q_80,w_1600/tzffl4dwlrhpjeimtoud.jpg",,Gizmodo.com,wildfires,0
JEAN RUTTER and MARCUS PAYADUE,"5. The high cost of poor handwriting. As the Florida Senate race looks to be headed to a hand recount, a judge ruled to give voters with sloppy penmanship a second chance. Thousands of ballots were invalidated because voters signatures didnt match signatures on file. Now theyll have a little more time to confirm their identities. There are dozens of reasons a signature mismatch may occur, the judge explained. And indeed, one study found that younger voters were more likely to have their mail-in ballots rejected partly because they didnt use handwriting enough to develop a steady signature. Above, preparing for a recount in Palm Beach, Fla. In the race for governor, Ron DeSantis, the Republican candidate, appeared to have enough votes to avoid an additional recount. By the end of the day, he led Andrew Gillum, the 39-year-old Democratic mayor of Tallahassee, by a margin of 0.41 percentage points. About a dozen lawsuits have been filed in efforts to extend deadlines, impound equipment and count mailed ballots that were rejected. _____",Here’s what you need to know at the end of the day.,2018-11-15T23:15:55Z,"{'id': 'the-new-york-times', 'name': 'The New York Times'}","California Wildfires, Brexit, Yellowstone: Your Thursday Evening Briefing",https://www.nytimes.com/2018/11/15/briefing/california-wildfires-brexit-yellowstone.html,https://static01.nyt.com/images/2018/11/15/briefing/c-5PMBRIEFING-US-core/15PMBRIEFING-US-SLIDE-SHO-slide-UEMO-facebookJumbo.jpg,the-new-york-times,The New York Times,wildfires,1
JEAN RUTTER and HIROKO MASUIKE,"3. President Trump is considering firing Kirstjen Nielsen, the secretary of homeland security, in a major shuffle of his cabinet and West Wing staff, our reporters learned. Ms. Nielsen, above, has long been a target of the president, who has criticized her for being ineffective in implementing his administrations zero tolerance immigration policies. Other shake-ups could be in store, including the renewed possibility that Mr. Trump might push out John Kelly, his chief of staff and Ms. Nielsens old boss. And Mira Ricardel, a foreign policy hard-liner who had been serving as a deputy to the national security adviser, was expected to be dismissed after running afoul of Melania Trump. It is the position of the office of the first lady that she no longer deserves the honor of serving in this White House, a spokeswoman said.",Here’s what you need to know at the end of the day.,2018-11-13T23:00:33Z,"{'id': 'the-new-york-times', 'name': 'The New York Times'}","California Wildfires, Amazon, Midterms: Your Tuesday Evening Briefing",https://www.nytimes.com/2018/11/13/briefing/california-wildfires-amazon-midterms.html,https://static01.nyt.com/images/2018/11/13/briefing/111318briefing-evening-promo/111318briefing-evening-promo-facebookJumbo.jpg,the-new-york-times,The New York Times,wildfires,1
