author,content,description,publishedAt,source,title,url,urlToImage,source_id,source_name,types,yes_disaster
Jon Evans,"The ICO regulators are here, and they’re carrying big sticks. (PDF) “Coins or other digital assets issued on a blockchain may be securities under the federal securities laws… tokens were securities as defined by Section 2(a)(1) of the Securities Act because they were investment contracts … An investment contract is an investment of money in a common enterprise with a reasonable expectation of profits to be derived from the entrepreneurial or managerial efforts of others.” What does this mean, exactly? I’ll let people who have actually passed the bar decode it for you. Here’s a thread from Marco Santori, fintech team leader of Cooley Law: 1/ OK HERE WE GO. Today, the SEC today confirmed some of our suspicions about utility tokens. I’ll summarize here in this thread. https://t.co/MI66jV4g27 — Marco Santori (@msantoriESQ) December 11, 2017 And, as you might expect, many of the serious thinkers in the blockchain space (yes, they exist) have greeted this governmental intrusion with … actually … cautious relief. OK, you might not have expected that, but it’s true. Everybody saw it coming, so it’s a relief to finally get it over with; and the ICO space has become such a get-rich-quick shitshow, so full of empty promises, that precipitating what John Biggs calls “the coming avalanche of ICO failures,” while achieving some legal clarity, seems like a good-case scenario. This is reportedly even more true in China, which has banned ICOs ouright — and according to Emily Parker, “everyone I spoke to in China’s cryptocurrency community supported, or was at least sympathetic to, the ICO ban. I repeatedly heard that 90 percent of Chinese ICOs were scams. The whole model, in which you buy tokens to use on a platform that does not yet exist, might never exist, or could be a total flop, can be a magnet for fraudsters.” That is no less true outside of China. But pointing accusatory fingers at risible ICOs is almost too obvious, and too easy, and there are too many to choose from. Let’s not dwell on stupid greed or greedy stupidity or valuations. The blockchain revolution was not supposed to be about getting rich. Stop laughing. I’m not kidding. And neither is wunderkind Ethereum creator Vitalik Buterin, reflecting on what he has wrought (click through to read the whole thread): So total cryptocoin market cap just hit $0.5T today. But have we *earned* it? — Vitalik Buterin (@VitalikButerin) December 13, 2017 or Brave engineer Yan Zhu: most of these people are too technologically myopic to imagine something better than both BTC &amp; traditional currency. people used to care about cryptocurrency because they wanted to solve problems that couldn't be solved by existing systems, now they just want to make money. https://t.co/znp8ufM93R — yan (@bcrypt) December 9, 2017 Wasn’t the idea to decentralize the power of networked technology, and programmable money, from banks and governments to the ignored masses — rather than adding maybe a few thousand people to the world’s Very Rich List? If your ICO is going to make a handful of people rich, then it’s not actually very decentralized, is it? That’s not part of any kind of brave new world. That’s actually incredibly boring. This is all a moot point for today, though. The real reason that the SEC is right to regulate ICOs as securities is that, with very few exceptions, today’s ICO tokens are almost definitionally speculative … because public decentralized blockchain technology is not yet ready for prime time for anything other than low-volume transfers of value, with some programmatic control. It’s technically and socially and economically utterly fascinating, don’t get me wrong, and it has a very bright future ; and, sure, cryptocurrencies are having a surreal / spectacular run as a store of imputed value, i.e. the thing blockchains are currently good at. But we aren’t going to see any big-money fat-protocol applications, or any decentralized people’s revolution either, until and unless the technology gets much easier and cheaper to use — for both end users and developers like me. It is pretty remarkable that people have imputed tens of billions of dollars of value to a technical ecosystem so immature that it can't handle functions which return arrays of structs. https://t.co/Xt5y1WNRzf — Jon Evans (@rezendi) December 15, 2017 That will happen. But not right away. And in the interim, people are making huge bets on entire classes of technology that carry a real risk of being obsoleted before they’re so much as alpha launched, if they ever alpha launch, much less before ordinary users ever even try them in real numbers. Everyone loves comparing blockchain protocols to the early days of computing and the Internet, so here’s another analogy: today’s ICO investors are bidding billions to own pieces of gopher, FTP, and X.400. Which is fine — even admirable, in a way — as long as the craze to get rich now doesn’t get in the way of cooler heads inventing/upgrading to HTTP and SMTP over the next few years. Here’s hoping.","The ICO regulators are here, and they’re carrying big sticks. (PDF) “Coins or other digital assets issued on a blockchain may be securities under the federal securities laws… tokens were securities as defined by Section 2(a)(1) of the Securities Act because t…",2017-12-17T14:00:28Z,"{'id': 'techcrunch', 'name': 'TechCrunch'}",ICO-lateral damage,https://techcrunch.com/2017/12/17/ico-lateral-damage/,https://tctechcrunch2011.files.wordpress.com/2017/12/collateral-damage.jpg,techcrunch,TechCrunch,damage,0
Lily Hay Newman,"On Monday evening, the White House released an order instructing the Department of Justice and the Office of the Director of National Intelligence to declassify excerpts from an array of documents related to special counsel Robert Mueller's investigation into Russian interference. He has every legal right to do so. But national security analysts and former intelligence officials say that such a demand isn't just largely unprecedented; it's potentially dangerous. The Trump Administration said Monday that the disclosure was ""for reasons of transparency"" and was ""at the request of a number of committees of Congress."" The affected documents include certain pages of the Foreign Intelligence Surveillance Act application related to former Trump foreign policy aide Carter Page, and a number of FBI interview reports related to the Page FISA application and larger Russia investigation. President Trump has been fixated for more than a year on proving that a wiretap of Page—after he left the Trump campaign—was part of a partisan effort to undermine his candidacy. ""The damage that is done is something that’s going to continue for several years."" Jeffrey Ringel, The Soufan Group Additionally, Monday's White House order includes the public, unredacted release of a trove of text messages ""relating to the Russia investigation"" sent from and between former FBI director James Comey, former deputy FBI director Andrew McCabe, former FBI agent Peter Strzok, former FBI lawyer Lisa Page, and current Justice Department official Bruce Ohr. A more recent fixation of President Trump's, Ohr's wife has worked as a Russia analyst and contractor for the same intelligence firm that commissioned the infamous Steele dossier. Though the White House has demanded specific pages from the Page FISA application, its other requests potentially cast a wide enough net to potentially expose law enforcement and intelligence methods and sources. ""I do not recall anything like this happening in the past,"" says Jeffrey Ringel, director at the intelligence consultancy The Soufan Group, who spent 21 years as a national security specialist at the FBI. ""Emails and text messages of investigators have been pulled into court previously by defense attorneys, but this would be much more broad and public. If law enforcement guaranteed that my identity would be kept secret as part of a deal, and then that bond is broken, it makes people lose faith in the system. The damage that would be done is something that’s going to continue for several years."" Monday's White House order came in the form of a press release rather than a formal directive, potentially leaving the DoJ and ODNI room to interpret it as a discretionary request for review, rather than a nonnegotiable command. That could help limit the fallout, if so. ""When the President issues such an order, it triggers a declassification review process that is conducted by various agencies within the intelligence community, in conjunction with the White House Counsel, to seek to ensure the safety of America's national security interests,"" a Department of Justice spokesperson said in a statement. ""The Department and the Federal Bureau of Investigation are already working with the Director of National Intelligence to comply with the President's order."" Taken at face value, though, the request concerns former intelligence operatives. ""It really depends on how this is executed,"" says David Kennedy, CEO of TrustedSec and founder of the threat tracking firm Binary Defense, who formerly worked at the NSA and with the Marine Corps' signal intelligence unit. ""If there is the ability to blow intelligence sources, show inner workings of how information is collected, or anything that could damage the intelligence community, then this is really bad. What worries me is FISA docs are usually top secret, and methods of collection and evidence are in there. But if this is purely communications that don't reveal too much, then it might not be too damaging."" But while personal communications could potentially be revealed without a major impact on national security, so much haphazard declassification could still have collateral impacts on individual privacy. Complicating the interpretation of the White House order is the question of whether the Trump Administration only requested specific pages from the FISA application to protect law enforcement sources and methods on other pages, or whether it's selectively excluding information that validates the FBI's Carter Page wiretap. Given how Trump associate Devon Nunes has misled the public about key aspects of the FISA application, hopes aren't high. ""There are obvious privacy and investigative reasons that you might legitimately not want to publish certain pages,"" says Julian Sanchez, a national security-focused research fellow at the Cato Institute. ""But the problem with the incomplete way information has been dribbling out is that it might also be that that stuff confirms the utility of the surveillance. It's an issue of selective disclosure and the potential to support a narrative through omission."" Which is a shame, because there's an argument to be made that the FISA process really is too secretive. Selectively declassifying self-serving information, though, doesn't achieve that end. ""On the one hand I would love to see the FISA process generally be more transparent,"" Sanchez says. ""But it's clearly a terrible precedent for the White House to be picking and choosing specific investigations that personally affect the president. There are reasons that the White House is not in a position to weigh the equities impartially or expertly."" ""It's clearly a terrible precedent for the White House to be picking and choosing specific investigations that personally affect the president."" Julian Sanchez, Cato Institute Democratic Senator Mark Warner of Virginia, the vice chairman of the Senate Intelligence Committee, told reporters on Tuesday that he has already seen a more complete version of the Page FISA application, and that he also worries about selective disclosure and the larger, long-term ramifications of this White House move. ""I worry not just in terms of precedents it sets for this investigation, but I also worry about the men and women of our intelligence community whether they think some future president at the drop of a hat may decide to disclose contacts, information,"" Warner said. It also, in turn, could make allies less willing to work with the US, if they thought their own classified efforts could be exposed on a whim. The full scope of the situation won't be clear until ODNI and the DoJ determine what to actually disclose based on the White House demand. But the request alone sets a precedent to at least attempt the same tactic in the future, and perhaps double down on it if the results aren't to their liking. ""The President of the United States should not be involved at this level in an ongoing investigation,"" the Soufan Group's Ringel says. ""This may be good for President Trump this week, but in the long term it’s going to have detrimental effects, because faith in the system has been weakened."" More Great WIRED Stories",Trump has the legal right to make public whatever documents he chooses. But he's going to cause untold damage in the process.,2018-09-18T21:06:27Z,"{'id': 'wired', 'name': 'Wired'}",The Collateral Damage of Trump's Extreme Declassifications,https://www.wired.com/story/trump-declassify-documents-national-security/,https://media.wired.com/photos/5ba036249c21992d8a957128/191:100/pass/PresDonaldTrump_18260700973102.jpg,wired,Wired,damage,0
"Michelle Woo on Offspring, shared by Michelle Woo to Lifehacker","You’re not just getting old. Today’s toys are too damn loud. This isn’t simply an annoyance that drives many parents to either break out the hammer, or drink—prolonged exposure to high decibel levels can be dangerous for kids, and may even cause long-term hearing loss. All toys are required to meet the American Society of Testing and Materials’ “acoustic standard,” which states that the sound-pressure level of a toy must not exceed 85 decibels at a distance of 50 centimeters. Go above 85 decibels and you’re entering a danger zone. ( A vacuum is about 80 decibels.) The thing is, kids get much closer than 50 centimeters to their toys. Arm’s length is about 25 centimeters (or 10 inches), and any parent who’s watched their kid fall in love with a plastic Spider-Man knows they will often cuddle it, sleep with it, and maybe even lick the thing once in a while. The Sight &amp; Hearing Association has been making this point for years and puts out an annual Noisy Toy List, which I appreciate a lot. It includes toys that are louder than 85 decibels at testing distances that make more real-world sense—zero inches and 10 inches. Browsing through the latest list from 2017, I noticed several popular toys that my kid oooohs at every time she sees them on store shelves. You may have seen them, too. Here are the top 10 offenders: 0 inches: 96.7 dB 10 inches: 89.4 dB 0 inches: 96.3 dB 10 inches: 85.6 dB 0 inches: 93.9 dB 10 inches: 88.3 dB 0 inches:93.8 dB 10 inches: 79.2 dB 0 inches: 93.8 dB 10 inches: 88.1 dB 0 inches: 92.4 dB 10 inches: 88.3 dB 0 inches: 91.2 dB 10 inches: 79.6 dB 0 inches: 91.0 dB 10 inches: 79.6 dB 0 inches: 90.8 dB 10 inches: 83.1 dB 0 inches: 90.6 dB 10 inches: 87.3 dB See the full list here. Hearing loss develops over time, so don’t panic if your kid has played with one of these toys before. But do know how important it is to protect young ears. If you think a toy is too loud, you can test it with a sound level meter app like Sound Meter or, as the Sight &amp; Hearing Association points out, you can just trust your own ears. If it’s too loud for you, it’s too loud for your kid. Get rid of the toy, or if you really don’t want to part with it, muffle the sound by putting water-proof tape or super glue over the speaker. Or, you know, just take the batteries out.","You’re not just getting old. Today’s toys are too damn loud. This isn’t simply an annoyance that drives many parents to either break out the hammer, or drink—prolonged exposure to high decibel levels can be dangerous for kids, and may even cause long-term hea…",2018-05-04T20:00:00Z,"{'id': None, 'name': 'Lifehacker.com'}",These Popular Toys Could Seriously Damage Your Kids' Hearing,https://offspring.lifehacker.com/these-popular-toys-could-seriously-damage-your-kids-hea-1825782467,"https://i.kinja-img.com/gawker-media/image/upload/s--trG8iXSr--/c_fill,fl_progressive,g_center,h_900,q_80,w_1600/yxxp3ibau1k6vnmqnlbh.png",,Lifehacker.com,damage,0
Vijith Assar,"When the blockbuster twin security exploits known as Meltdown and Spectre appeared in early 2018, Mozilla was among the first to respond, retroactively changing several behaviors of Firefox to help prevent them. Both attacks rely on using high-speed timing measurements to detect sensitive information, so somewhat counterintuitively, the patches had to decrease the speed of seemingly mundane computations. The first change was to slow down the performance API for web browsers, which had previously been able to analyze the behavior of a page at speeds fast enough to be used in an attack; the second change removed SharedArrayBuffer, a new kind of data structure atop which similar timers could be trivially rebuilt. Similar changes were also soon also implemented by Microsoft for Internet Explorer and Edge browsers and also by WebKit, a tool for viewing the web that is used to build Safari, Mobile Safari, Android Browser, and the dedicated browsers embedded on many other devices. As of this writing, SharedArrayBuffer is now disabled in all major browsers. The speed and power of our computers until now has always been a lie, built atop a foundation that must now be undone. Backpedaling on established features of the internet was necessary, but also strange and unexpected. The web is, among other things, a decentralized specification: It is an agreement about how to build things, and then also how to run the things that have been built. In order for a new feature to meaningfully exist on the web, developers and browsers and standards bodies must all first come to an understanding about how it will work. Once you add something to that agreement, you can't remove it, because you have no idea what problems might arise, or even in which far-flung corners they may appear. In contrast, technology systems and programming languages that operate in narrower contexts—on a specific server, for example, or inside a specific app—can successfully withstand more dramatic changes to their behaviors. Any upgrade-related malfunctions are localized, and accordingly easy to fix. There are no such promises with a distributed web, though, so its technologies have always evolved in ways that maintain backwards compatibility. This is why old web pages pretty much always to work in newer browsers. Spectre forced browsers to finally break the compatibility covenant of the web. It's entirely likely that no meaningful projects relying on those features even exist, and even if they do, there may still be simple, safer workarounds. Nonetheless, such a prominent episode in which the internet broke its own code retroactively comes with a cost, at least ideologically. The web can't quite be trusted as an infallible platform to the extent it had been. Breaking Changes There's a common practice in software engineering called semantic versioning, whereby the officially published new releases of software tools and packages are given slightly complex version numbers—think the more nuanced ""version 2.4.1"" instead of moving straight to ""version 3""—so that shifts to the largest numbers can indicate to both users and automated systems that something important has changed. The system might no longer work the same as it did previously. These are referred to as ""breaking changes,"" and they serve as safety checks, or at least warning flags. We don't know how widespread the impacts were, but the patches made to web browsers to help protect against Meltdown and Spectre do meet the technical definition of breaking changes for the entire web. Of course, by now the web is far too old and chaotic to be subject to any versioning or planning whatsoever. That's precisely why, until now, it had always opted to safely preserve backwards compatibility. Both Meltdown and Spectre are caused by the widespread use of a technique called ""speculative execution"" in which processors eagerly and proactively execute instructions even before they are actually needed by the program. The speculatively computed material is then faster, but the primary discovery of Meltdown and Spectre was that it is insufficiently secured, and thus provides a way to leak sensitive information. Meltdown most notably affects Intel hardware in which the speculative execution was previously assumed to be safe, and attempts to disable it at the software level can have a marked performance cost. This is not just about sluggish laptops— many cloud service providers charge clients varying rates that reflect the computational burden of the contract, so Meltdown and Spectre may show up as an increase in technical budgets, paid out as a literal dollar amount to services that now have to run more slowly as a result of the patch. The only real fix for Meltdown is to eventually physically replace all the chips, a change which will take at least a full hardware generation to propagate. Spectre is more sophisticated, and may have no real fix at all. We might not have realized it until recently, but the speed and power of our computers until now has always been a lie, built atop a foundation that must now be undone if we also want to remain safe. Beyond Bits Responding to Meltdown and Spectre required immediately decreasing the speeds of both processors and online timing measurements, thereby reversing advances we thought we'd made both in hardware and with the general sophistication of the web as a platform. Disruptive ideas can likewise attain a pace that manifests outside the silicon: In New York, Uber's reach and market dominance emerged fast enough to capitalize on the ongoing financial struggles of the subway system, and Airbnb's alongside the rising barriers to home ownership for the modern middle class. We had quite literally been racing toward something terrible. Even if Intel wouldn't quite agree that Moore's law is over, its real-world performance benefits may be substantially erased after Meltdown and Spectre are tamed. The long-standing computing trope that should be even more concerning in this context, however, is ""it's all just ones and zeroes."" We're not just talking about bits once those bits drive our robots, drones, 3-D printers, and soon our autonomous vehicles. New technologies now often manifest in the real world, since for now that is still where most of the money is, but even Bitcoin melts the polar icecaps. On the mind-boggling cosmic scale, these exploits will affect our ability to create and edit organisms, but on a more tangible level, they also decreased the operational speeds of both processors and online timing measurements, thereby reversing advances we thought we'd made both in hardware and with the general sophistication of the web as a platform. In both fields, we had quite literally been racing toward something terrible. We’ve built technology too quickly for our own good, quantifiable now in dollars and microseconds, using a wide range of tools and metrics even though of SharedArrayBuffer is no longer around to take the meassurements. Anything that seeks to reshape the infrastructure built by our past selves should deserve our most aggressive scrutiny, regulation, and suspicion. If backtracking overeager technology is already proving so catastrophic for the cheap chips in our laptops and phones, then we certainly have no hope of reversing its changes to our homes, cities, and oceans. Some things can't be patched or safely versioned. We just have to get it right the first time. More Meltdown",Spectre fixes forced browsers to break the compatibility covenant of the web. Other unchecked technologies could cause even deeper damage.,2018-03-18T11:00:00Z,"{'id': 'wired', 'name': 'Wired'}","Meltdown, Spectre, and the Costs of Unchecked Innovation",https://www.wired.com/story/meltdown-spectre-costs-of-unchecked-innovation/,https://media.wired.com/photos/5aac58c4f156f371db608f2e/191:100/pass/MeltdownSpectreProgress-FA.jpg,wired,Wired,damage,0
