author,content,description,publishedAt,source,title,url,urlToImage,source_id,source_name,types,yes_disaster
Stefanie Duguay,"As of Dec. 17, Tumblr will no longer allow “ adult content,” defined as that which shows “real-life human genitals or female-presenting nipples, and any content — including photos, videos, GIFs and illustrations — that depicts sex acts.” Before this, the platform’s lenient policies contrasted significantly with those of Facebook and Instagram, which have stricter content moderation guidelines. This update follows the removal of Tumblr’s app from Apple’s app store after child pornography was found on the platform. However, it also reflects broader changes following Verizon’s acquisition of Yahoo, Tumblr’s parent company. Katrin Tiidenberg, a researcher who has studied self-expression on Tumblr, conjectures that this change may have more to do with advertising sales than protecting users. Regardless of Tumblr’s motives, this update will seriously affect LGBTQ (lesbian, gay, bisexual, transgender and queer) youth who rely on Tumblr and its communities for self-discovery and support. ‘Safer’ online spaces Since LGBTQ identities have often been stigmatized, the internet has been pivotal in helping those with diverse gender and sexual identities learn about themselves and find each other. Tumblr has provided a safe space for this through many of its key features (e.g. pseudonymous accounts, reblogging) and the communities it attracts. Given this, it’s not surprising that a large Australian survey found LGBTQ youth use Tumblr much more frequently than the rest of the population. Many respondents indicated content on Tumblr broadened their understanding of sexuality and gender and facilitated self-acceptance. The Tumblr logo is displayed at Nasdaq in New York in July 2013. (AP Photo/Mark Lennihan) Tumblr has served as an essential outlet for LGBTQ youth in relation to other popular platforms. Alexander Cho, a postdoctoral fellow at UC Irvine, has written about Tumblr’s “ queer ecosystem ” where “users circulate porn, flirt, provide support to deal with homophobia as well as advice on coming out…” Cho has found that queer youth of colour experience Facebook as a space of “ default publicness ” and prefer Tumblr for sharing intimate and personal content. LGBTQ people have also found Tumblr to be powerful for self-representation. Through sophisticated hashtagging practices, transgender people share art, stories and engage in dialogue that challenges cisgender norms. Researcher Tim Highfield and I have explored how sharing queer GIFs – short, looping media — not only allows LGBTQ youth to engage in Tumblr’s fan communities but also playfully displays queer culture en masse. This broad representation of LGBTQ identities may dissuade homophobic harassment, as some of the queer women I’ve interviewed perceive less discrimination on Tumblr. What’s porn got to do with it? Porn is a portion of the multiple forms of media resonating among LGBTQ users. This media allows them to knit together non-mainstream identities and survive in a world where heterosexuality is ubiquitously portrayed across social media and broadcast outlets. Not all LGBTQ content contains genitals, “female-presenting nipples” or sex acts, but not all content with these elements constitutes what we would generally think of as pornography. Much of the sexualized content circulated among LGBTQ Tumblr users make available depictions of sexuality that are frequently rendered invisible or marginalized. These can take the form of fan art, remixed film clips of sensual embraces and selfies. This media allows LGBTQ people to see themselves as sexual beings — something that is particularly important for young people developing a sense of sexual and gender identity. Even if you disagree with teenagers accessing this type of content, Tumblr’s new policy bans it for everyone regardless of age. Formerly, users could voluntarily mark their blogs as “NSFW” (Not Safe for Work) if they posted occasional nudity and “adult” if posting substantial nudity. This provided a sort of checkpoint to hinder younger users in accessing this content. Now even adults won’t be able to access “adult content.” This means that young people over 18, who may be facing formative life changes, like starting post-secondary education or moving away from home, won’t have access to media that may help them learn about their identity and feel supported while doing so. Commercial platforms shape culture Strict content moderation policies tend to have negative outcomes for already marginalized users. In my research with Jean Burgess and Nicolas Suzor, we found that some queer women experienced Instagram’s content moderation as overly stringent. Instagram asks users to report content and responds through automated mechanisms. Therefore, queer women’s content was subject to removal based on other users’ whims and the banning of certain hashtags like #lesbian. Tumblr’s new updates promise a similar mixture of user reporting and automated content detection tools. Several scholars have begun to critically examine how platforms’ decisions shape our social and cultural norms. In Canada, Chris Tenove, Heidi Tworek and Fenwick McKelvey have pointed out that content moderation is not standardized and lacks federal oversight. Platforms often apply content moderation categories, such as “adult content,” without transparency or accountability. Tumblr’s CEO, Jeff D’Onofrio, said : “There are no shortage of sites on the internet that feature adult content. We will leave it to them and focus our efforts on creating the most welcoming environment possible for our community.” It seems that with this new change, youth who want to encounter sexual content will need to relocate. While some young people may turn to pornography sites, many of these sites are not designed with diverse sexual and gender identities in mind. Youth entering these sites may be more likely to encounter stigmatized, stereotypical and demeaning representations of women and transgender people. Even LGBTQ-friendly pornography sites don’t have the elaborate community networks unique to Tumblr. Such communities help youth to make sense of sexual content in relation to who they are becoming as they grow up. Tumblr’s decision means LGBTQ youth will have one less outlet where they can learn about sexual identity and gain support from peers who are like them and sharing content for them. Stefanie Duguay is Assistant Professor at Concordia University. A version of this story originally appeared at The Conversation.","Tumblr’s new NSFW content policy will hurt those with diverse gender and sexual identities, who use the site to learn about themselves and find each other. As of Dec. 17, Tumblr will no longer allow “ adult content,” defined as that which shows “real-life hum…",2018-12-06T20:50:33Z,"{'id': None, 'name': 'Fastcompany.com'}",The collateral damage of Tumblr’s porn ban,https://www.fastcompany.com/90278004/tumblrs-ban-on-nsfw-content-hurts-lgbtq-youth?partner=feedburner&utm_source=feedburner&utm_medium=feed&utm_campaign=Feed%3A+fastcompany%2Fheadlines+%28Fast+Company%29,"https://images.fastcompany.net/image/upload/w_1280,f_auto,q_auto,fl_lossy/wp-cms/uploads/2018/12/p-1-tumblr-censorship.jpg",,Fastcompany.com,damage,0
msmash,"National parks are America's public lands, but right now they're America's trashcans. That's because the U.S. federal government, embattled over funding for a border wall, has shut down, leaving national parks open and largely unattended. Since the shutdown began, brimming trashcans, overflowing toilets, and trespassing has been reported at many parks locations. ""Never before have I seen the federal government tempt fate in national parks the way we are today,"" says Diane Regas, president of the Trust for Public Land. ""It's not about what has happened already. It's about what could happen if you don't have the appropriate staffing."" According to the National Parks Conservation Association (NPCA), staffing varies by park, but some 16,000 parks service employees are furloughed, leaving a small number active for policing and security. The government shut down three times in 2018, but only three days last January and less than a day that following February. As of Friday, the government had been partially shut down for 13 days.","When the government eventually reopens, park experts warn reversing damage won't be as easy as throwing out the trash. From a report: National parks are America's public lands, but right now they're America's trashcans. That's because the U.S. federal governm…",2019-01-07T09:30:00Z,"{'id': None, 'name': 'Slashdot.org'}",National Parks Face Years of Damage From Government Shutdown,https://yro.slashdot.org/story/19/01/06/2141220/national-parks-face-years-of-damage-from-government-shutdown,https://a.fsdn.com/sd/topics/government_64.png,,Slashdot.org,damage,0
Daniel Cooper,"In the wake of Krzanich's departure, current CFO Robert Swan will assume the role of Interim CEO while the board looks for a longer term replacement. The company says that the departure will not damage its long-term outlook, and that it has a ""robust succession planning process in place."" It added that it has full faith in Bob Swan's ability to lead the company through the transition. Krzanich is an Intel lifer, having started at the company's New Mexico plant shortly after graduating in 1982. He worked his way up to a management role in 1996, and by 2007 was running Intel's supply chain efforts, and pushed for the company to stop using conflict minerals. He was appointed to the role of COO in 2012, and succeeded Paul Otellini as CEO in May 2013. Intel has moved swiftly to move beyond Krzanich, and at the same time as his resignation was announced, his executive biography was scrubbed from Intel's website.","Intel CEO and board member Brian Krzanich will step down from his role at the company, effective immediately. In a statement, Intel said that it had been recently informed of a ""past consensual relationship"" with a company employee. After an investigation by …",2018-06-21T13:18:00Z,"{'id': 'engadget', 'name': 'Engadget'}",Intel CEO resigns over ‘relationship’ with employee,https://www.engadget.com/2018/06/21/intel-ceo-resigns-over-relationship-with-employee/,https://o.aolcdn.com/images/dims?thumbnail=1200%2C630&quality=80&image_uri=https%3A%2F%2Fo.aolcdn.com%2Fimages%2Fdims%3Fresize%3D2000%252C2000%252Cshrink%26image_uri%3Dhttp%253A%252F%252Fo.aolcdn.com%252Fhss%252Fstorage%252Fmidas%252F70cce137281f948c9c5dc3d379dd234d%252F205775006%252FPA170026.jpg%26client%3Da1acac3e1b3290917d92%26signature%3D7d39c5974c32f516ed1fd5efeee61ef93d7c826b&client=cbc79c14efcebee57402&signature=e24fa4a1c79bfdca1b9eab0af3f402647504b419,engadget,Engadget,damage,0
Jon Fingas,"Whether or not this makes a difference is another story. Although Democrats at the SEC supported the guidance, they argued that the real solution would be tougher rules requiring better disclosures and improved security standards. The guidance may formalize SEC interpretations that haven't always been made public, but it doesn't change those laws to keep pace with modern cybercrime. It's not uncommon for companies to downplay or cover up incidents, but they won't necessarily face serious repercussions for their actions. If nothing else, though, this is a shot across the bow. It's a reminder that companies shouldn't sit on news of a breach, jeopardizing the data of their customers for the sake of profit. If companies honor the guidelines (and that's a big ""if,"") you may understand the true severity of a breach and have a better chance at mitigating the damage.","American companies haven't always been forthright about disclosing data breaches in a responsible way, and regulators want to encourage better behavior. The Securities and Exchange Commission has issued ""interpretive guidance"" that it hopes will both promote …",2018-02-21T23:32:00Z,"{'id': 'engadget', 'name': 'Engadget'}",SEC guidelines push for clearer data breach disclosures,https://www.engadget.com/2018/02/21/sec-guidelines-push-for-clearer-data-breach-disclosures/,https://o.aolcdn.com/images/dims?thumbnail=1200%2C630&quality=80&image_uri=https%3A%2F%2Fo.aolcdn.com%2Fimages%2Fdims%3Fcrop%3D3973%252C2649%252C0%252C0%26quality%3D85%26format%3Djpg%26resize%3D1600%252C1067%26image_uri%3Dhttp%253A%252F%252Fo.aolcdn.com%252Fhss%252Fstorage%252Fmidas%252F72dcee7391eb0e4437ed2e2c9bb2fb4b%252F205690396%252Fjay-claytonchairman-of-us-securities-and-exchange-commission-nominee-picture-id656907654%26client%3Da1acac3e1b3290917d92%26signature%3D8d28afcc26079a731f4c5c27c0c4c6177cf83ded&client=cbc79c14efcebee57402&signature=06868b79bea624555273344236886139db65c3cd,engadget,Engadget,damage,0
Jon Fingas,"The breach compromised about 145.5 million people, although their level of exposure varied wildly. About 10.9 million Americans' driver's licenses were embroiled in the hack, and just a small fraction of the exposed UK licenses (just under 700,000) had enough info to jeopardize the victims' privacy. Equifax stressed to CNN that the initial list of exposed data was never meant to be the final, definitive account of the scope of the problem. And that's not unheard of -- companies frequently deliver rough assessments of the damage in the immediate aftermath and refine the numbers as they learn more. However, that explanation might not be enough for officials. Senators are already clamoring for a thorough investigation, and want to know the full extent of what happened. This update gives them more of what they want, but it also raises the question of why the company is still determining the scope of the breach nearly half a year after it was made public.","The 2017 Equifax data breach was already extremely serious by itself, but there are hints it was somehow worse. CNN has learned that Equifax told the US Senate Banking Committee that more data may have been exposed than initially determined. The hack may have…",2018-02-11T00:58:00Z,"{'id': 'engadget', 'name': 'Engadget'}",Equifax breach may have exposed more data than first thought,https://www.engadget.com/2018/02/10/equifax-breach-may-have-exposed-more-data/,https://o.aolcdn.com/images/dims?thumbnail=1200%2C630&quality=80&image_uri=https%3A%2F%2Fo.aolcdn.com%2Fimages%2Fdims%3Fcrop%3D4000%252C2667%252C0%252C0%26quality%3D85%26format%3Djpg%26resize%3D1600%252C1067%26image_uri%3Dhttp%253A%252F%252Fo.aolcdn.com%252Fhss%252Fstorage%252Fmidas%252F2ca26494d15cb9d219604fbabae6c084%252F205918941%252Fan-equifax-inc-slide-is-displayed-on-a-monitor-during-a-house-in-picture-id866371962%26client%3Da1acac3e1b3290917d92%26signature%3D113db25159031a43dd53fc0d5e08686e339155d0&client=cbc79c14efcebee57402&signature=1b81b9fe36bf87c0e6abf1931ded5417e7f88a03,engadget,Engadget,damage,0
