author,content,description,publishedAt,source,title,url,urlToImage,source_id,source_name,types,yes_disaster
VANESSA FRIEDMAN,"There is nothing wrong with this, or with thinking about this; it doesnt reveal a superficiality or lack of substance, which is often the default fear when the topic of clothing comes up. 
On the contrary, it acknowledges the truth that we all make snap judgments based first on appearance, and then make a choice about how much time and brain space need to be devoted to influencing those judgments, and how much can be delegated.
This should be something everyone can relate to, given the current craziness around dress codes in general, be it the complete nonsense of events that request creative dress or dress to impress or the difficulty of corporate strictures on dressing appropriately in an office setting, a word so vague that it is practically meaningless. (Yes, Goldman Sachs, this means you.) 
To a certain extent, we are always in search of dress recommendations and instruction, as the social and professional codes of yesteryear have eroded under the increasing commingling of life and work, putting an end to unspoken uniforms. 
Thats why stylists and personal shoppers have become such a booming business, increasingly famous in their own right. In many ways, politics has been the most insulated of all professions, but clearly, even that is changing.
(And really, if there is such a thing as a courtroom stylist, can a political stylist be far behind? This is essentially the role Meredith Koop played for Michelle Obama, though officially her job was general aide, and how Hervé Pierre functions for Melania Trump.)","Gov. J.B. Pritzker, center, with Bill Hadley, the Stephenson County board chairman, right, and Pastor Antwon Funches of St. Paul Missionary Baptist Church, left, during a stop to survey flood damage in Freeport, Ill.",2019-04-01T13:21:40Z,"{'id': 'the-new-york-times', 'name': 'The New York Times'}","Unbuttoned: Hey, Governor, What Are You Wearing?",https://www.nytimes.com/2019/04/01/fashion/jb-pritzker-dress-advice.html,https://static01.nyt.com/images/2019/04/04/fashion/01UNBUTTONED-flood/01UNBUTTONED-flood-facebookJumbo.jpg,the-new-york-times,The New York Times,damage,0
Marcus Gilmer,"As a powerful nor'easter slams the Atlantic Coast, flooding records in Massachusetts set just two months ago by another storm could fall throughout the weekend, and images and videos of the early stages are already rolling across social media. SEE ALSO: Weather Service issues 'Life or death' warning, as major nor'easter hits Massachusetts While the storm will lash a long stretch of the East Coast, from near Washington, D.C. all the way up to Maine, the most severe flooding is expected along the Massachusetts coast, including Boston, which was pounded by the ""bomb cyclone"" in early January. With heavy winds bringing a storm surge of two to four feet to the area, as well as water levels approaching and even eclipsing 15 feet, flooding records set by that January storm could be shattered over the weekend. Street flooding was already being reported in Quincy, Massachusetts. Water levels were also already on the rise in Boston. At high tide on Friday morning, the water in Boston Harbor reached 14.36 feet, which was the third-highest water level on record. And the worst of this storm is yet to come. Plenty of other locations across the North Atlantic coast were also being slammed with high winds, heavy rain, and high waters. Massachusetts locations like Revere and Scituate are already experiencing severe flooding with the storm expected to spin over the area through the weekend. This is a developing story...","As a powerful nor'easter slams the Atlantic Coast, flooding records in Massachusetts set just two months ago by another storm could fall throughout the weekend, and images and videos of the early stages are already rolling across social media. SEE ALSO: Weath…",2018-03-02T18:33:06Z,"{'id': 'mashable', 'name': 'Mashable'}","Photos and videos show flooding, damage from historic storm along East Coast",https://mashable.com/2018/03/02/winter-storm-coastal-flooding-photos-video/,https://i.amz.mshcdn.com/MYqJhg8yfB5wU29_rx4S2Uwbgbw=/1200x630/2018%2F03%2F02%2F4a%2F7a9394e44023406d8b9f1263a8dd3994.2af6a.jpg,mashable,Mashable,damage,0
Andrew Freedman,"This weekend's storm reserved its full might for southern New England, where winds gusted to 93 miles per hour and coastal flooding occurred for at least five tide cycles. But the nor'easter that struck Washington, D.C., New York, Providence, and Boston has churned up so much real estate across the Atlantic Ocean that high waves are causing damage in Puerto Rico and the Leeward Islands. The storm's footprint, in the form of high waves, is unusually expansive, extending all the way southward to the Caribbean and even northern South America. Swells generated by the storm's vast wind field now occupy at least half of the North Atlantic, according to maps provided by the U.S. Ocean Prediction Center, which is part of the National Weather Service. SEE ALSO: Pilot reports hellish, vomit-filled landing in middle of strengthening nor'easter John Morales, chief meteorologist at NBC 6 in Miami, who was born in Puerto Rico, has been tweeting images of the damage there caused by ocean swells of 15 to 20 feet that were generated by the meteorological ""bomb"" that hit New England and is still spinning out over the open ocean. The ocean swell event has been so impactful in the Caribbean that even within San Juan Bay the rising water and wave action caused damage along the outside of ancient wall surrounds Old San Juan. https://t.co/ivOx2z5gCV — John Morales (@JohnMoralesNBC6) March 5, 2018 One of the worst ocean swell events in recent decades is hitting Hispaniola, Puerto Rico, the Virgin and northern Leeward Islands hard today through tomorrow. https://t.co/onusoRoEwv — John Morales (@JohnMoralesNBC6) March 4, 2018 The Ocean Prediction Center's forecasts show waves that were originally generated by the nor'easter will extend across the Atlantic within the next two days. The likely result would not be damaging flooding, however, since the wave heights are diminishing so far from the storm. 24-hour wave period and direction forecast for March 6, 2018. Image: ocean prediction center The high waves did considerable damage in eastern Massachusetts, with astonishing scenes of waves towering over homes, and breaking through shoreline barriers. It was one of the most destructive and longest-lasting coastal flood events in Massachusetts history, coming in as a top 3 tide level in Boston Harbor, for example. Towns including Scituate, Marblehead, Quincy, and Gloucester were particularly hard hit, as was the island of Nantucket. Wave footprint of the early March nor'easter, outlined by the blue box. Image: earth.nullschool.net The flooding was made worse by astronomical high tides and long-term sea level rise, which is making once rare coastal flood events more likely with each passing year.","This weekend's storm reserved its full might for southern New England, where winds gusted to 93 miles per hour and coastal flooding occurred for at least five tide cycles. But the nor'easter that struck Washington, D.C., New York, Providence, and Boston has c…",2018-03-05T16:36:52Z,"{'id': 'mashable', 'name': 'Mashable'}","Massive waves from weekend nor'easter cause damage in Caribbean, reach South America",https://mashable.com/2018/03/05/noreaster-high-waves-reach-caribbean/,https://i.amz.mshcdn.com/DWTOUK7yvuP78ciCV1HN8BI2U64=/1200x630/2018%2F03%2F05%2F6b%2Fcad3181fd2e54072a615309dced8f0d2.57fb3.jpg,mashable,Mashable,damage,0
Jason Schreier,"One of the things I love about Assassins Creed Odyssey, a game full of things to love, is this: You cant die from fall damage. No matter what. From the start of the game, your main character (Kassandra, or Alexios if youre basic) will take reduced damage from leaping off mountains or buildings, no matter the height. Then, at level 20, youll take no damage at all. Its a brilliant feature that, coupled with freeform climbing, encourages exploration in a way reminiscent of Zelda: Breath of the Wild. You can wander in any direction youd like, moving up and down with no concern for how youll get back to where you started. This is a nice contrast to other massive role-playing games, like The Witcher 3, in which you star as a grizzled mercenary who can single-handedly defeat entire armies but dies if he jumps more than five feet. Daily thoughts from a Kotaku staffer about a game were playing. The logic behind fall damage in video games is twofold. One: it makes the world feel more realistic when you cant leap off huge mountains without dying. Two: it creates an artificial barrier to prevent the player from exploring and reaching places they shouldnt be reaching. Assassins Creed Odyssey wisely throws both of those rationales out the window, accepting the fact that a game about a woman who uses VR to travel back through time doesnt need to be too realistic, and that reaching places you shouldnt be reaching in a video game is actually pretty damn cool. If Assassins Creed Odyssey influences other game developers in one way, let it be this: Fall damage is bad and should go away forever.","One of the things I love about Assassin’s Creed Odyssey, a game full of things to love, is this: You can’t die from fall damage. No matter what. Read more...",2018-10-09T16:00:00Z,"{'id': None, 'name': 'Kotaku.com'}",Death To Fall Damage,https://kotaku.com/death-to-fall-damage-1829623960,"https://i.kinja-img.com/gawker-media/image/upload/s--T0bWhtua--/c_fill,fl_progressive,g_center,h_900,q_80,w_1600/h7ngxjs8ga18us17feth.jpg",,Kotaku.com,damage,1
Alexis Nedd,"More than halfway through HBO’s Sharp Objects, no one really knows who killed the girl whose violent death sparked the events of the series. No one really knows what Amma’s deal is either, or if Camille is going to be able to handle the painful emotions that come with being back in her childhood home. No one knows much of anything. Except for one thing. Everyone knows Adora Crellin is a complete monster. SEE ALSO: The scariest part of 'Sharp Objects' isn't the murders. It's the teens. Seriously, what is Adora’s damage? She’s a horrible, person-shaped monster in a fluffy pink shell with zero redeeming qualities and the personality of an arsenic-laced Ladurée macaron. The fact that she managed to live long enough to have at least one adult daughter without the town coming for her in the middle of the night with torches and pitchforks speaks volumes about how messed up Wind Gap society is. It’s possible that the episodes in the latter half of the season will shed light on why exactly Adora is the way she is. But if the end of Episode 5 is any indication, her backstory will shine more light on her personal unwillingness to be anything but an emotional vampire, instead of engendering sympathy for her. To recap, episode 5 ended with Adora telling Camille that all of her darkness and strife comes from Camille’s mysterious father, in a conversation that is notably the first time she has mentioned anything about the time in her life that resulted in Camille’s birth. The glimpse into what happened between Adora and Camille’s father could have been a moment of honesty between mother and estranged daughter, but of course Adora is only in it to punish Camille for being, in Adora’s eyes, her father’s daughter. “That’s why I think I never loved you,” Adora says to her own child, “you were born to it, that cold nature. I hope that’s come comfort.” Somebody make sure that Mother of the Year award gets returned to sender. Adora is a horrible, person-shaped monster in a fluffy pink shell, with the personality of an arsenic-laced Ladurée macaron. The problem with Adora is that she is not only the premiere citizen of Wind Gap — she acts as if she is the town itself, a physical representation of its history and values, its secrets, glory, and pomp. In a way, she’s right, in that she comes from the town’s founding Calhoun family whose tragic history of sexual violation is (for whatever batshit reason) the cornerstone of the town’s public identity. Adora’s blood, her home, and her money are all connected to the effed-up mythology of Wind Gap. So perhaps it makes sense that she has no idea how to be a person and mother divorced from the ideals of a poisonous Missouri township. Watching Adora smile with pride as her youngest daughter participates in the town’s tradition of miming Millie Calhoun’s rape is a sickening visual that nonetheless clarifies her priorities. The Crellin family, née the Preaker family, née the Calhouns, exist to reflect and encapsulate Wind Gap’s disturbing values above all else. Adora’s prime directive in being the patron goddess of Wind Gap comes out in her overwrought parenting reactions, some of which are played for laughs but are mostly flat-out weird. Her obsession with blaming one or both of her daughters for the cut on her hand betrays her need to view herself as a fundamentally good person whose peace is only disturbed by the disharmonious actions of those who won’t follow the status quo. There’s a clear line between how she views herself and how she views Camille and the town murders. Wind Gap, to Adora, is a wonderful place that is being preyed upon by outliers like murderous truckers and a daughter who refuses to conform. She’s wrong, of course, on both counts. Wind Gap is actually a nasty place that is harboring a local psychopath, and the root of Camille’s problems is Adora’s lack of affection. But no one can tell her that. Especially not Camille. Camille’s birth, which the audience understands to have been out of wedlock when Adora was young, must have been a radical departure from that younger Adora’s prescribed job as the future doyenne of Wind Gap. Maybe her pregnancy forced Adora to submit to or choose the role she inhabits now, to be a slightly hated but always shining example for the women of the town, but in making that choice she also had to emotionally eliminate the one thing that contradicted with that image. Camille was born into the aftermath of that choice. She never stood a chance to gain Adora’s love because she was an outlier before she even took her first breath. Adora chose Wind Gap, and Alan, and Marion, and even Amma over her firstborn and Camille has suffered ever since. Damaged or not, chosen or choosing, Adora is a bad person and an even worse mother. She’s bad because Wind Gap is bad, and the expectations put on women in society are bad, and maybe her mother was pretty bad too. None of it excuses her from refusing to love her own child and continuing to reject Camille thousands of times over the course of her life. She’s a straight up bad mom. And as it usually is with most bad moms, her daughters are the ones who will have deal with the fallout from having been raised by her. Anyone else need an Evian bottle full of vodka?","More than halfway through HBO’s Sharp Objects, no one really knows who killed the girl whose violent death sparked the events of the series. No one really knows what Amma’s deal is either, or if Camille is going to be able to handle the painful emotions that …",2018-08-06T21:18:25Z,"{'id': 'mashable', 'name': 'Mashable'}","Hey Adora from 'Sharp Objects', what the hell is your damage?",https://mashable.com/2018/08/06/sharp-objects-adora-bad-mom/,https://i.amz.mshcdn.com/IbIbrMyiw_oVPp0I6s6OwHIW76U=/1200x630/2018%2F08%2F06%2F18%2F09adc027eb06490d95928cccf7ff64b6.45038.jpg,mashable,Mashable,damage,0
CORAL DAVENPORT,"At 3.6 degrees of warming, the report predicts a disproportionately rapid evacuation of people from the tropics. In some parts of the world, national borders will become irrelevant, said Aromar Revi, director of the Indian Institute for Human Settlements and an author of the report. You can set up a wall to try to contain 10,000 and 20,000 and one million people, but not 10 million. The report also finds that, in the likelihood that governments fail to avert 2.7 degrees of warming, another scenario is possible: The world could overshoot that target, heat up by more than 3.6 degrees, and then through a combination of lowering emissions and deploying carbon capture technology, bring the temperature back down below the 2.7-degree threshold. In that scenario, some damage would be irreversible, the report found. All coral reefs would die. However, the sea ice that would disappear in the hotter scenario would return once temperatures had cooled off. For governments, the idea of overshooting the target but then coming back to it is attractive because then they dont have to make such rapid changes, Dr. Shindell said. But it has a lot of disadvantages. For more news on climate and the environment, follow @NYTClimate on Twitter.",A landmark United Nations report paints a far more dire picture of the immediate consequences of climate change than previously thought and says that avoiding damage requires quickly transforming the world economy.,2018-10-08T01:00:04Z,"{'id': 'the-new-york-times', 'name': 'The New York Times'}",Major Climate Report Describes a Strong Risk of Crisis as Early as 2040,https://www.nytimes.com/2018/10/07/climate/ipcc-climate-report-2040.html,https://static01.nyt.com/images/2018/10/08/climate/08cli-heat1/08cli-heat1-facebookJumbo.jpg,the-new-york-times,The New York Times,damage,0
Timothy J. Seppala,"If you've played SotN or any of its contemporaries like Axiom Verge or Shadow Complex you know what to expect. Controls should be mostly familiar too. Using an Xbox-style gamepad for my demo, X handled attacks and A was for jumping, while magic attacks were mapped to Y and the right trigger. My admittedly brief demo took place on a boat infested by all manner of ghastly creatures. I went from room to room as protagonist Miriam; clearing out harpy-like creatures and hulking, headless suits of armor on the main deck with edged weapons and fisticuffs. I then jumped downward through platforms and took the fight to jellyfish and barnacle-covered cannons below decks. It's worth noting that I didn't encounter any of the ""get skill to unlock new area"" tropes the genre is known for. But with each new area I entered, the mini-map in the upper right corner of the screen filled in. Once or twice, it showed doorways that weren't visible in the game with my current loadout, a coy tease that there were plenty of secrets tucked away in the haunted ship. I leveled up a handful of times and found a bunch of new gear (including a pair of ""kung-fu boots"" that increased my kicking damage), too. When it comes to magic, spells are called ""Shards"" in Bloodstained parlance, and I unlocked both fire and ice incantations. Combat is light and quick, and the aforementioned ice magic attack can counter the possessed cannon's salvos. My only gripe is that I couldn't quite get the timing right to successfully evade incoming attacks. That the evade command (a quick jump backward) was awkwardly mapped to the left bumper button didn't help either. The placement is even more perplexing considering the B button doesn't have a function assigned to it. For run-of-the-mill enemy encounters it wasn't too big of a deal. Once I found a weapon that worked for my play style -- a rapier -- I didn't take much damage. Its longer range meant I didn't have to be nearly as close while attacking enemies, and thus, offered a bit of protection compared to attacking bare-handed. And, unlike the claymore which covered even more range and did more damage, the comparatively smaller sword wasn't slow to swing.","Castlevania: Symphony of the Night ( SotN ) is one of the most influential games ever made. First released for the original PlayStation in 1997, the game has since been ported to nearly every platform under the sun. It perfected the series' core design concei…",2018-06-15T14:00:00Z,"{'id': 'engadget', 'name': 'Engadget'}",'Bloodstained' will scratch your 'Castlevania' itch,https://www.engadget.com/2018/06/15/bloodstained-will-scratch-your-castlevania-itch/,https://o.aolcdn.com/images/dims?thumbnail=1200%2C630&quality=80&image_uri=https%3A%2F%2Fs.aolcdn.com%2Fhss%2Fstorage%2Fmidas%2F52bb1a868ddf54d9d32e041ab7ee4594%2F206455482%2Fbloodstainedlede.jpg&client=cbc79c14efcebee57402&signature=f6f4d1989c3e76cdd61fc0ad64fe2e803ef22f18,engadget,Engadget,damage,0
Sean Gallagher,"Enlarge / U-35 under construction at Kiel in 2013. The sub—like all the others in Germany's fleet—is currently in for repairs. reader comments 5 Germany has a submarine problem. During a test dive in October, the Deutsche Marine's U-35 struck something (probably a rock) with one of its four ""X-rudders,"" the steering planes on its rear fins. The damage required the submarine to be towed back to a shipyard in Kiel for repairs—where it joined three other German navy submarines currently drydocked. The U-35 was the Deutsche Marine's only working submarine prior to the collision. The remainder of the German submarine fleet is in port at the German naval base in Eckernförde—waiting for dry docks in Kiel to open up. Germany has a total of six submarines, all of the Type 212 class. These ""hybrid"" subs—also operated by the Italian navy—are powered by a combination of a diesel engine and nine proton exchange membrane (PEM) fuel cells. They are among the quietest, most advanced non-nuclear submarines in the world. Because their fuel cells are "" air independent propulsion "" (AIP), these subs can operate submerged for weeks without surfacing. And since the PEM cell ""engines"" have no moving parts other than the electrically powered screws, they're incredibly stealthy when submerged. They can also operate in waters as shallow as 17 meters deep (55 feet), making them ideal for patrolling the waters of the Baltic. But because of backlogs in repairs and a series of unfortunate events, only two of the Type 212 class are not currently under repairs—and they are not ready for active service: U-31, the class leader—launched in 2002—has just come out of major maintenance and has a year's worth of trials ahead of it before being returned to service. It has been out of service since 2014. U-32 had a battery casualty on a trip to Norway. U-33 is in the Kiel shipyard for maintenance until February of 2018 and will likely not be back in service until May or June. U-34 is due to start a yard period in Kiel in January, and it's not certain when it will return to service. U-36, the latest submarine built for the Deutsche Marine, was completed a year ago, but it is still in acceptance trials and is not expected to be fully active until May of 2018. The reason for the backlog: a spare-parts shortage that was exacerbated by cuts made to the Deutsche Marine's budget. To save money, the service stopped stockpiling spares for the complex systems of its subs, relying instead on either purchasing parts on demand or cannibalizing subs that were out of service—much like the US Navy has had to do as a result of budget sequestration over the past four years. As a result, Germany's entire submarine service is left essentially sitting on its hands through at least the first half of 2018.","Spare parts shortage, collision damage have sidelined entire sub fleet.",2017-12-19T20:25:33Z,"{'id': 'ars-technica', 'name': 'Ars Technica'}",Das boot ist kaputt: German navy has zero working subs,https://arstechnica.com/tech-policy/2017/12/das-boot-ist-kaputt-german-navy-has-zero-working-subs/,https://cdn.arstechnica.net/wp-content/uploads/2017/12/Kiel_HWDW_U35-760x380.jpg,ars-technica,Ars Technica,damage,0
