author,content,description,publishedAt,source,title,url,urlToImage,source_id,source_name,types,yes_disaster
JOSE A. DEL REAL,"• Several homeless people were rescued in Sacramento as water rose around them beneath a highway overpass. • In Montecito, the chief executive of a disaster relief charity finds disaster right in his back yard for the second time. • Dispatch: A family returns to their home in Carpinteria after evacuating amid warnings. • The Sacramento Bee writes that the storm set a rainfall record in the Sacramento region. • The San Francisco Chronicle reports the rainstorm produced one of the rainiest days in San Francisco history, causing car crashes and transit delays. California Online (Please note: We regularly highlight articles on news sites that have limited access for nonsubscribers.) • The former Assembly Republican leader Chad Mayes announced the formation of an initiative to reshape the state party around “pragmatic conservative” ideas. [ The Sacramento Bee ] • A federal judge in San Francisco temporarily blocked the Trump administration from ending the Deferred Action for Childhood Arrivals Program. [ The San Francisco Chronicle ] • Senator Dianne Feinstein published transcripts of an interview the Senate Judiciary Committee conducted with the firm involved in compiling a controversial dossier about President Trump. [ The New York Times ] • One in 10 California prison guards has attempted suicide, according to a study. [ The Associated Press ] • Two Democratic lawmakers are requesting $10 million in state funds for a legal-defense fund that would help Salvadorans at risk of being deported, after the Trump administration announced it would end their temporary legal status. [ Los Angeles Times ] Photo The capitol building in Sacramento, Calif. Credit Deanne Fitzmaurice for The New York Times • During last year’s Oroville Dam crisis, a report shows officials with the Department of Water Resources second-guessed dumping water for fear they would not be able to deliver water to faraway water districts. [ The Sacramento Bee ] • Public health officials in California are urging state residents to get a flu vaccine amid an intensifying flu season. [ The Mercury News ] • A study says that the bed bug problem in Los Angeles is even worse than in New York. [ Patch Media ] • Eight people filed to run for mayor in San Francisco before Tuesday’s filing deadline. [ SFGate ] • Jon Gruden was introduced as the head coach of the Oakland Raiders at the team’s headquarters on Tuesday, making his official return to the team. [ The East Bay Times ] And Finally... The Montecito community in Santa Barbara County took a heavy beating Tuesday. Below are a few striking photos from the mudslides. Photo Emergency workers searched through debris and damaged homes in Montecito. Credit Santa Barbara County Fire Department Photo The 300 block of Hot Springs Road in Montecito, Calif., on Tuesday, following debris and mud flow due to heavy rain. Credit Santa Barbara County Fire Department Photo Los Angeles Fire Department Firefighters worked amidst flood waters and mud during heavy rains in Sun Valley, Cali., on Tuesday. Credit Andrew Gombert/European Pressphoto Agency California Today goes live at 6 a.m. Pacific time weekdays. Tell us what you want to see: CAtoday@nytimes.com. California Today is edited by Julie Bloom, who grew up in Los Angeles and graduated from U.C. Berkeley. Continue reading the main story","Wednesday: Extensive damage in SoCal, concerns over the intensifying flu season, and bed bugs in Los Angeles.",2018-01-10T14:34:37Z,"{'id': 'the-new-york-times', 'name': 'The New York Times'}",California Today: California Today: What You Need to Know About the Mudslides,https://www.nytimes.com/2018/01/10/us/california-today-what-you-need-to-know-about-the-floods-and-mudslides.html,https://static01.nyt.com/images/2018/01/10/us/10mudslides-01ALTALT/10mudslides-01ALTALT-facebookJumbo.jpg,the-new-york-times,The New York Times,damage,0
ALAN HENRY,"You probably already know that you should keep supplies and an emergency kit on hand for the most common types of emergencies your community may face, but those kits are designed to be helpful only for the first hours or days — ideally just long enough for you to get help or for help to get to you. Even if you have a sizable stockpile of supplies, you’re going to need help from other people sooner rather than later. Mr. Stripling said that most search and rescue after a disaster is done by people in their communities, long before professionals arrive. However, a lot of the support structures that foster the sense of community that led people to look out for one another have degraded, Mr. Stripling said, and it’s up to individuals to bring them back to life. “We have fewer stores and more social media addicts — and that’s tough from a preparedness standpoint since disasters are inherently geographical,” he said. “In a disaster, more people will survive if your neighborhood is resilient — tightly connected, with lots of knowledge about who lives there and lots of strong institutions. ” Photo Credit Ángel Franco/The New York Times Before you go knocking on doors however, make a plan — not about how you’ll persuade your neighbors exactly, but what you’ll actually ask of them. How to get started Instead of going door-to-door to rally neighbors, you’ll find more success if you piggyback on existing institutions to organize people in times of need, Mr. Stripling said. “Disaster research shows that tight-knit communities with strong, locally driven organizations respond better in disaster situations,” he said. “That means that any work you do to build community, from strengthening a P.T.A. to starting a local business that serves as a community hub, will naturally help your neighborhood be better prepared. “That’s a key point to focus on. These civic institutions or schools or churches not only enrich our lives day to day, they help to save our lives when disaster strikes. And many of them are not as strong as they used to be.” In short, don’t reinvent the wheel. There’s little need to build something you’ll then have to persuade people to come to when you could get involved with a local P.T.A., sports team, church, book club or neighborhood watch. Mr. Stripling even suggested getting involved with a local coffee shop, day care, or just a group of friends you get drinks with periodically if you can’t find a community group to join. Your next step is to put disaster prep on the agenda of the group you’ve connected with. That doesn’t mean taking over or dragging out a stodgy set of doom-and-gloom talking points. Try to have fun, Mr. Stripling said. “You can schedule a disaster-focused P.T.A. meeting, or a bar trivia night about disasters. Honestly, people do that!” he said. “Your local coffee shop could host a Godzilla Awareness Party. Your small group can help bring people in using an ‘each one reach one’ approach around the neighborhood — and most localities have emergency management teams that would be thrilled to speak at an event like that.” Photo Credit Bryan Oller/Associated Press What to include in your community disaster plan Once you have a group of interested people and a venue to get everyone talking, it’s time to start thinking about what your community’s plan will include. That said, don’t get caught up in the specifics. The point is to get people aware of the possible disasters your community will face, and get them ready and willing to help and take care of one another in a crisis. “The most important thing to understand is that planning for these sorts of things is about the process, not any final document,” Mr. Stripling explained. “Because disasters are chaotic, you’re probably not going to have a lot of reading time, right? So, it’s important to get your group ready to improvise. Building your group into a team that can react to different types of events is more important than being ready to run any one evacuation plan.” He outlined three major components of a good community disaster prep plan: 1. Make sure everyone has more than one way to reach one another. Cellphone numbers are great, but remember that in an emergency, cellular networks will probably be overloaded. If you have a signal but can’t place a mobile call, text messages and walkie-talkie apps use far less mobile data and are more likely to get through. In every case, however, old-fashioned landlines are ideal, since they can be used without power. Mr. Stripling also suggested that getting into amateur or HAM radio is helpful, especially for times when traditional communication networks are down. Finally, don’t forget old-fashioned rendezvous points. If you have no communications at all, it’s critical to have a spot everyone knows to meet up just to make sure everyone is safe. 2. Learn about the hazards and most likely disasters in your area. Not every region is prone to the same types of disasters. If you live on the coast, make sure you talk about plans for coastal storms and flooding. If you live in the Midwest, make sure you’re all on the same page about tornadoes and catastrophic storms. Western state residents may want to talk about mudslides and wildfires. Everyone should probably discuss things like terrorism or other man-made disasters. In every case, people respond better in an emergency if they’ve talked about possible threats before they occur. “It’s also incredibly important to understand that disasters don’t impact people equally — they tend to exacerbate existing vulnerabilities,” Mr. Stripling said. “So you need to understand the vulnerabilities in your neighborhood — things like poverty, housing discrimination or unequal transportation access — since these elements often point to where the worst consequences will occur.” 3. Understand your neighborhood and how your neighbors can help one another. If everyone is going to rely on one another, think about what is convenient and makes sense for each person. “Maybe one neighbor runs a store and could help stock food supplies for the whole team, and another has a vacation home or relative’s house that could serve as a rendezvous point,” Mr. Stripling said. “The neighbor who lives within walking distance of the school could be in charge of kid pickup if transportation goes down. Or someone owns an S.U.V. or boat that could help evacuation procedures. Everyone brings something to the table — and the more diversity your team has, the more powerful it will be.” Ideally, everyone in your community will be willing to pitch in with their own unique skills, abilities and perspectives to help everyone stay safe and protected. Additionally, while everyone should pool resources in a way that makes sense, you should all be willing to back one another up, even if it doesn’t seem like a particular role is your best fit. If the neighbor responsible for kid pickup is out of town when a blizzard hits, someone else should be ready to step in. Best of all, the closer and more tight knit you are before a disaster, the more you’ll be willing to cover the gaps when one happens. Be ready before help arrives Most of us are taught that in an emergency, first responders like police officers, emergency medical personnel and firefighters will be the first ones to get there and help victims. In reality, bystanders and neighbors are usually first — and in the best position to help save lives — especially after a disaster significant enough that it may take time for those emergency workers to arrive. Mr. Stripling suggested reading the Federal Emergency Management Agency’s “ Until Help Arrives ” program and sharing it with your community group. Similarly, he pointed to the New York City Health Department’s Bystander Training Course as another useful resource even for people who don’t live in New York. Keep in mind that most disasters are much worse for people who are already the most at risk. For example, elderly neighbors, people who live alone, or people with disabilities that make evacuation difficult. Make sure people in your group know who in the area may need a helping hand if disaster strikes, and check in on them or be ready to help them evacuate. Mr. Stripling also noted that this extends beyond storms, earthquakes or catastrophic events. Consider that extreme heat waves or cold snaps claim more lives every year than many other “traditional” disasters, and plan to take care of one another accordingly. Additional Reading • The Department of Homeland Security Community Emergency Response Team Program • The D.H.S. Citizen Corps training program • The Department of Health and Human Services’ Medical Reserve Corps • The FEMA Community Preparedness Toolkit • The New York City Health Department’s Emergency Threats FAQs Continue reading the main story","With some careful planning, persuading strangers to help one another in case of an emergency will mitigate damage and build strong community bonds.",2018-02-15T07:45:01Z,"{'id': 'the-new-york-times', 'name': 'The New York Times'}",How to Prepare Your Community for a Disaster,https://www.nytimes.com/2018/02/15/smarter-living/prepare-your-community-for-a-disaster.html,https://static01.nyt.com/images/2018/02/13/smarter-living/13sl-disaster1/13sl-disaster1-facebookJumbo.jpg,the-new-york-times,The New York Times,damage,0
https://www.facebook.com/bbcnews,"Image copyrightNew Taipei City Police DepartmentImage caption
 The damages are not covered by Lin Chin-hsiang's car insurance policy
A young Taiwanese man who dozed off in his car and crashed into three Ferraris got the shock of his life when he was told it would cost 12 million Taiwan dollars ($390,000; £310,000) to pay for the repairs.
But a public outpouring of support and donations to help him pay what at first seemed an insurmountable sum has stunned the 20 year old. 
Lin Chin-hsiang's predicament has gripped Taiwan and the response from the public reflects growing dissatisfaction with the island's widening wealth gap, which has left many low-income families like Mr Lin's struggling to make ends meet.
The young man from a single parent family dropped out of college earlier this year to help his mother at the family's shop that sells incense and gold paper money (burned during worship) in New Taipei City. His father died from illness a few years ago.
He works nightshifts at a barbecue restaurant and, after finishing at 03:00 on Sunday, he returned home to find his mum not feeling well, and so decided to help her deliver an order to a nearby temple in time for a ceremony.
It was around 05:40 in the morning when, exhausted from working all night, he fell asleep at the wheel and crashed into the Ferraris. 
They were among four luxury cars that belonged to a group of friends who were meeting up before a scenic drive. The owners were standing near the vehicles and no-one was injured.
Image copyrightNew Taipei City Police DepartmentImage caption
 Lin Chin-hsiang was helping his mother with an early morning delivery after an overnight shift at a restaurant
""I thought: 'Oh no, I've gotten myself into a big mess.' I was really worried about bringing trouble to my mother and having to pay so much money. I wanted to help her, but made things worse"" Mr Lin told the BBC on Wednesday.
Police said he had not been drinking alcohol and had a clean driving record.
Local media contacted luxury car dealerships and repair shops to calculate that the repair bill would be 12 million Taiwan dollars. 
What happened next was something Mr Lin and his family, trying to figure out how they could pay such a huge sum, had not expected.
Dozens of people called the local police station handling the accident and offered to donate money to help pay Mr Lin's repair bill or his legal fees. Some of them even turned up at the family's shop - a shack made of sheet metal, which also serves as their home. 
""I'm really grateful to everyone who has offered to help and who has come here to encourage me. Some people even drove up from central Taiwan and asked me where they can donate money. Some spent a long time looking for our shop, some are not in good situation, but they still gave money,"" he said, sounding overwhelmed by what has happened.
""Some people gave 5,000 ($160) or 10,000. They just said 'In the future, you just have to help society.'""
Image copyrightNew Taipei City Police DepartmentImage caption
 The Ferrari owners were going on a scenic drive together
The local authorities have asked people who want to help Mr Lin to direct their funds to an official account.
More than 100 donations have been made - the smallest equal to about $4 and the largest almost $6,500. In total 740,000 Taiwan dollars ($24,000) have already been raised.
The college Mr Lin dropped out of has meanwhile invited him to return. He was in his last year of middle school when his father died. He has an older brother who is working and a sister in high school.
Since the story hit the news, some Taiwanese social media users have called on the Ferrari owners to forgive Mr Lin and not demand money from him, given his circumstances.
One owner, however, has publicly said that he worked hard to be able to buy the car and would like to be compensated for the damage.
Mr Lin says the Ferrari owners have been kind and have not insisted he pay the bill all at once. They have instead suggested he could start eventually paying in instalments while they consult their insurance companies on how much the policies will cover.
Ferrari: What happened to F1's most ruthlessly successful team?
With a monthly salary of 35,000 Taiwan dollars ($1,136), it would take Mr Lin 28 years to pay the full cost of the repairs. His family's vehicle insurance policy only covers injuries not damages.
But he insists that covering the cost is the right thing to do.
""I'm really sorry to have hit their cars, really sorry. It wasn't intentional Even though it will take a long time, I committed a wrong. I should still pay for it.""",Taiwanese people open their wallets to help a low-paid man foot a rather large bill for the damage.,2018-12-19T12:36:21Z,"{'id': 'bbc-news', 'name': 'BBC News'}",Sympathy for overworked Taiwan man who ploughed into Ferraris,https://www.bbc.co.uk/news/world-asia-46619532,https://ichef.bbci.co.uk/news/1024/branded_news/787F/production/_104874803_e0855913-b037-4b8e-9238-6bb9941e1763.jpg,bbc-news,BBC News,damage,0
MIRIAM JORDAN and MATT STEVENS,"In late February, California’s stone-fruit and nut trees wake up from their winter dormancy, begin to bloom and enter a growth spurt that stretches until the summer harvest. “Trees in bloom are very, very fragile,” said Ryan Jacobsen, executive director of the Fresno County Farm Bureau. “Freezing temperatures can burn the flowers or harm fruit that is just being set.” Growers worked around the clock to implement frost-protection measures, such as irrigating their orchards to create a warmer environment around the trees. Extremely low temperatures have also kept bees in their hives, instead of on the job pollinating. “Not only are we losing crops, but bees aren’t flying,” Mr. Jacobsen said, adding, “The bees make your crop.” Subfreezing temperatures are more likely to impact California agriculture in December and January, when the citrus harvest is underway. Temperatures plunged to the 20s only briefly around Christmas last year, sparing this season’s production. Half of the navel orange and mandarin crop is still on trees, but citrus industry officials said they were not worried. Smaller almond and stone-fruit crops could push up prices for consumers. “We’re casting a wary eye on the forecast,” Mr. Chandler, the grower, said. “If Mother Nature keeps going cold, there’s not much that worrying is going to do to save the crop.” California Online (Please note: We regularly highlight articles on news sites that have limited access for nonsubscribers.) Photo Demonstrators supporting the Deferred Action for Childhood Arrivals program in Manhattan. Credit Shannon Stapleton/Reuters • The Supreme Court turned down a request from the Trump administration to decide whether it was entitled to shut down DACA. That means the Dreamers could remain in legal limbo for many months unless Congress acts. [ The New York Times ] • President Trump is scheduled to finally visit California in mid-March to see prototypes for a potential border wall and learn more about the construction. He will also visit Los Angeles to attend a Republican National Committee fund-raiser. [ The Washington Post ] • California regulators have given the green light to truly driverless cars. As of April 2, autonomous vehicles will no longer need to have a person in the driver’s seat who can take over in the event of an emergency. [ The New York Times ] • The California Supreme Court ruled that lengthy prison sentences for juveniles who commit crimes other than homicide are unconstitutional. The court said such punishments don’t recognize a young person’s ability to change. [ The Associated Press ] • In a series of editorials, The Los Angeles Times declares its city’s homeless crisis “a national disgrace.” [ The Los Angeles Times ] Photo Stacey Dash at the Academy Awards in 2016. Credit Chris Pizzello/Invision, via Associated Press • The actress Stacey Dash, best known for starring in the 1995 movie “Clueless,” is now running for Congress — in a heavily Democratic district in the southern suburbs of Los Angeles. [ The New York Times ] • Macy’s is downsizing its physical footprint in San Francisco again. The company says it is looking to sell the former I. Magnin building — part of its flagship store in Union Square. [ The San Francisco Chronicle ] • San Diego’s top library official wants to eliminate fines to avoid cutting off library access to poor residents. [ The San Diego Union-Tribune ] • As recently as two weeks ago, the Weinstein Company looked as if it had found a way forward. Here’s how a deal to sell it fell apart. [ The New York Times ] • One year later, here’s a comprehensive oral history of the Oscars’ envelope fiasco. [ The Hollywood Reporter ] • The Walt Disney Company has unveiled plans for its “Star Wars” land. [ The Orange County Register ] Photo Gustavo Dudamel leads the Vienna Philharmonic at Carnegie Hall. Credit Hiroyuki Ito for The New York Times • Gustavo Dudamel, the music director of the Los Angeles Philharmonic, led three concerts with the Vienna Philharmonic at Carnegie Hall over the weekend. [ The New York Times ] • For Asian-Americans, these Olympics felt like a watershed moment. But there were plenty of frustrating media missteps that felt all too familiar. [ The Los Angeles Times ] • So many people are fleeing the Bay Area, U-Haul is running out of moving trucks. Renting one will really cost you. [ SFGate ] • Where exactly did the term “ Gourmet Ghetto ” come from? [ Berkeleyside ] And Finally... Photo Canter’s Deli in Los Angeles. Credit Misha Erwitt for The New York Times Smack in the middle of Los Angeles, Canter’s Deli has long provided Angelenos — a few of them famous — with a comforting respite in the wee hours of a weekday morning. After the bars close, the decades-old landmark of a restaurant has stood ready to receive customers seeking endless coffee refills, a plate of pickles, enormous pastrami sandwiches and an entire booth they could claim for themselves. But this month, the deli announced on Twitter that it was suspending weekday dine-in service between 3 and 8 a.m. Owners acknowledged that customers’ preferences have shifted to delivery (“most of you really like to eat our delicious sandwiches and black&amp;white cookies at home in your pjs”) and appeared well aware of the need to keep sit-down dining available all night on Fridays and Saturdays (“We know you need us after the after parties”). It’s a small alternation, sure, but a concerning one to some longtime locals who have watched the slow decline of Jewish delis in L.A., fretted over Gary Canter’s sudden death and become disheartened over the “C” grade the restaurant got from health inspectors last year. Gentrification has already remade the corridor in which the deli resides. Critically acclaimed restaurants, a coffee shop hawking artisanal breakfast burritos and streetwear vendors with lines out the door now fill the district, which was once considered a hub of Jewish life in Los Angeles. “Change is hard,” Canter’s tweeted. “But our food will still be the same.” California Today goes live at 6 a.m. Pacific time weekdays. Tell us what you want to see: CAtoday@nytimes.com. California Today is edited by Julie Bloom, who grew up in Los Angeles and graduated from U.C. Berkeley. Continue reading the main story","Tuesday: “There will be damage,” a grower warns, the Supreme Court turns down a DACA request, and a decades-old Jewish deli makes a change.",2018-02-27T13:56:33Z,"{'id': 'the-new-york-times', 'name': 'The New York Times'}",California Today: California Today: Some Central Valley Crops Imperiled by Cold,https://www.nytimes.com/2018/02/27/us/california-today-central-valley-crops-freeze.html,https://static01.nyt.com/images/2018/02/21/us/21caltoday1/21caltoday1-facebookJumbo.jpg,the-new-york-times,The New York Times,damage,0
