author,content,description,publishedAt,source,title,url,urlToImage,source_id,source_name,types,yes_disaster
https://www.facebook.com/bbcnews,"Image copyright Reuters Image caption Certain details about the rescue are only now coming to light After 17 days underground, all the Thai boys and their football coach have safely escaped from the Tham Luang cave complex. A team of Thai and international divers mounted a dangerous and complicated rescue to bring the boys out, and details of the bid are still emerging now. BBC correspondent Jonathan Head has answered some of the core questions about the boys, the rescue attempt, and what happens next. Why did the kids go so deep into the cave? We will not know that until we hear from them and their assistant coach, Ekkapol 'Ek"" Chantawong. On that Saturday they were scheduled to play a match, which was cancelled, according to head coach Nopparat Kanthawong. He scheduled a training session instead. The boys were keen cyclists so on the Facebook chat group through which they communicated with the parents, coach Ek suggested they cycle to the football field. There was no suggestion there that they would go on to the caves. Image copyright Facebook/ekatol Image caption A Facebook photo shows the coach with some of the young footballers Saturday was the 16th birthday of Pheeraphat 'Night' Sompiengjai, and a local shop said the boys spent more than 700 baht (US$22) on food to celebrate, a large sum in this area. Coach Nop describes Ek as being very kind-hearted and devoted to the boys. He thinks the boys persuaded him to go with them into the caves. The caves are well-known in the area and had been explored by the boys before. The best guess is they went quite deep, which is easy when they are dry, got caught by rising flood water, and were forced to go even deeper. What kind of communication have the children had with their parents and why are they not being allowed to see them? The official explanation is they are weak from their ordeal and potentially vulnerable to infection. These are now very precious lives in Thailand. A massive effort has been made to get them out alive. The Thai authorities are taking no chances. Media caption The boys give victory signs as they recover in hospital Perhaps they also wanted to avoid the excitement of seeing their parents again. Thais are generally less physical than westerners. Hugging is unusual. And the parents are from poor, marginal communities, used to being told what to do by officials, and probably grateful for the lengths the government went to in rescuing them. They would not protest. They were allowed to see them through windows, and are gradually being allowed in, wearing gloves and facemasks, to stand in the same room. Will coach Ek face any disciplinary proceedings? At this stage that seems unlikely. The parents say they have forgiven him, and they are grateful for the efforts he is reported to have made to keep their spirits up in the caves, in particular through meditation, which he learned during 12 years as a monk. Coach Nop said Ek may be asked to go back to being a monk for three months, something Thais typically do as a kind of penance, or to replenish or cleanse themselves spiritually. Such a move would make a lot of sense to Thais, and he would likely be allowed to resume life as normal after that. Also Thailand typically does not have a 'blame culture', where a culprit must be found for any misadventure. There is a more fatalistic acceptance of things going wrong, less public clamour for accountability. How did they survive so long with so little food, and lose so little weight? The boys were in the caves nine days before they were found. They may have had a little food from what they bought to celebrate Night's birthday. They are passionate football players, very fit, and with the training they have had a tight-knit team. This would have helped them ration their food carefully and support each other, perhaps with songs. Media caption Child psychiatrist: ""It will be a challenge for these children to go back to normal life"" Coach Ek taught them to meditate, say Thai navy divers, and gave them more food than he ate. He also told them to drink water dripping from the rocks, rather than polluted ground water. During their last six to eight days they were being fed, initially high-protein gels, but later more normal food, which might have allowed them to start putting on a little weight before coming out. Were they in the dark the whole time? Most of the time. They went in with cheap torches, which would not have lasted long. It is likely they were in the dark for most of the first nine days of their ordeal. Once they were found a Thai army doctor and at least three divers stayed with them, equipped with good torches. Even so they were mostly in the dark, and had to wear sunglasses when they were first brought out. Image copyright Thai Navy SEALs/Getty Images Image caption Rescuers brought them food, light and letters from their parents to help them cope Were they sedated in any way? The Thai authorities are being very coy about this. Prime Minister Prayuth Chan-ocha said they had been lightly sedated. But the BBC has spoken to a number of people involved in the operation who say the boys were heavily sedated, and only semi-conscious. The logic for this would be the fear their rescuers had that they would panic when wearing diving equipment for the first time in darkness and swirling cave water, endangering the lives of all of them. The two British cave divers who led the rescue effort, John Volanthen and Richard Stanton, are believed to have asked for Australian Richard Harris, a cave diver and anaesthetician, to assist in preparing the boys. How they carried semi-conscious or very drowsy boys through the technically challenging early stages of the journey out, with a lot of diving in narrow passages, we do not know. At times they may have been strapped to a diver's body. Later they were strapped on to a stretcher and suspended from a rope pulley system attached to the cave roof. The entire operation was complex, innovative and very bold. Nothing like it has been attempted before. Some of those involved described the tasks undertaken by the core divers, who carried the boys out, as superhuman. Who has paid for this operation? The Thai government, for most of it. It is likely that the contribution by other countries, like the 30 US air force personnel who went to help, would have been funded by their own governments as a gesture of good will. Many Thai businesses supported with transport and food. Thai Airways and Bangkok Airways offered free flights to some of the foreign divers coming in. Media caption Thailand cave rescue: Meet the volunteer helpers Could the Thais have done this on their own? No, and few countries could. Cave diving is a very specialised skill, and expert cave rescuers are even rarer. Thailand was fortunate that an experienced caver Vern Unsworth has explored the Tham Luang cave complex extensively, and lives nearby. He was on the scene the day after the boys disappeared, and suggested that the Thai government needed to invite expert divers from other countries to help. The Thai navy divers who went down initially struggled, because both their experience and equipment were for sea diving, which is very different. They were driven out of the caves by rapidly rising flood water, and finding the boys seemed a hopeless cause. Once foreign divers arrived, from many different countries, the Thai authorities allowed them to devise first the search, and then the enormously complex rescue. It was a huge logistical operation involving hundreds of people, building guide rope and pulley systems, putting in power and communication cables. It is to Thailand's credit that it was organised so well, and there was no attempt to diminish the foreign contribution. Do you have a question about the Thai cave rescue? Please send your questions to haveyoursay@bbc.co.uk. You can also contact us in the following ways: Email HaveYourSay@bbc.co.uk Tweet: @BBC_HaveYourSay WhatsApp: +44 7555 173285 Text an SMS or MMS to 61124 (UK) Please read our terms &amp; conditions and privacy policy",Why are the boys in quarantine? Were they sedated during the rescue? We answer the key questions.,2018-07-11T23:53:28Z,"{'id': 'bbc-news', 'name': 'BBC News'}",Cave rescue: Key questions answered,https://www.bbc.co.uk/news/world-asia-44799779,https://ichef.bbci.co.uk/news/1024/branded_news/0B8D/production/_102475920_tv048054739.jpg,bbc-news,BBC News,rescue,1
https://www.facebook.com/bbcnews,"Image copyrightGetty ImagesImage caption
 Emiliano Sala was returning to Cardiff after signing for the club on the weekend
The search for a missing aircraft that was carrying Cardiff City footballer Emiliano Sala will resume at sunrise.
The Argentine striker, 28, was one of two people on board the plane which lost contact off Alderney in the Channel Islands on Monday night.
Five aircraft and two lifeboats scoured more than 1,000 sq miles for traces of the Piper Malibu plane on Tuesday.
Sala was heading to the Welsh capital after signing for the Bluebirds from French club Nantes in a £15m deal.
Cardiff's chief executive said the club had been left in ""shock"".
Air and sea crews from the Channel Islands, France and the UK took part in a 15-hour search on Tuesday, but found no trace of the aircraft or its occupants.
Guernsey Police was not able to confirm if floating objects seen belonged to the aircraft and warned that chances of passenger survival were ""slim"".
""We have found no signs of those on board,"" the force tweeted. ""If they did land on the water, the chances of survival are at this stage, unfortunately, slim.""
Sala's father Horacio told Argentine TV channel C5N he was ""desperate"".
On Tuesday night, football fans in Nantes laid flowers at a fountain as a tribute to Sala and the plane's pilot. 
After joining in 2015, he had scored 48 goals for the Ligue 1 side.
French sports newspaper L'Equipe carried the news of Sala's plight on its front page on Wednesday with the headline: ""The disappearance of a warrior"".
It wrote: ""In Nantes, the wait has been unbearable for the supporters of a forward loved for his battling qualities.""
Image caption
 Nantes fans gathered in the city to pay tribute to their former striker
Image caption
 Map showing location of Alderney and lighthouse
The single-turbine engine plane left Nantes, in north-west France, at 19:15 on Monday and had been flying at 5,000ft when it contacted Jersey air traffic control requesting descent.
It lost contact while at 2,300ft and disappeared off radar near the Casquets lighthouse, infamous among mariners as the site of many shipwrecks, eight miles (13km) north-west of Alderney.",Rescue workers are set to restart their hunt for a plane carrying Emiliano Sala which vanished on Monday.,2019-01-23T04:06:06Z,"{'id': 'bbc-news', 'name': 'BBC News'}",Emiliano Sala: Search for Cardiff City FC player's plane to resume,https://www.bbc.co.uk/news/uk-wales-46966424,https://ichef.bbci.co.uk/news/1024/branded_news/BA03/production/_105291674_sala.jpg,bbc-news,BBC News,rescue,1
JENNIFER MEDINA,"Mudslides in California left devastation in their wake. At least 17 people have been killed, and search and rescue workers are hunting for the more than 40 still missing. A member of a search and rescue team waded through mud and debris in Montecito, Calif. Credit Justin Sullivan/Getty Images The wildfire that ravaged much of Ventura and Santa Barbara Counties last month was the largest in California history. But it was the mudslides this week that proved far more deadly, killing 17 people. Rescue crews were looking for more than 40 people still missing on Friday morning. Officials said they expect the death toll to rise. People dug through the mud as they looked for salvageable items. Credit Justin Sullivan/Getty Images The mud came more rapidly and strongly than anyone predicted. Although Santa Barbara officials recommended on Monday night that residents should evacuate, few were alarmed by the suggestion and they stayed put, only to be woken by the sounds of boulders tumbling down the hills. Bill Asher walked through mud in his home in Montecito, Calif. Credit Marcio Jose Sanchez/Associated Press The thick mud felt much like wet cement, leaving dozens of residents stuck for hours while they waited to be rescued. More than 100 homes were destroyed. On some properties, nothing remained but the foundation. Searching for bodies in the deep mud. Credit Marcio Jose Sanchez/Associated Press Search and rescue workers used long poles to probe for bodies in the mud. In many places it was impossible to tell whether the mud was solid — one official compared it to a candy shell on top of ice cream. Mud and debris covered the front of a Mercedes-Benz. Credit Justin Sullivan/Getty Images Many residents said they were shocked to see the size and number of boulders that had come tumbling down the mountain into the streets, some as large as cars. A car damaged by the mudslides. Credit Kyle Grillot/Reuters Nearly all of the roads to the area remained closed on Friday, making it nearly impossible for residents to get across town and forcing rescue teams to rely on fire trucks and airlifts. The 101 freeway was covered in mud. Credit Kyle Grillot/Reuters The 101 freeway was completely closed off Thursday, turning Montecito into a kind of island. A member of a search and rescue team surveyed a home. Credit Justin Sullivan/Getty Images Family members of some of the victims killed in the mudslides said that the city should have made the mandatory evacuation zone larger. While many were reluctant to move out for the second time in a month, it could have saved lives, they said. Jordan Castro, a Fremont firefighter, checked a vehicle that had been washed to the shore. Credit Mike Nelson/European Pressphoto Agency The bodies of several victims were dragged — along with cars and other debris — a mile away from their homes, in some cases all the way to the beach. Emergency workers looked for survivors. Credit Robyn Beck/Agence France-Presse — Getty Images By Friday morning, rescue workers were still holding out hope that those stranded in the mud would find a way to stay alive. Officials warned residents that it could be weeks before they were allowed to return to their homes.","At least 17 people have been killed, and search and rescue workers are hunting for the more than 40 still missing.",2018-01-12T18:31:40Z,"{'id': 'the-new-york-times', 'name': 'The New York Times'}",What the Aftermath of a Deadly Mudslide Looks Like,https://www.nytimes.com/2018/01/12/us/california-mudslides-photos.html,https://static01.nyt.com/images/2018/01/13/us/13mud-vis01/13mud-vis01-facebookJumbo.jpg,the-new-york-times,The New York Times,rescue,1
https://www.facebook.com/bbcnews,"Image copyright Getty Images Image caption The accident took place close to the cable car station on Table Mountain The bodies of a tourist and his guide have been recovered from South Africa's Table Mountain following an accident which trapped hundreds of people at the top of the popular attraction. The man, his local guide and a second tourist are reported to have been using ropes to scale the front of the Cape Town mountain when they fell on Monday. Rescuers then used the cable car to reach the surviving climber. But the bodies were not recovered until first light on Tuesday. The tourists are understood to be of Asian origin, while the guide was a South African, a spokeswoman for South Africa's Sanparks, which runs the country's national parks, told the BBC. According to local media reports, the cable car service - which takes thousands of people up and down the mountain every day - was out of action for more than five hours. About 800 people were eventually able to get down at around 22:00 local time (20:00 GMT). John Marais, of Wilderness Search and Rescue, explained to South African news site TimesLive that after their accident, the two climbers were seen ""dangling"" on ropes about 150 metres below the cable car station. A picture shared on social media shows one rescuer administering CPR to a person on a narrow ledge.",Hundreds were trapped at the top while rescue workers use the cable car to reach the climbers.,2018-01-02T11:20:39Z,"{'id': 'bbc-news', 'name': 'BBC News'}",Two die climbing Table Mountain,http://www.bbc.co.uk/news/world-africa-42541740,https://ichef-1.bbci.co.uk/news/1024/cpsprodpb/CA1F/production/_99434715_c08c24ba-1bc1-47dc-a4e0-87bb5fd1786e.jpg,bbc-news,BBC News,rescue,1
Wendy Dent,"Around 6 pm Tuesday at Tham Luang in Thailand, the last of the 13 survivors who had spent 18 days trapped in a cave emerged to safety. A rescue team had spent the past three days getting the boys out after five days of desperate planning and calculations since their discovery. As the boys’ oxygen supply dwindled, doubts in the rescuers’ ability to save them mounted. The boys weren’t trained scuba divers, and they were facing a voyage on which a pro Thai Navy SEAL died, while placing oxygen tank supplies along the route. Then Elon Musk entered the fray, apparently at the humble request of a Twitter follower: What followed was a curious few days where two rescue operations played out simultaneously. The first was the official one in Thailand that ultimately proved successful, and the second was run by Musk—an unsolicited effort that Thai authorities ultimately called “not practical for our mission” but one that captivated the internet and reinforced the most flattering image of Musk: as a brilliant engineer with a nose for unexpected solutions to pressing problems, delivered in record time. In his inimitable fashion, Musk started tossing out fresh ideas for ways to free the boys, chatting with his followers. It inspired a wealth of budding engineers to brainstorm and send hand-drawn designs his way too. ""Boring Co has advanced ground penetrating radar &amp; is pretty good at digging holes. Don’t know if pump rate is limited by electric power or pumps are too small. If so, could dropship fully charged Powerpacks and pumps."" For a mogul who has spent recent months fighting with the press and a few investors, it was a chance to put those skills and an ample bank account to use for an unambiguously great cause, with no frustrating quibbling over production rates or financial figures. So, never one to keep a single project in mind, Musk started down two paths. For the first, he tapped Wing Inflatables. The SpaceX contractor is based in Arcata, California, 350 miles north of San Francisco. “We manufacture inflatable recovery parts for SpaceX,” says CEO Andrew Branagh. “So we have a relationship. When Elon had an idea, he asked our engineering team to get a hold of us."" So they hopped on a conference call. “Elon Musk was on the call,” Branagh says. “He was very visionary. I was impressed. They were open to our ideas."" The result of the collaborative brainstorm was a red kevlar pouch of sorts, designed to carry the boys. The ""inflatable tube with airlocks,"" as Musk called it, could be pulled along, stretcher style, by a trained diver, freeing the boys from needing to learn how to dive or use scuba gear. ""They are like a bell chamber,"" Branagh says. Just as a church bell tower contains or releases sound by closing or opening a series of vents, the inflatable tube with airlocks uses air pressure to control the buoyancy, necessary for moving through a cave complex where you occasionally have to drop down to keep moving forward. When you turn parts of the pods one way, it allows them to float. ""When you turn them another way, they sink."" (To keep the boys calm during a long, claustrophobic voyage, Branagh suggested valium.) They moved fast and worked hard. ""We started with a concept at 8 am and had a prototype in the pool being tested the same day,” Branagh says. “Then the team stayed until 1 in the morning and built more units.” Enough units to get all 12 boys, plus their coach, out of the cave and into the daylight. The following afternoon, Musk’s jet touched down in Arcata to pick up the potential life savers. “A third of the factory went to the plane to wish it luck,” Branagh says. The pouches that went into the jet, however, never appeared in the public light, and it’s not clear where they ended up. Musk never mentioned them on Twitter. While Branagh and his team were racing to put them together, Musk was hedging his bets with another design approach. Made from an oxygen tube designed for a SpaceX Falcon rocket, the bullet-shaped capsule followed the same principle as the pouch the Wing team devised, an air pressure–controlled vehicle of sorts for the boys to lay inside while the pro divers guided them to safety. Musk called it a ""kid-sized submarine” and said it was 12.2 inches in diameter, skinny enough to fit through the narrowest “choke hold” of the passage. He called it Wild Boar, in honor of the boys’ soccer team. ""Good for rescuing vulnerable patients in dangerous environments,"" he tweeted, ""particularly if water, toxic gas or dangerous bacteria/viruses present, as patient would remain dry &amp; at [standard] air pressure entire time."" And because Musk is always thinking on a few tracks at once, he noted, “with some mods this could also work as an escape pod in space."" As the engineering process sped along, Musk updated the public with a steady stream of tweets. The aluminum capsules could use a thin layer of neoprene insulation, he said, and their buoyancy would be controlled by strapping diving weight belts around them. Musk also considered one follower’s suggestion to add a music player to the setup. ""Yeah, that sounds cool,” he replied. “Music makes things better. Calms the mind. Adding padded wall pockets for a hand radio &amp; phone/music player."" But by the time Musk’s team had tested its design in a Los Angeles pool, on Saturday, the rescue operation was already underway in Thailand, and Musk’s help wasn’t needed. “Will continue testing in LA in case needed later or for somewhere else in future."" Still, Musk put the design on his plane and made the trip over the Pacific. When he arrived, it was day three of the rescue. Eight boys were already out safe, thanks to the low-tech diving method, and the remaining four boys and their coach would soon be free. He dropped off the mini-sub in one of the caves in the long complex. ""Leaving this here in case it may be useful,” he tweeted. “Thailand is so beautiful.” It’s unclear whether the design could have been helpful had it arrived earlier, and whether the hastily assembled capsule would have met the demands of the diving and medical experts on the scene. Representatives for SpaceX and Musk declined to answer questions about various details of the process, including the team’s communications with local authorities. Whatever the answers, Musk was eager to play a role in the rescue. And for that, he faced accusations that he inserted himself in the situation to promote himself. “Musk has a long track record of promising to solve huge problems and then either missing deadlines or falling short,” Adam Clark Estes wrote in Gizmodo. “Along the way, he’s also built up a cult of personality that leads fans to compare him to comic book superheroes. So even if Musk isn’t really serious about his ridiculous, buzz-building projects, plenty of people still think he is.” Musk again took to Twitter to parry the critique: “This reaction has shaken my opinion of many people. We were asked to create a backup option &amp; worked hard to do so. Checked with dive team many times to confirm it was worthwhile. Now it’s there for anyone who needs it in future. Something’s messed up if this is not a good thing.” By Wednesday afternoon, he’d moved on to a new problem that needs fixing. “Please consider this a commitment that I will fund fixing the water in any house in Flint that has water contamination above FDA levels,” he tweeted. “No kidding.” More Great WIRED Stories","The SpaceX and Tesla CEO's work to help the rescue operation captivated the internet and reinforced the most flattering image of Musk, as a brilliant engineer with a nose for unexpected solutions to pressing problems.",2018-07-11T22:20:31Z,"{'id': 'wired', 'name': 'Wired'}",The Engineering Behind Elon Musk's Bid to Save Thailand's Cave Boys,https://www.wired.com/story/elon-musk-thailand-cave-boys-rescue-engineering/,https://media.wired.com/photos/5b452bc49bc3f356f4059475/191:100/pass/Cave_AP_18176408805848.jpg,wired,Wired,rescue,1
