author,content,description,publishedAt,source,title,url,urlToImage,source_id,source_name,types,yes_disaster
https://www.facebook.com/bbcnews,"Image copyrightSDFDImage caption
 Firefighters released a photo of the malfunctioning gondola ride
More than a dozen people trapped on a ride are being rescued at the SeaWorld amusement park in San Diego. 
Around six gondolas stopped functioning on Monday night after a gust of wind tripped a circuit breaker on the Bayside Skyride, police in the US city told FOX5 News. 
Some 16 people were trapped on the ride, some of them in gondolas suspended above water.
So far, 14 have been rescued, says the San Diego fire rescue department.
The National Weather Service says it was about 49F (9C) in San Diego at the time of the incident.",US firefighters work to bring down people trapped on an airborne ride at SeaWorld in San Diego.,2019-02-19T07:04:18Z,"{'id': 'bbc-news', 'name': 'BBC News'}",SeaWorld rescue: People trapped on ride in San Diego,https://www.bbc.co.uk/news/world-us-canada-47289125,https://ichef.bbci.co.uk/news/1024/branded_news/0514/production/_105700310_b3a84a4c-7379-487c-a961-d259d812695a.jpg,bbc-news,BBC News,rescue,1
NORIMITSU ONISHI,"But as a fuller picture of the calamity has emerged in the past few days, pledges of money and help have begun coming in from the United Nations, the European Union and individual nations. As aid began to pour in, neighbors across this blistered landscape tried to help one another.
Humanitarian groups are grappling with a double crisis: the brunt of the cyclone itself, and the severe flooding left in its wake.
Nearly a week after the storm hit, heavy rains were still endangering communities isolated by flooding, and complicating efforts by rescue workers to reach them. Rising floodwaters were threatening to partially submerge Buzi, a town of 200,000, not far from Beira, the United Nations warned.
Beira has become a place of refuge for people fleeing flooded areas, but on Wednesday, the whole town still lacked electricity. Cellphone service was extremely limited, and people thronged the few areas with connectivity along the main road.
Fallen trees had yet to be cleared from central Beira, an area with modern buildings and colonial Portuguese homes. Stores and other businesses were closed. There was no activity at the port, the sector that defines the city. Large stores owned by Indians and Chinese, more recent arrivals, were shuttered.
Roofs had been torn off many buildings, but the physical damage was limited.
The greatest destruction was found in the poor rural neighborhoods outside the city center. There, many poorly built houses had collapsed instantly when the storm hit.","Nearly a week after southern Africa was hit by one the worst natural disasters in decades, it was all rescue workers could do to try to reach the victims.",2019-03-20T23:15:30Z,"{'id': 'the-new-york-times', 'name': 'The New York Times'}",Rescuers Battle Flooding in Desperate Bid to Save Cyclone Victims,https://www.nytimes.com/2019/03/20/world/africa/cyclone-idai-rescue.html,https://static01.nyt.com/images/2019/03/20/world/20mozambique3/merlin_152347080_0a52cd69-308d-4aab-8299-e8666d2d11c5-facebookJumbo.jpg,the-new-york-times,The New York Times,rescue,1
Melanie Ehrenkranz,"New South Wales’ $340,000 investment in drones has apparently paid off in a major way. On Thursday, two teenage boys in Australia struggling offshore were saved thanks to a rescue drone, the BBC reported. Ben Franklin, Parliamentary Secretary for Northern NSW, told the Sydney Morning Herald that “it only took 70 seconds” for the drone— the Little Ripper UAV —to make its way to the boys and then drop the inflatable pod to rescue them. The drone, deployed by lifeguard supervisor Jai Sheridan, caught the whole thing on camera. “On a normal day that would have taken our lifeguards a few minutes longer to reach the members of the public,” Sheridan told the Sydney Morning Herald. The government’s investment in a fleet of drones is part of its nearly $13 million Shark Management Strategy program which was announced in 2015. Trials of drones as a means of aerial surveillance and real-time views of the coast are being held in a number of locations, including Lennox Head, where the two boys were reportedly rescued.","New South Wales’ $340,000 investment in drones has apparently paid off in a major way. On Thursday, two teenage boys in Australia struggling offshore were saved thanks to a rescue drone, the BBC reported. Read more...",2018-01-18T16:55:00Z,"{'id': None, 'name': 'Gizmodo.com'}",A Drone Just Saved the Lives of Two Teenage Boys in Australia,https://gizmodo.com/a-drone-just-saved-the-lives-of-two-teenage-boys-in-aus-1822192109,"https://i.kinja-img.com/gawker-media/image/upload/s--cmfJ9_fH--/c_fill,fl_progressive,g_center,h_450,q_80,w_800/ozhuxm9sod0u6nummsie.jpg",,Gizmodo.com,rescue,1
https://www.facebook.com/bbcnews,"A former Thai navy diver who joined in search efforts to rescue 12 boys and their coach trapped in a flooded cave in Thailand has died. He lost consciousness on his way out of the Tham Luang cave complex after delivering supplies to the group, officials told reporters. The diver had left the navy but had returned to help with the rescue operation. This breaking news story is being updated and more details will be published shortly. Please refresh the page for the fullest version. You can receive Breaking News on a smartphone or tablet via the BBC News App. You can also follow @BBCBreaking on Twitter to get the latest alerts.",A former Thai navy diver helping to rescue the boys trapped in a cave has died while taking in supplies - officials,2018-07-06T02:43:46Z,"{'id': 'bbc-news', 'name': 'BBC News'}",Diver dies in Thailand cave rescue attempt,https://www.bbc.co.uk/news/world-asia-44734385,https://ichef.bbci.co.uk/news/1024/branded_news/7A23/production/_97176213_breaking_news_bigger.png,bbc-news,BBC News,rescue,1
CARL HULSE,"Immigration activists were furious that Senator Chuck Schumer of New York, the Democratic leader, and his fellow Democrats had given away the best leverage they had to ensure that the young immigrants were protected. “It’s morally reprehensible and it’s political malpractice,” said Ezra Levin, the co-executive director of Indivisible, a liberal group. “Leader McConnell’s track record of keeping his ‘commitments’ is thin at best,” said Senator Jeff Merkley, Democrat of Oregon, one of the party’s leading progressive voices. Photo “I think if we have learned anything during this process, it’s that a strategy to shut down the government over the issue of illegal immigration is something the American people didn’t understand and would not have understood in the future,” Senator Mitch McConnell, the majority leader, said on Monday. Credit Gabriella Demczuk for The New York Times The fierce backlash underscored the challenge confronting Mr. Schumer and more centrist Democrats as they attempt to negotiate with Republicans and President Trump to reach an agreement on immigration without alienating the more liberal factions of a party that has moved distinctly to the left. Their balancing act reflects the broader tension in the party as it tries to reconcile the fervor of blue-state opponents of Mr. Trump and the caution of Democrats in states where they must appeal to Trump supporters. Democrats need to protect 10 Senate Democrats up for re-election in states carried by the president and appeal to the swing voters who could flip control of the House. Those vulnerable Senate Democrats were key to sparking the bipartisan drive to bring the shutdown. Yet many of the Senate Democrats considered potential 2020 presidential candidates voted to keep the shutdown going. Heading into the showdown, Mr. Schumer and other top Democrats figured that Mr. Trump was at a vulnerable moment, given the uproar surrounding racially charged comments made in a recent meeting with senators to discuss immigration, disturbing words that came on top of persistent accounts of Oval Office chaos. And they saw the so-called Dreamers — the young immigrants brought to the United States illegally as children — as a particularly appealing group, as they faced deportation to countries they barely knew through no wrongdoing of their own. Polling consistently finds deep American sympathy for those immigrants, and under intense pressure from the left to stand tough, Democrats hoped the public would embrace the use of all possible measures to help them. But over the course of the weekend, Democrats increasingly came to realize they had maneuvered themselves into a difficult position that made many of the party’s moderate senators uncomfortable. Republicans were not distancing themselves from the president despite his erratic swings on immigration policy. And while the Dreamers may be a highly sympathetic group, using them as a rationale for shuttering the federal government was not playing well. The president, top Republicans and their allies had some success in framing the showdown as a case of Democrats putting the interests of “illegal immigrants” ahead of American citizens, a line of attack Democrats felt they could not weather. Mr. McConnell, who sat at his Senate desk with a satisfied smile before the vote to reopen the government on Monday, archly drove that point home in brief remarks. “I think if we have learned anything during this process,” he said, “it’s that a strategy to shut down the government over the issue of illegal immigration is something the American people didn’t understand and would not have understood in the future.” In relenting so rapidly, Democrats saw some tangible benefits. They managed to highlight the plight of the Dreamers while avoiding a prolonged shutdown that could have ultimately damaged their cause. And by conceding defeat on Monday, Democrats avoided widespread disruptions in government operations that would have cascaded during the week and beyond. They also won the pledge from Mr. McConnell to allow broad bipartisan negotiations on immigration, overall spending, health programs and other unresolved issues. If those fail to produce an agreement by Feb. 8, he promised to open an immigration debate on the Senate floor. Senators on both sides of the aisle saw that as a breakthrough that could provide a chance for the polarized chamber to engage in what has become a rare occurrence: actual legislating. What they do not have is any certainty that Mr. Trump will back whatever legislation the Senate produces or that the House will even consider it. The agreement to end the shutdown came after weekend negotiations among a bipartisan group of about two dozen lawmakers assembled by Mr. Manchin and Senator Susan Collins, Republican of Maine. Members of the group all saw the shutdown as unacceptable and contributing to public disgust with Washington, motivating them to pursue a solution outside the chamber’s leadership. They say they are intent on finding a way to protect the immigrants covered by the Deferred Action for Childhood Arrivals, or DACA, program as well as fashioning a “global” agreement on spending, disaster aid and a variety of other issues that have defied resolution. Republican participation in the bipartisan group was crucial for Democrats seeking assurances from Mr. McConnell on the way forward. While they were nervous about accepting the word of Mr. McConnell given their history of clashes with him, they doubted that he would undercut such a substantial number of his fellow Republicans. “I expect the majority leader to fulfill his commitment to the Senate, to me and to the bipartisan group and abide by this agreement,” Mr. Schumer said. “If he does not, of course — and I expect he will — he will have breached the trust of not only the Democratic senators, but members of his own party as well.” Still, immigration activists found fault with putting any faith in Mr. McConnell. And they noted that even if the Senate can draft a measure that attracts a broad majority, it faces a steep test in the House, which ignored a 2013 Senate immigration measure that passed with 68 votes. Negotiations will now begin with Democrats in a new posture. During a Friday meeting with Mr. Trump aimed at settling the dispute, Mr. Schumer said Democrats would agree to provide significant funding for the wall along the Mexican border that Mr. Trump has made a central and symbolic element of his agenda. They had previously opposed any funding for the wall. While Democrats gave that ground, they are not without weapons. Should the negotiations collapse, they will be able to pound Republicans for abandoning the Dreamers. They could also vote again to shutter the government, though that seems unlikely after this episode. As lawmakers looked ahead to a few difficult weeks, Republicans chose not to crow over the outcome. “I think we should be magnanimous,” said Senator John Cornyn of Texas, the No. 2 Senate Republican, in what might be the most telling observation about which side prevailed. Continue reading the main story","Democrats had hoped the public would embrace the use of all possible methods, including a government shutdown, to come to the rescue of the young unauthorized immigrants known as the Dreamers.",2018-01-23T01:54:45Z,"{'id': 'the-new-york-times', 'name': 'The New York Times'}","News Analysis: Democrats Blink in Shutdown Impasse, Hoping for a Bargain",https://www.nytimes.com/2018/01/22/us/politics/schumer-democrats-shutdown.html,https://static01.nyt.com/images/2018/01/23/us/politics/23dc-assess-1/23dc-assess-1-facebookJumbo.jpg,the-new-york-times,The New York Times,rescue,1
Marcus Gilmer,"While the Woolsey Fire in southern California, is largely contained ( 96% as of Monday night ) some of the terrifying images from the last several weeks are continuing to trickle out, including the above video of an absolutely incredible rescue. The footage is harrowing, taken from a helmet cam, as rescuers navigate a helicopter among the wind, smoke, and fire to land safely and rescue three people and two dogs on Castro Peak near Malibu. SEE ALSO: Terrifying footage shows Southern California fires nipping at a highway It also offers up a rare perspective of what it takes to make these rescues, how complicated and dangerous they are and the risks taken by first responders in dire situations in this case LAFD Air Operations pilots David Nordquist and Joel Smith. Even more impressive is the way the pair kept calm and pulled off the rescue without a hitch. One even drily commented, ""That was enough excitement for me today."" True heroism.","While the Woolsey Fire in southern California, is largely contained ( 96% as of Monday night ) some of the terrifying images from the last several weeks are continuing to trickle out, including the above video of an absolutely incredible rescue. The footage i…",2018-11-20T16:08:06Z,"{'id': 'mashable', 'name': 'Mashable'}",Harrowing video shows helicopter rescue of several people and their dogs from California wildfire,https://mashable.com/video/helicopter-rescue-woolsey-fire-malibu/,https://i.amz.mshcdn.com/owbUn4Gb875njbgqok1MEC6Y3G8=/1200x630/2018%2F11%2F20%2F45%2F235d69803b774d0d8bce4b08c77517cb.4b3e8.png,mashable,Mashable,rescue,1
JACK HEALY and SHERI FINK,"Was this Summer Haven Lane? They couldn’t see any signs. “Where we going right now?” Mr. Tillman asked. They steered around mailboxes, branches, pulverized decking and other debris that could blow out the propeller. When the water got too shallow and the boat scraped bottom, the men hopped out and waded, grabbing pieces of fence post and siding to sound the depth of the water in front of them. Finally, a blue two-story house on Summer Haven Lane emerged from the trees. As they approached, a woman’s palm pressed up against a dark second-story window. “Hey! Can you go around to the porch so we can talk to you?” Mr. O’Neal yelled. Laura Tedder and her son, Dylan Evans, stepped out onto the second-floor balcony. Ms. Tedder said she had not realized there had been a mandatory evacuation, but had stocked her house with plenty of food and water. And though the churning river was lapping at the stairs to her house, Ms. Tedder said she did not want any rescuing. They had no power, but were recharging their phones with the spare power left over in her son’s laptop. They were planning to play Uno that afternoon. “This is our home,” Ms. Tedder said. “I guess we just feel safer here. It’s pretty much flooded most places anyway.” Mr. O’Neal asked, and asked again to make sure, but Ms. Tedder was firm. “We’ll be all right,” she said.",An improvised network of volunteers has sprung up to locate and rescue people who did not evacuate for Tropical Storm Florence.,2018-09-15T15:27:37Z,"{'id': 'the-new-york-times', 'name': 'The New York Times'}",Torrents of Water in Towns Across the Carolinas. And a Guy With a Boat.,https://www.nytimes.com/2018/09/15/us/florence-volunteer-rescue.html,https://static01.nyt.com/images/2018/09/16/us/16rescue1/16rescue1-facebookJumbo.jpg,the-new-york-times,The New York Times,rescue,1
RICHARD SANDOMIR,"Ms. Klaben and Mr. Flores crashed in terrain that was waist-deep in snow, with temperatures as numbing as 48 degrees below zero. Without wilderness survival training, Mr. Flores adapted nonetheless. He wrapped Ms. Klabens injured foot in her sweaters, covered the openings of the cabin with tarpaulins and tried, without success, to fix their radio to send out a distress signal and build rabbit traps. What little food Ms. Klaben and Mr. Flores had brought on board a few cans of sardines, tuna fish, fruit salad and a box of Saltine crackers was rationed and gone within 10 days. They drank water, some of it filtered through shreds of one of her dresses and boiled in an empty oil can. They ate bits of toothpaste that they squeezed from a half-filled tube and virtually nothing else, they said. Wed pretend the melted snow was soup, she told The Associated Press shortly after their rescue. Some days it would be tomato, then beef, then all the other varieties. To pass the time, they read books, including a book of poems by Robert Service and a Bible. At times, Mr. Flores tired to convert Ms. Klaben from Judaism to his Mormon faith. In early March, Mr. Flores left her for eight days walking the treacherous ridge in snowshoes he had made of tree branches and wire to find a clearing in the dense woods where they might be better seen from the air by bush pilots. He returned after finding a knoll about three-quarters of a mile away, and on Day 42 they set off for the spot, dragging a makeshift sled with their belongings. A few days later, he left her again and found a frozen pond on which he etched an enormous SOS sign, with an arrow that pointed to their campsite, hoping it would be seen from the air.","Helen Klaben is carried from a rescue airplane in the Yukon Territory in March 1963. She and the pilot of a single-engine plane, which had crashed, had just survived 49 days stranded in the snowy wilderness.",2018-12-12T00:34:42Z,"{'id': 'the-new-york-times', 'name': 'The New York Times'}","Helen Klaben Kahn, Survivor of a 49-Day Yukon Ordeal, Dies at 76",https://www.nytimes.com/2018/12/11/obituaries/helen-kleban-kahn-dead.html,https://static01.nyt.com/images/2018/12/12/obituaries/12KAHN1/merlin_147978390_ea916a26-04be-4d3c-8ef7-962181ab29fc-facebookJumbo.jpg,the-new-york-times,The New York Times,rescue,1
Jon Fingas,"If you're a tad more trusting, this is good news. Robots have typically only had limited cooperation with each other, and this hints at more advanced team-ups where robots can supplement each others' abilities and accomplish more than they would by themselves. That could be helpful for search and rescue missions, or any situation where it would be impractical to equip every robot with the same features. It's a positive move -- so long as the robots remain friendly.","We hope you weren't planning on sleeping tonight. Boston Dynamics has posted a video showing that its SpotMini robot can hold the door open for its fellow automatons. If one bot needs a helping hand, it'll signal to another machine nearby that can pry the doo…",2018-02-12T23:38:00Z,"{'id': 'engadget', 'name': 'Engadget'}",Boston Dynamics' robots are the politest 'pets' you'll meet,https://www.engadget.com/2018/02/12/boston-dynamics-robots-can-hold-the-door-open/,https://o.aolcdn.com/images/dims?thumbnail=1200%2C630&quality=80&image_uri=https%3A%2F%2Fs.aolcdn.com%2Fhss%2Fstorage%2Fmidas%2Fce253af83bd035496858f3c56481d7cc%2F206120318%2Fboston-dynamics-robot-holds-door.jpg&client=cbc79c14efcebee57402&signature=fcc2530b12b33982580e5974bf14bca3c04ff53f,engadget,Engadget,rescue,1
Megan Rose Dickey,"Twilio has $250,000 in startup Edovo, which creates tablet-based educational content for incarcerated individuals. Twilio has also invested grant money in the International Rescue Committee, MindRight and Caravan Studios. Last year, Twilio awarded over $1.5 million in impact funds and plans to award an additional $1.5 million by the end of this year. Edovo works with facilities to bring in secure wireless networks and tablets that access Edovo’s educational platform. The incentive-based learning program covers a variety of areas, including literacy, college course work, cognitive behavioral therapy and vocational training. Upon completion of certain lessons, incarcerated individuals can receive certificates and entertainment options. They can also use Edovo to stay in touch with their loved ones. Right now, Edovo is operating in 20 states in over 50 facilities. To date, over 50,000 people have accessed Edovo’s educational content. “This is government, so there are limitations and challenges to operating with government,” Edovo co-founder Brian Hill told TechCrunch. “As an impact entrepreneur, it’s on us to innovate and figure out how to make it easy to work with challenging organizations.” On average, those who participate in correctional education programs had 43 percent lower chances of returning to prison than those who did not participate in education programs, according to the U.S. Department of Justice. “Our goal is to make sure everyone incarcerated has free access to education on a daily basis,” Hill said. By the end of 2018, Edovo plans to be in all but five states. Another goal is to open up the channel of communication between loved ones and the incarcerated person, Hill said. Ultimately, Edovo’s 2018 is about “creating accessible communications, driving mental health treatment successfully through technology and identifying specifically what drives change in an individual.“ Featured Image: Edovo","Twilio has $250,000 in startup Edovo, which creates tablet-based educational content for incarcerated individuals. Twilio has also invested grant money in the International Rescue Committee, MindRight and Caravan Studios. Last year, Twilio awarded over $1.5 m…",2018-02-01T14:00:45Z,"{'id': 'techcrunch', 'name': 'TechCrunch'}","Edovo, a startup that provides tablet-based education to incarcerated people, snags some funding",http://techcrunch.com/2018/02/01/edovo-a-startup-that-provides-tablet-based-education-to-incarcerated-people-snags-some-funding/,https://tctechcrunch2011.files.wordpress.com/2018/02/edovo.jpg,techcrunch,TechCrunch,rescue,1
https://www.facebook.com/bbcnews,"Image copyrightReutersImage caption
 Rescuers prepare a water pump at the site of the flooded coal mine
A team of Indian navy divers has been deployed in a bid to rescue 15 workers trapped inside a flooded coal mine.
The men had entered the illegal pit, known as a ""rat hole"", in the north-eastern state of Meghalaya on 13 December, and were cut off when floodwater from a nearby river poured in.
Emergency workers equipped with high-power pumps have arrived at the scene.
It is not yet clear whether the miners are still alive.
India's NDTV reports that divers have recovered nothing but three helmets so far.
Officials hope the men may have found an air pocket in the main mineshaft.
""Only God's grace and some miracle can help them to be alive,"" Kyrmen Shylla, Meghalaya's disaster management minister, told Reuters on Wednesday.
Earlier rescue efforts by India's National Disaster Response Force (NDRF) and State Disaster Response Force (SDRF) were hampered by a lack of equipment. Initially, only two low-power pumps were on hand to drain the water.
Image copyrightReutersImage caption
 It is now more than a fortnight since the workers became trapped
The 112m (370ft) deep rat-hole coal mine where the workers are trapped is in East Jaintia district - one of many in the state.
Rat-hole mining involves digging pits into the ground to create a narrow hole to find coal, and is dangerous for those involved. Workers, including children, descend into the mines using bamboo ladders and accidents are common.
The practice was banned in 2014, but mine owners have challenged the ruling in India's Supreme Court.
Most of Meghalaya's illegal miners are migrant labourers who come from neighbouring states to earn money.","High-power pumps arrive at a flooded ""rat-hole"" mine where 15 workers were trapped 16 days ago.",2018-12-29T15:48:25Z,"{'id': 'bbc-news', 'name': 'BBC News'}",Indian miners: Navy divers deployed in rescue bid,https://www.bbc.co.uk/news/world-asia-india-46710467,https://ichef.bbci.co.uk/news/1024/branded_news/428E/production/_104983071_mine2.jpg,bbc-news,BBC News,rescue,1
