author,content,description,publishedAt,source,title,url,urlToImage,source_id,source_name,types,yes_disaster
Andrew Freedman,"It's April. I know. Flowers should be blooming, outdoor lunches should be starting. But that springtime reality is a long way off for tens of millions of Americans. For people living across the Upper Midwest, Great lakes, Ohio Valley, Mid-Atlantic, and New England, an Arctic blast and series of storm systems will make it look and feel more like February during the next week. There are now three separate storms threatening to bring snow to parts of this swath of the country between April 4 and April 12, as bitterly cold air — courtesy of the polar vortex — blasts its way south and east to the Atlantic seaboard. SEE ALSO: Watch this drag Elsa push a police van stuck in the snow during a blizzard in Boston On Friday, for example, temperatures in the north central states are likely to be at least 30 degrees below average for this time of year, with air temperatures holding below freezing all day in northern Minnesota and the Dakotas. The National Weather Service is forecasting Minneapolis' coldest April day on record on Friday, with a high temperature of just 21 degrees Fahrenheit. On Wednesday, the air temperature dropped to minus-6 degrees Fahrenheit in Aberdeen, South Dakota, setting a new monthly record low, the NWS found. The combination of the Arctic cold and an active storm track across the northern two-thirds of the country will keep snow in the forecast for places that would normally have high temperatures well into the 50s and 60s Fahrenheit at this point. In Washington, D.C., where the cherry blossoms are near their peak bloom, the city is bracing for the potential of accumulating snow on Saturday. Computer model projection showing snow, sleet, and rain across the Mid-Atlantic on Saturday morning, April 7. Image: tropicaltidbits.com Some computer model projections show the potential for several inches of snow to fall in the D.C. area, with up to a foot of snow in the higher elevations of West Virginia, Virginia, and Maryland. It's possible, too, that heavy snow will extend northward to Philadelphia, New York City, and Boston on Saturday. And that's not all. There are early indications that a coastal storm may form on Tuesday, April 11, bringing more wintry weather to the Mid-Atlantic and Northeast. The cold is being driven by a large, polar vortex-associated upper level low that has set up shop near Hudson Bay, Canada for much of the latter part of this winter and into spring. Geopotential height anomalies, showing a pinwheeling area of cold swirling about just north of the U.S.-Canada border (circled). Image: tropicaltidbits.com This weather system is helping to keep air temperatures unusually cold across parts of western Canada into the U.S., with round after round of spring snowstorms making many locations look and feel like winter is never-ending. The frigid start to the spring in portions of North America provides a sharp contrast to the unusually warm conditions in other parts of the world. Parts of the Arctic are seeing surface temperatures of about 30 degrees above average for this time of year, and a record-shattering heat wave hit parts of Asia at the end of March, setting national monthly heat records from Iraq to Pakistan.","It's April. I know. Flowers should be blooming, outdoor lunches should be starting. But that springtime reality is a long way off for tens of millions of Americans. For people living across the Upper Midwest, Great lakes, Ohio Valley, Mid-Atlantic, and New En…",2018-04-04T21:16:30Z,"{'id': 'mashable', 'name': 'Mashable'}","Don't hate me, but record-setting cold and snow are about to sweep across the U.S.",https://mashable.com/2018/04/04/april-cold-outbreak-snowstorms/,https://i.amz.mshcdn.com/Wx9eSY1pf2oY-oXRGx9ibU2nS4M=/1200x630/2018%2F04%2F04%2F50%2Fdca972ed7f364acdb33dbe71ef7294f0.e6c21.jpg,mashable,Mashable,snow storm,1
,"At a Glance
Winter Storm Eboni will intensify in the Plains and Midwest midweek.
Parts of the Plains and Midwest will see strong winds and significant snow.
Some communities in the northern Plains may see near-blizzard conditions.
Snow may also affect northern New England late this week.
Winter Storm Eboni will track into the Plains midweek where it will intensify and lay down an expansive swath of wind-driven snow.
Eboni will then spread snow into parts of the upper Midwest and northern New England through Friday.
Eboni was named late on Mon., Dec. 24 with the expectation that area criteria winter storm warnings for 400,000 square kilometers or more would be met later in the week. Both area and population criteria was reached Tuesday afternoon. 
(MORE: The Science Behind Naming Winter Storms at The Weather Channel)
Happening Now
Snow continues to fall across parts of the central and southern Rockies and has spread into portions of the northern and central Plains. 
Eboni brought more than a foot of snow to the Sierra on Christmas Eve into early Christmas morning. 
Winter storm warnings have been issued by the National Weather Service from southern Colorado northeastward to Minnesota and far northwestern Wisconsin. Heavy snow and blowing snow are expected to make travel dangerous in these areas. 
Near-blizzard conditions  including low visibility and blowing snow are possible in parts of the Dakotas late Wednesday into Thursday.
Winter weather advisories are also in place for parts of the Rockies, northern Plains and upper Midwest where travel could be tricky through midweek. 
(From the National Weather Service.)
Day-By-Day Forecast
Winter Storm Eboni will emerge and strengthen in the central Plains midweek as an upper-level trough a southward dip in the jet stream ejects out of the West.
(MORE: Severe Storms, Heavy Rain Threaten the South Midweek)
Temperatures are expected to be cold enough on the northern side of this storm for significant amounts of snow to fall from the northern and central Plains into the upper Midwest and northern Great Lakes region.
Wednesday
Snow or a rain-and-snow mixture may affect a swath from the southern Rockies into northwestern Kansas, Nebraska and the Dakotas.
Many areas of eastern Colorado, western Kansas and western Nebraska will see the precipitation start as rain but then change to freezing rain and snow Wednesday night.
Snow will spread through much of Minnesota, northern Wisconsin and the Upper Peninsula of Michigan later Wednesday or Wednesday night.
Increasing winds are also expected in the Plains and upper Midwest and near-blizzard conditions are possible in parts of western Kansas Wednesday night.
Snow will linger from New Mexico and northeastern Arizona northward into Colorado, Wyoming and eastern Montana.
(The green shadings depict where rain is expected. Areas that are shaded blue are expected to see snow. Purple-shaded locations may see either rain or snow. Areas in pink are expected to see sleet or freezing rain (ice).)
Thursday
Snow or a rain-and-snow mixture will affect areas from western Kansas to Nebraska, the Dakotas, Minnesota, northern Wisconsin and northern Michigan.
Increasing winds are also likely through the Plains and upper Midwest, which will reduce visibility where snow is falling. 
Depending on the strength of the winds, we could see near-blizzard conditions develop in parts of the Dakotas and Nebraska, Kansas and northern Minnesota.
Some areas will see a change in precipitation type, including Minneapolis which will see snow change to rain.
Snow, sleet and freezing rain will spread into parts of New England and eastern New York Thursday night.
(The green shadings depict where rain is expected. Areas that are shaded blue are expected to see snow. Purple-shaded locations may see either rain or snow. Areas in pink are expected to see sleet or freezing rain (ice).)
Friday
Wind-driven snow may continue to impact parts of the upper Midwest and northern Great Lakes.
Portions of northern New England and northeastern New York could see snow or a mix of rain, snow, sleet and freezing rain persist through Friday.
(The green shadings depict where rain is expected. Areas that are shaded blue are expected to see snow. Purple-shaded locations may see either rain or snow. Areas in pink are expected to see sleet or freezing rain (ice).)
How Much Snow?
At least 6 inches of snow is expected in a swath from parts of Colorado northeastward through the eastern Dakotas and into northern Minnesota and the Upper Peninsula of Michigan. More than a foot of snow is possible in eastern South Dakota, southeastern North Dakota and in parts of central and northern Minnesota.
Gusty winds will lead to blowing and drifting snow that may create snow drifts several feet high. 
The trickiest forecast for snowfall totals is for cities along the southern edge of the expected snowfall, which could see rain and snow. Minneapolis and Sioux Falls, South Dakota are two examples. 
Keep in mind, the area of heaviest snow could shift farther north or south in future forecast updates based on the track of the storm.
Farther east, more than 6 inches of snow is most likely in northern New Hampshire and northern Maine.
Light snowfall is possible in parts of southern New England but little to no snow accumulation is currently anticipated in Boston, Providence and Hartford. 
Winter Storm Recap
The low pressure system that became Winter Storm Eboni came ashore near the California/Oregon border on Christmas Eve with an area of snowfall and coastal rain. 
The system created a dip in the jet stream over the Southwest on Christmas where Eboni dropped snow across the Four Corners and the Tetons. 
Select snowfall totals through early Wednesday: 
California: 12 inches at Northstar resort
Colorado: 2 inches at Telluride
Idaho: 5 inches near China Mountain
Nevada: 15 inches at Mount Rose
Oregon: 8 inches near Cornucopia
Utah: 6 inches in Harrisville","Winter Storm Eboni Will Intensify and Spread Heavy Snow, Wind Into Parts of Plains, Midwest The Weather Channel FOUR MILLION under winter weather alerts as Storm Eboni blows through country with near-blizzard Daily Mail Winter storm warning issued: A foot of …",2018-12-26T12:04:33Z,"{'id': None, 'name': 'Weather.com'}","Winter Storm Eboni Will Intensify and Spread Heavy Snow, Wind Into Parts of Plains, Midwest - The Weather Channel",https://weather.com/storms/winter/news/2018-12-26-winter-storm-eboni-snow-wind-plains-midwest-wet-new-england-christmas,https://s.w-x.co/Eboni_prim_1226am.jpg,,Weather.com,snow storm,1
AZI PAYBARAH,"Dec. 27-28, 2010 Mayor Michael Bloomberg, fresh off his unpopular push to extend term limits, was coldly dismissive of complaints from residents who said they were buried under a storm. The city is going fine. Broadway shows were full last night, Mr. Bloomberg told reporters, playing into critics caricature of him as a Manhattan-centric mayor unaware of life in the less-gilded quarters of the city. Later, it was reported that Mr. Bloombergs private plane and presumably its owner were in Bermuda. The same storm was, apparently, not enough of a concern to curtail Mr. Christies plans. He had planned, paid for and executed a vacation to Disneyworld while the people whod just elected him, were, as The Daily News put it, buried in an epic snowstorm. Feb. 9, 1969 The storm that lives in infamy. A sudden dump of 15 inches of snow eventually led to the death of 42 people and injured 288 others. It permanently scarred Mayor John Lindsays reputation, and, some said, gave cover to his successors: Anything short of Mr. Lindsays disastrous response was bound to appear favorable. The Timess J. David Goodman, Al Baker and James Glanz interviewed more than 100 people, and analyzed housing authority records. They write : For at least two decades, almost every time a child in its apartments tested positive for high lead levels, Nycha launched a counteroffensive, city records show. From 2010 through July of this year, the agency challenged 95 percent of the orders it received from the Health Department to remove lead detected in Nycha apartments. Private landlords almost never contest a finding of lead; they did so in only 4 percent of the 5,000 orders they received over the same period, records show. Nychas strategy often worked. The Health Department backed down in 158 of 211 cases in public housing after the authority challenged its finding, the data shows. Look ahead: Mr. Goodman emails to note that the de Blasio administration is trying to parry criticism over its handling of lead in public housing by exploring holding paint companies accountable. For help, a city official met with a historian and a lawyer.","For mayors and other officials, the backlash over storm preparations can be perilous. Now it’s Bill de Blasio’s turn. Also: The mandarin duck speaks!",2018-11-19T11:03:31Z,"{'id': 'the-new-york-times', 'name': 'The New York Times'}",New York Today: New York Today: Why Politicians Fear Snowstorms Even More Than You Do,https://www.nytimes.com/2018/11/19/nyregion/newyorktoday/new-york-today-politicians-storms.html,https://static01.nyt.com/images/2018/11/18/reader-center/nytoday2/merlin_77326556_b64e0a5f-1df1-40c0-b8b3-37beb467fcf2-facebookJumbo.jpg,the-new-york-times,The New York Times,snow storm,1
http://www.facebook.com/fox2now,"Winter Storm and Blizzard Warnings for Nov. 25, 2018 ST. LOUIS, MO – A major winter storm will pound parts of the Midwest Sunday. Heavy snow will blanket parts of southeast Nebraska, northeast Kansas, southern Iowa, northern Missouri, and northwest Illinois, with some seeing 10 inches or more. The snow will be accompanied by winds of up to 45 mph, creating dangerous whiteout conditions on roads and interstates. Travel is not advised. For the St. Louis region, this storm will bring significant wind and falling temperatures but not much snow. Rain showers move in around midday as wind speeds begin to increase and temperatures begin to drop. Rain will change to windblown light snow and flurries Sunday evening. Wind gusts through the evening will be 25-30mph. Only minor snow accumulations are expected, mostly on grass and cars. The exception to this is in northern Montgomery County and Pike County, MO along with Pike and northern Greene Counties, IL, where around an inch of snow is possible. These counties are on the edge of the heavy snow that will more greatly impact communities to the north. Any light snow exits around midnight and we clear out into Monday. Much, much colder with wind chills in the teens Monday. It stays very cold through Wednesday. Tomorrow night, the northwest 1/3 of the state should anticipate up to 12 of snow. Central Illinois could get up to 6, the heaviest north of Springfield. Take all necessary precautions. Alter travel plans to leave early or ask yourself if your trip can wait. #ILwx pic.twitter.com/lLk5cXt1hp — IDOT (@IDOT_Illinois) November 25, 2018","fox2now.com Major winter storm set to bring heavy snow, high wind to upper Midwest fox2now.com ST. LOUIS, MO – A major winter storm will pound parts of the Midwest Sunday. Heavy snow will blanket parts of southeast Nebraska, northeast Kansas, southern Iowa, n…",2018-11-25T03:30:47Z,"{'id': None, 'name': 'Fox2now.com'}","Major winter storm set to bring heavy snow, high wind to upper Midwest - fox2now.com",https://fox2now.com/2018/11/24/major-winter-storm-set-to-bring-heavy-snow-high-wind-to-upper-midwest/,https://localtvktvi.files.wordpress.com/2018/11/winterstormwarnings1.jpg?quality=85&strip=all,,Fox2now.com,snow storm,1
KWCH,"A major winter storm continues to move across northern Kansas this morning. Light to moderate snow will continue to fall through the afternoon. Most of the snow will be flying sideways, as gusty winds will continue into the evening. Bitter cold temperatures (for mid April) with wind chills in the single digits, teens and low 20s. The Blizzard Warning in Kansas has been cancelled, Winter Weather Advisory, High Wind Warning and Wind Advisory is in place until 7 P.M. Additional snowfall accumulation of 1 inch will be possible north of I-70 over north-central and northeast Kansas. Considerable blowing and drifting may make travel dangers or impossible. Wind gusts across central Kansas will be close to 50 m.p.h. with gusts in the western part of the state approaching 60-70 m.p.h. The winter storm will move east, into Missouri and Illinois through the overnight into Sunday morning, allowing Canadian high pressure to move into Kansas. For Wichita, temperatures will drop below freezing around 9 p.m. and remain below freezing until 10 a.m. Sunday. A hard freeze (28 degrees or colder for 4-6 hours) is also possible. Near record low temperatures are possible Sunday morning across all of Kansas. After a bitter cold start to Sunday morning, sunshine will return and temperatures will warm into the 40s, 50s and low 60s. It will be breezy Sunday with wind gusts in the 30-35 m.p.h. range through midday with winds slacking off during the evening. More temperatures swings (less dramatic) are possible this week, as highs climb into the 70s and 80s Tuesday, then fall back into the 50s and 60s Wednesday. Another storm system is expected Friday into Saturday bringing another chance of showers and storms to the area, along with cooler temperatures for next weekend. Wichita Area Forecast: **Wind Advisory until 7 P.M.** Today: Cloudy, flurries or sprinkles possible. Wind: NW 25-35; gusty. High: 40. Tonight: Decreasing clouds late. Wind: NW/N 15-30; gusty. Low: 25. Record Low: 25 set in 1983 Tomorrow: Morning clouds, then mostly sunny and breezy. Wind: NW 10-25; gusty. High: 50. Tomorrow Night: Mostly clear to clear. Wind: N 5-10. Low: 27. Mon: High: 65 Mostly sunny. Tue: High: 82 Low: 51 Mostly sunny and windy. Wed: High: 69 Low: 44 Sunny and breezy. Thu: High: 70 Low: 39 Sunny to partly cloudy. Fri: High: 66 Low: 48 Mostly cloudy. Chance for showers/storms overnight. Sat: High: 64 Low: 53 Chance of showers/storms, windy.","KWCH Winter storm continues to impact Kansas KWCH A major winter storm continues to move across northern Kansas this morning. Light to moderate snow will continue to fall through the afternoon. Most of the snow will be flying sideways, as gusty winds will con…",2018-04-14T14:56:14Z,"{'id': None, 'name': 'Kwch.com'}",Winter storm continues to impact Kansas - KWCH,http://www.kwch.com/content/forecast/Winter-storm-continues-to-impact-Kansas-479766653.html,http://media.graytvinc.com/images/Capture2242.JPG,,Kwch.com,snow storm,1
TRIBUNE STAFF AND THE ASSOCIATED PRESS,"Wind-driven sleet, freezing rain and snow alternated to keep roads slick Saturday as the Coulee Region waited to see how much snow would ultimately accumulate during a mid-April storm that blasted much of the nation’s heartland. The National Weather Service predicted 6 to 12 inches of snow along and north of Interstate 90, 2 to 6 inches south of the I-90 corridor, and a winter weather warning was in effect till 7 p.m. Sunday. The weather system stretched from the Gulf Coast to the Great Lakes, forcing flight cancellations and creating treacherous road conditions. Three people were killed in weather-related incidents, including a sleeping 2-year-old Louisiana girl. In the Upper Midwest, the early spring storm brought snow to a region pining for sunshine and warmth. More than 200 flights were canceled Saturday at Minneapolis-St. Paul International Airport and blizzard conditions forced the airport in South Dakota’s biggest city, Sioux Falls, to remain closed for a second straight day. Some flights at the La Crosse Regional Airport were delayed or canceled. The Minnesota Twins home game against the Chicago White Sox at Target Field was also snowed out, marking the first back-to-back postponements of baseball games in the stadium’s nine seasons. Authorities closed several highways in southwestern Minnesota, where no travel was advised, and driving conditions were difficult across the entire southern half of the state, well into western Wisconsin. “It’s a cool experience for me, the best Minneapolis experience,” said Niko Heiligman of Aachen, Germany, who braved the snow to take a walk along the Mississippi River in downtown Minneapolis. “I’m only here for the weekend, so I guess that’s how it goes. There’s snow and it’s cold. So it’s good.” The storm is expected to persist through today in Minnesota, Wisconsin and Michigan before moving into New York state and New England. A band of 6 to 18 inches of snow had fallen by Saturday morning across central and northeastern Wisconsin, with another round on the way. A blizzard warning was issued for the northern half of Wisconsin, which was expected to get another 14 inches by Sunday evening. Winds of up to 55 mph caused blowing and drifting snow, along with ice shoves in Green Bay. In Chicago, Lake Michigan waves were expected to reach as high as 18 feet, prompting a flood warning until today along the lakefront. Huron, an eastern South Dakota city of about 13,000 people, received 18 inches of snow. One of the three storm-related deaths occurred Friday on snow-covered Interstate 80 near Chappell in western Nebraska, where the State Patrol said an Idaho truck driver lost control of his semitrailer and slammed into a semi that had become stranded. Rollo Ward, 61, of Idaho Falls, Idaho, died at the scene. Another death happened early Saturday in northwestern Louisiana when a storm toppled a tree onto a mobile home in Haughton, killing a sleeping 2-year-old girl inside. A woman died in a spinout on a slippery highway in central Wisconsin on Saturday morning. The Columbia County Sheriff’s Office said the 30-year-old woman from Poynette, Wis., was driving a minivan that began to spin and crossed the centerline of Hwy. 16 in the town of Lewiston, where it was struck by an oncoming SUV. The road was slush-covered and light, freezing rain was falling. The storm made its mark in Texas, too, where hail stones the size of chicken eggs fell on areas south of Dallas and Fort Worth.","La Crosse Tribune Storm blasts central US with snow, ice and wind, killing 3 La Crosse Tribune Wind-driven sleet, freezing rain and snow alternated to keep roads slick Saturday as the Coulee Region waited to see how much snow would ultimately accumulate durin…",2018-04-14T23:17:50Z,"{'id': None, 'name': 'Lacrossetribune.com'}","Storm blasts central US with snow, ice and wind, killing 3 - La Crosse Tribune",http://lacrossetribune.com/news/local/storm-blasts-central-us-with-snow-ice-and-wind-killing/article_eca99f5d-1357-5eb7-b8ea-701112e05b43.html,https://bloximages.chicago2.vip.townnews.com/lacrossetribune.com/content/tncms/assets/v3/editorial/4/80/48039fbe-a94e-5dc5-9037-b5bdee3e045d/5ad28b414b211.image.jpg?crop=1644%2C925%2C0%2C168&resize=1120%2C630&order=crop%2Cresize,,Lacrossetribune.com,snow storm,1
"JACK HEALY, RICHARD FAUSSET and CAMPBELL ROBERTSON","But the mind-set seemed to have fully changed. Local officials used to regard hurricane response as something akin to major snow removal: sporadic events that therefore warranted relatively little investment. “Two years of these types of storms have really made us look internally at our own preparation,” Mr. Sears said. “Now that we have a better understanding of where people may be at risk, we can better stage assets in that area.” “Matthew got me once, Florence got me twice,” Mr. Sears said Tuesday, recounting what he told the City Council this week. “The next hurricane won’t get me.” Closer to the coast, in Conway, S.C., a few miles northwest of Myrtle Beach, the weariness with the cycle of worry, flood, repeat was palpable. “I grew up here,” said Matt Bruton, 34, a moving and storage business operator, who was hanging out Tuesday in his single-story brick home in Old Sherwood Country Club, an eclectic neighborhood of old and new houses north of the Waccamaw River. The waters had already risen through neighboring Crabtree Swamp to a level higher than residents had ever seen. “We had a record flood during Floyd in ’99, and it wasn’t this high,” Mr. Bruton said. “The hundred-year flood they called it the last time, and here we are again. I’d like to put my house in a different, higher place, but I call this the best neighborhood in Conway. We’re all friends here.”","As climate change and rapid growth bring more flooding, residents and officials must grapple with where to rebuild and how to prepare for the next storm.",2018-09-18T23:50:56Z,"{'id': 'the-new-york-times', 'name': 'The New York Times'}","‘It’s Back’: Underwater Yet Again, the Carolinas Face a New Reality",https://www.nytimes.com/2018/09/18/us/north-carolina-hurricanes-storms-history.html,https://static01.nyt.com/images/2018/09/19/us/19stormredux1/19stormredux1-facebookJumbo.jpg,the-new-york-times,The New York Times,snow storm,1
