author,content,description,publishedAt,source,title,url,urlToImage,source_id,source_name,types,yes_disaster
"Brian Kahn on Earther, shared by Andrew Couts to Gizmodo","The countrys midsection is about to be hit by a rare, potentially record setting bomb cyclone that will bring everything from rain to snow to hurricane-force winds and could leave severe flooding in its wake from Texas to Minnesota. So if you live in that area, listen up!
The mayhem is already beginning as moisture streams from the Pacific into the Southwest, where winter storm warnings are in effect as of Tuesday afternoon. Up to two feet of snow could fall in New Mexicos Sangre de Cristo Mountains, accompanied by winds whipping across ridge tops at speeds of up to 75 mph, according to the National Weather Service. That alone would be pretty wild, but its only a precursor to Wednesdays weather mayhem.
As the storm pushes inland, its pressurewhich drops as storms get strongeris expected to dip into the range of 970 millibars. Thats roughly on par with an average Category 2 Atlantic hurricane and could challenge the all-time low pressure record for Kansas. The drop will be driven by the storms winds as they wrap around its core in a counter clockwise direction, bringing moist, warm air from the Gulf of Mexico in contact with cold air from the Upper Midwest and Canada. The movement of the winds is called cyclonic, and pressure is expected to drop more than 24 millibars in 24 hours, which means this storm is shaping up to fulfill the criteria for a rare inland bomb cyclone. It could even take on a hurricane-like appearance.
The fascinating thing about this storm is how quickly it will intensify and the possible record-low pressures it will produce in the Plains, Jason Furtado, a meteorology professor at the University of Oklahoma, told Earther. Another neat thing is that some models are indicating that this storm will strengthen so quickly, it could develop an eye-like feature in the center of the storm. This is a very rare for non-tropical systems and even more so for storms in the central U.S. (Its also rare for noreasters, which tend to be more comma-shaped.)
Weather geekery aside, the storm is going to make a mess of things. The area facing wind gusts up to 60 mphthe equivalent of a mature tropical stormstretches for more than 1,000 miles from Sturgis, South Dakota to the Texas-Mexico border. For comparison, the reach of Sandys tropical storm-force winds was 1,150 miles from edge to edge, although even thats not a perfect comparison, since tropical storm winds start at 39 mph.
So about those winds. The most intense blasts could rip up to 75 mph in the Rockies and Southern Plains. The rotation of the storm will also create what Furtado called a moisture pipeline straight out of the Gulf of Mexico. That means not only will it be windy, but also snowy. The National Weather Service is forecasting up to a foot or more of snow from Colorado to the Dakotas. Blizzard warnings are also in effect for large part of the region, and they could expand as the storm begins its onslaught.
Even after the storm clears out on Wednesday night, its impacts could linger. Aside from the heavy, blowing snow, areas on the Southern Plains could see wind-driven rain that could melt out what snowpack there is, aided by a blast of warm air on Thursday. Ed Vallee, the founder of Empire Weather, told Earther that flooding and melting snowpack is another unique impact could happen after the storm blows out into the Atlantic.","The country’s midsection is about to be hit by a rare, potentially record setting bomb cyclone that will bring everything from rain to snow to hurricane-force winds and could leave severe flooding in its wake from Texas to Minnesota. So if you live in that ar…",2019-03-12T20:00:00Z,"{'id': None, 'name': 'Gizmodo.com'}",The Central U.S. Is About to Get Hit With a Bomb Cyclone,https://earther.gizmodo.com/the-central-u-s-is-about-to-get-hit-with-a-bomb-cyclon-1833239904,"https://i.kinja-img.com/gawker-media/image/upload/s--4Dd4JguJ--/c_fill,fl_progressive,g_center,h_900,q_80,w_1600/lzezxfbz6svf2n0vbjxc.jpg",,Gizmodo.com,snow storm,1
NICK CORASANITI,"Photo A major snowstorm predicted to start Wednesday could dump as many as 16 inches in the New York region. Credit George Etheredge for The New York Times An unyielding winter is about to dump yet another major snowstorm on the New York region, with forecasters projecting significant snow accumulation just as the calendar ticks toward spring. The National Weather Service issued a winter storm warning for northeastern New Jersey and southeastern New York, including all of New York City, saying that snowfall will likely begin early Wednesday morning and that total accumulations of 12 to 16 inches were expected. “Travel will be very difficult to impossible, including during the evening commute on Wednesday,” the service wrote. The Metropolitan Transportation Authority said it would be sending out information on its preparations for the storm later on Tuesday, but did not anticipate Tuesday evening’s commute to be affected. New Jersey Transit had also not issued any advisories for service changes. The storm comes just as many in the region are finally dug out from two relentless storms in early March — the second one left two people dead and thousands of people in New Jersey and the suburbs north of New York City without power for days as utility companies came under scrutiny for their response. Continue reading the main story","Even as the calendar turns to spring, winter refuses to relinquish its grip with forecasters predicting 12 to 16 inches of snow starting on Wednesday.",2018-03-20T14:19:12Z,"{'id': 'the-new-york-times', 'name': 'The New York Times'}",New York Region Braces for Major Snowstorm,https://www.nytimes.com/2018/03/20/nyregion/new-york-region-braces-for-major-snowstorm.html,https://static01.nyt.com/images/2018/03/21/nyregion/21nyweather/21nyweather-facebookJumbo.jpg,the-new-york-times,The New York Times,snow storm,1
Brian Koerber,"Unless you've been hiding under a rock for fear of nuclear war with North Korea, you may have heard that a winter storm is developing on the East Coast of the United States. While that storm is shaping up to be a doozy, it's already reaching headlines for bringing some rare chilly weather and frozen precipitation to the South. Yes, folks, today it snowed in Florida. SEE ALSO: 'Bomb cyclone' to pummel East Coast, followed by a polar vortex-related cold snap Not used to the snow, Floridians were pretty pumped to see the white fluffy stuff for a change. This pup, however, was very confused. South Carolina also saw a good amount of snow. And so did North Carolina. People in Georgia were trying their very best to make snowmen. Some were better than others. The fire chief for Valdosta, Georgia, even made a snow angel. Snow-covered palm trees are a pretty rare sight. Ill-equipped and unaccustomed, some roads were closed with just a dusting. A fountain even froze in Atlanta. While this is exciting to many who live in the South and rarely see snow, this storm is part of an explosive "" bomb cyclone "" that's expected to pummel the rest of the East Coast Wednesday night into Thursday. Snow will overspread the region tonight/Thursday morning &amp; last most of the day. Heavy snowfall is possible around 9am to 4 pm w/ snowfall rates near 2 inches an hour. Travel may become difficult due to poor vsbys &amp; snow covered roads. Blowing &amp; drifting snow is also possible. pic.twitter.com/BSF9XzJj6f — NWS Boston (@NWSBoston) January 3, 2018 Be careful, and stay warm out there. With love, from sunny Los Angeles.","Unless you've been hiding under a rock for fear of nuclear war with North Korea, you may have heard that a winter storm is developing on the East Coast of the United States. While that storm is shaping up to be a doozy, it's already reaching headlines for bri…",2018-01-03T23:43:50Z,"{'id': 'mashable', 'name': 'Mashable'}",It's snowing in the South and people are losing their damn minds,http://mashable.com/2018/01/03/snow-in-florida-georgia-carolinas-reactions-videos/,https://i.amz.mshcdn.com/W4j3RYbtQrXxaPN5nHvNgoLiRN4=/1200x630/2018%2F01%2F03%2F94%2F9eab10eba0804eb996944a86138890b4.f1d9c.jpg,mashable,Mashable,snow storm,1
MATT STEVENS and SANDRA E. GARCIA,"“We’re used to snow, don’t get me wrong,” Mr. Sinnott, 52, said. “But this amount, trying to deal with this, is very atypical.” Mr. Sinnott spoke on Tuesday evening by phone as he monitored the dispatch of snow plows from a municipal garage. He said crews had been working around the clock to clear main thoroughfares, but until about noon Tuesday, it had snowed so much that “every time we finish the main streets we have to circle back around and do them again.” As a result, snow has accumulated on residential side streets, making it difficult for people to escape their driveways, he said. But even if they could leave, Mr. Sinnott noted, “everything is closed.” He said he was not aware of any “critical incidents,” as of late Tuesday. The biggest problem, said Mr. Sinnott and David Mulvihill, the city’s director of public works, is that dozens of vehicles had been abandoned in the streets after they got stuck. “They just leave the car there,” Mr. Mulvihill said in a telephone interview. Officials said they had tapped city employees from across departments to help plow during 12- to 16-hour shifts. Officials from Pittsburgh, about 130 miles south of Erie, have offered to send equipment and personnel if needed, they said. “It’s all hands on deck here,” Mr. Mulvihill said. “We got blasted, but we’re keeping up with it.” Erie declared a snow emergency, and officials urged residents to stay off the streets. Mr. Sinnott and Mr. Mulvihill both said they were grateful the storm arrived during a holiday, when schools and many businesses were already closed. Chandler Albert and her family were among those who decided to venture out with their four-wheel-drive vehicle despite the “four feet of snow currently covering my grandmother’s house,” she said in a telephone interview on Tuesday. A glimpse of the Christmas storm! pic.twitter.com/WUGGTlHos7 — Chandler Albert (@ChandlerAlbert) Dec. 27, 2017 Their destination? The grocery store, Wegmans. Their reason? They needed food to eat with their holiday leftovers. A version of this article appears in print on December 27, 2017, on Page A14 of the New York edition with the headline: Record Storm Buries Erie, Pa., in Five Feet of Snow. Order Reprints | Today's Paper | Subscribe Continue reading the main story","Residents of Erie, Pa., have had to abandon their cars in the middle of road after getting stuck. The snow, which shattered several records, is still coming down.",2017-12-27T03:29:12Z,"{'id': 'the-new-york-times', 'name': 'The New York Times'}",Storm Buries Pennsylvania City in More Than Five Feet of Snow,https://www.nytimes.com/2017/12/26/us/snow-erie-pennsylvania-record.html,https://static01.nyt.com/images/2017/12/27/us/27xp-erie1/27xp-erie1-facebookJumbo.jpg,the-new-york-times,The New York Times,snow storm,1
Leigh Anderson,"The morning after a big snowfall here in Brooklyn, us city-dwellers always awake to the same awful, desperate noise: The sound of a million New Yorkers trying to pull their cars out of parking spaces that haven’t been adequately shoveled out. This means an ongoing high-pitched whirring of tires and revving of engines, sometimes for hours, while I lie with the pillow over my head and pray that they run out of gas or otherwise somehow explode. It is for these people, these determined tire-spinners, that I called the New Hampshire Motor Speedway in Loudon, New Hampshire to talk to Real New Englander And Car Guy™ Eric Rollins, the director of maintenance for the Speedway, for advice on how to rock one’s car out of a snowbank. He took time out of his day of prepping the Speedway for the big storm and offered some good advice for the tire-spinners and the inexperienced winter drivers among us. Be Prepared in the First Place “You should have good tires,” said Rollins. Examine them before the snow hits (this might be too late for you for this storm) and check that the tread isn’t worn. “Check the air pressure in the tires—they should be inflated to the proper level. Make sure your anti-freeze is good, your fan belts are good, and pack a blanket and jumper cables,” preferably one with a battery pack so you don’t need another car for a jump. Rollins recommends asking the mechanic to check everything out when you have your oil changed, and to remember to fill up on gas. “If you get stuck and your car runs at least you can stay warm.” The QueerCents blog has a primer on how to winterize your car including this neat penny trick: Read more Read Get Ready to Dig If your tires are spinning, “the first thing you should do is have a shovel,” said Rollins. “And probably a little kitty litter.” There’s no way around it: If you’re stuck in the snow, “the only way to get out is to move the snow.” Rollins recommends carrying a shovel, the kitty litter, and tire chains (here’s a handy video guide to installing tire cables —which ideally you should have on your tires before you’re stuck). If you can’t get any traction, shovel away more snow and scatter kitty litter, sand or dirt in front and in back of the tires. You can also use a board or one of the floor mats as a wedge behind the tires. Rock If you’re almost out, and are too lazy to get out and shovel, you can try to rock your car out of the snow. If you have a manual transmission, Rollins says, “Put it in first gear and let the clutch out. When it goes forward, push the clutch in, reverse, and and let it roll back and repeat the process.” Eventually, hopefully, you’ll get enough rocking momentum going to clear the snow in front of you. Need a tutorial for an automatic? Check out this helpful video: Use Your Common Sense For good measure, Rollins also offers some icy-driving tips for those of us who learned to drive before there were anti-lock brakes: Basically, if you start to skid, stay calm and keep a steady pressure on the brakes. “When you step on the brakes and they start to chatter, hold your foot firmly on the brake pedal and steer where you want to go.” Don’t pump the brakes or jerk the wheel. Rollins said he himself learned this only four years ago, as part of his firefighter training; people who learned to drive some decades ago might be conditioned to pump the brakes when they start to slide. Rollins also points out that nothing is going to help you at 100 miles an hour, though—and offers a reminder to drive at safe speeds and keep an adequate distance between cars. My Vermonter relatives often tell me that four-wheel drive or tire chains don’t allow you to go fast, they just allow you to go, so be cautious if you must drive in the snow, especially if you’re not used to it. And if you park on my street tonight? Please remember to pack a shovel.","The morning after a big snowfall here in Brooklyn, us city-dwellers always awake to the same awful, desperate noise: The sound of a million New Yorkers trying to pull their cars out of parking spaces that haven’t been adequately shoveled out. This means an on…",2018-01-04T14:57:00Z,"{'id': None, 'name': 'Lifehacker.com'}",How to Rock Your Car Out of a Snowbank,https://lifehacker.com/how-to-rock-your-car-out-of-a-snowbank-1821758238,"https://i.kinja-img.com/gawker-media/image/upload/s--MRFz3B9D--/c_fill,fl_progressive,g_center,h_900,q_80,w_1600/d0lfy8vrktzsieiyxcdx.jpg",,Lifehacker.com,snow storm,1
Andrew Freedman,"The ""bomb cyclone"" that slammed the East Coast on Wednesday and Thursday exceeded weather forecasters' expectations in nearly every way. It dumped more than a foot of snow on the Mid-Atlantic and Northeast, including 16 inches in Islip, Long Island, and flooded parts of downtown Boston with a storm surge that sent water rising to historic levels. The storm got its name for the process known as bombogenesis, which describes a storm whose minimum central air pressure plummets by at least 24 millibars in 24 hours. SEE ALSO: A 'bomb cyclone,' explained On Thursday, the bomb cyclone intensified by 59 millibars in 24 hours, which is the fastest rate ever observed in any other winter storm along the East Coast since at least 1976, according to data from David Roth, a meteorologist at the Weather Prediction Center, and Andrea Lang, an assistant professor at the University of Albany. Lang said that research by her and Hannah Attard, a doctoral student in her research group, found 1,218 cyclones that originated north of 30 degrees North latitude and met the bombogenesis criteria in the Northern Hemisphere between 1980 and 2015. This indicates that meteorological bombs, so to speak, aren't that rare. ""What is uncommon is the rate of deepening for the 4 January cyclone,"" Lang said in an email. ""If you filter all 1218 cyclones that meet the 'bomb' criteria for those that occurred in a box just off the East Coast (60-80˚W and 30-55˚N) we find 23 'bomb' cyclones in the 1980-2015 reanalysis data."" ""This storm would be the new number 1 in terms of 24 hr mean sea level pressure fall... for storms on our list,"" she added. The intensification rate isn't just a bit of trivia for weather geeks, either. It had implications for the storm's impacts, primarily by accelerating the storm's winds. Winds gusted to hurricane force, or 75 miles per hour, across Cape Cod and the Islands, and high winds raked everywhere from the Carolinas to Nova Scotia. This occurred because air was rushing in toward the center of the storm in response to the rapid drop in air pressure. Such winds helped drive the storm surge flooding that created so many problems in New England, too. The satellite imagery taken of the storm clearly shows how intense it became, as it even sported an eye-like feature near its center. Meteorologist Jeff Frame annotated an image to show all the meteorological features it revealed. There are many reasons why this storm intensified so quickly and significantly, with a minimum pressure eventually dropping to levels more typically seen in Category 2 or 3 hurricanes. For one, there were tremendous contrasts in air masses between cold, dry Arctic air pouring in from the northwest, and moisture-rich subtropical air streaming north over the Atlantic. ""There are several factors that contribute to the intensification of all cyclones, all of these factors were on the extreme side for this event,"" Lang said. ""All extratropical cyclones, which includes storms like nor'easters, form on boundaries between cold and warm air. However, not all nor'easters form when there is record-breaking cold air already in place along the east coast,"" she said. ""In general terms, the magnitude and scale of the temperature contrast is an indicator of energy available for cyclone intensification."" Zoomed-in satellite image of the eye-like feature in the 'bomb cyclone' on Jan. 4, 2018. Image: noaa Lang said that the southern location of the initial storm, which spun up near the coast of Florida, added more energy to the mix. ""The fact that the cyclone formed as far south as it did allowed the cyclone [to maintain] a link to the subtropics (nicely shown in the satellite imagery),"" she said. ""The subtropical link provided the cyclone with a source of fuel, in the form of water vapor, that fed the large field of precipitation and enhanced the storm strength."" While many of the East Coast's most memorable snowstorms also underwent bombogenesis, there was nothing typical about this particular weather bomb. And that's why satellite images of it have been saved to weather geek's hard drives, (and set as my new desktop background.) This storm was a beast, and looked absolutely gorgeous from space.","The ""bomb cyclone"" that slammed the East Coast on Wednesday and Thursday exceeded weather forecasters' expectations in nearly every way. It dumped more than a foot of snow on the Mid-Atlantic and Northeast, including 16 inches in Islip, Long Island, and flood…",2018-01-05T19:43:00Z,"{'id': 'mashable', 'name': 'Mashable'}",We've never seen an East Coast winter storm intensify as fast as the 'bomb cyclone',http://mashable.com/2018/01/05/bomb-cyclone-satellite-images-record-intensification-rate/,https://i.amz.mshcdn.com/vySvbTjfi8S1vmfovxGYy0EHexY=/1200x630/2018%2F01%2F05%2F32%2Fa14a3e1434cb4ea7a3fdba248f52d74a.7bcd7.jpg,mashable,Mashable,snow storm,1
Morgan Sung,"Hold on to your oat milk. It SNOWED in Los Angeles. 
Southern California known for its year-long sunshine, mild temperatures, desert mountains, and gorgeous beaches saw snow on Thursday afternoon, and everyone in the Los Angeles area justifiably freaked the fuck out. 
SEE ALSO: Seattle's gone to the dogs, literally, following record snowfall
An ""unusually chilly storm"" from Alberta, Canada brought snow over Las Vegas on Thursday morning, according to the Los Angeles Times. By the afternoon, snow dusted more northern parts of L.A. and Ventura County, stopping traffic as Angelenos reveled in it.
Although snow is common in the mountains surrounding Los Angeles, it rarely snows in the city itself. It hasn't snowed in the L.A. Basin where a majority of the population lives since January 1962, according to the Los Angeles Public Library archives. On Thursday it fell in places at 1000 feet above sea level which means neighborhoods that haven't experienced a decent winter wonderland in decades even got some flecks.  
And people understandably took to social media to express their surprise. 
It is snowing in LA. Everyone is going wild. Theyre taking videos up and down the street. 
You see that? Right?! Thats snow?? -My Uber driver in disbelief
 Brandon Davis (@BrandonDavisBD) February 21, 2019
Others saw it as a sign of the apocalypse. 
los angeles just got snow, the end times have come
 Kaiji Tang (@KaijiTang) February 21, 2019
Just let it actually snow in LA already and smother us in a blanket of welcome white death.
 @LAScanner (@LAScanner) February 21, 2019
Others found Angelenos' fascination downright adorable.
The National Weather Service even had to explain what snow was to confused Angelenos.
Unfortunately, the snow didn't last and L.A. went back to its usual sunny self.","Hold on to your oat milk. It SNOWED in Los Angeles. Southern California — known for its year-long sunshine, mild temperatures, desert mountains, and gorgeous beaches — saw snow on Thursday afternoon, and everyone in the Los Angeles area justifiably freaked th…",2019-02-22T00:20:07Z,"{'id': 'mashable', 'name': 'Mashable'}",It snowed in LA and everyone is freaking out,https://mashable.com/article/snow-los-angeles-wtf/,https://mondrian.mashable.com/2019%252F02%252F22%252Fe1%252Fd84357fa726b4b7d88c2241503a239ed.4a702.jpg%252F1200x630.jpg?signature=tXIYuJy-4BuZ4Yr8OTTNOfJGTWg=,mashable,Mashable,snow storm,1
