author,content,description,publishedAt,source,title,url,urlToImage,source_id,source_name,types,yes_disaster
Andrew Freedman,"Residents of Southern New England are used to snowstorms, including the classic blizzards that can stalk this region like a hunter tracks prey. Such storms, known as nor'easters for the direction that the wind comes from, can shut down areas from New York City to Portland, Maine, and bring damaging coastal flooding, feet of snow, and widespread power outages. However, even the hardiest of New Englanders are likely growing weary, as the third major nor'easter in a parade of powerful storms is projected to hit beginning Monday night. SEE ALSO: What is bombogenesis? This storm is not predicted to track close enough to the coast to spread heavy snow well inland, toward New York and New Jersey, like last week's storm did. But eastern Massachusetts can expect near blizzard to blizzard conditions by Tuesday morning, with snowfall totals potentially nearing 2 feet in some locations, according to the National Weather Service. Essentially, the atmosphere is acting like a rechargeable battery, with major storms every three to five days, followed by a period of unusually cool, calm weather. Computer model projection of the nor'easter on March 13, 2018. Image: tropicaltidbits.com The new storm will hit at a time when thousands of people are still without power in the region due to the tree and power line damage the last storm caused. Some areas in Massachusetts, Connecticut, Rhode Island, New York, and New Jersey are still littered with downed branches and even entire trees split in half. This coming storm is not likely to cause nearly as much damage to trees and the electrical infrastructure, since it will bring fluffier snow, rather than the pasty, wet cement of the last nor'easter. There's still a chance the latest nor'easter will track further away from the coast or closer to it, which would significantly change predicted snowfall amounts, but computer models are honing in on a track off the coast of Cape Cod. The latest nor'easter will likely end a remarkably stormy run of weather for early March, making this winter bookended by a frigid outbreak around New Years and a snowstorm blitz just before spring, with well above average temperatures sandwiched in between. Computer model depiction of the Greenland block, outlined by the blue square. Image: tropicaltidbits.com To understand why there has been such a barrage of storms, one must look to the large-scale weather pattern in place across the Northern Hemisphere that led up to this stormy period. As reported in February, the polar vortex, which is a semi-permanent area of low pressure at high altitudes above the Arctic with strong winds swirling around it, split into two pieces. One lobe of the polar vortex established itself over Siberia and Europe, leading to the ""Beast from the East"" cold and snow outbreak there. Another slipped into the Western U.S. for a time. Meanwhile, weird things were happening in the Arctic, where it was record-warm for the month of February. The region may soon set a record for the least amount of sea ice cover present at the end of the winter — also known as the lowest sea ice maximum. This is in keeping with trends toward rapidly increasing air temperatures during winter, and thinner, younger sea ice that covers less area over time. At the same time, conditions across the Pacific Ocean, including the tropical Pacific, set off a chain of events that altered the shape of the jet stream — the highway of air at upper levels of the atmosphere, which steers storms and helps energize them. Then, a massive block formed over Greenland, as a pattern of atmospheric pressure over the North Atlantic, known as the North Atlantic Oscillation or NAO, plunged to record negative territory. When the NAO is in a negative phase, it ups the odds for snowstorms in the eastern U.S. and Europe, although it does not guarantee them. Earlier this month, the NAO index plunged to a record low, which is indicative of how primed the atmosphere is for major storms. Together, these events set the stage for a fusillade of storms to blast the East Coast, among other parts of the world. The Greenland block is absolutely key to this, since it prevents weather systems from simply slinking off out to sea, and allows different branches of the jet stream to come together, or ""phase,"" and form a rapidly intensifying storm. Here's how Jason Furtado, an assistant professor of meteorology at the University of Oklahoma, explained what's going on, via email: The jet stream acts as the storm track. The southward displacement of the polar jet stream across the Eastern US (trough) during Greenland blocking/negative North Atlantic Oscillation (NAO) episodes facilitates storm systems to track across the Midwest or Southeast and eventually off the Eastern Seaboard. Placing these potent systems over the warm Atlantic waters allows them to rapidly intensify and form Nor’easters. The blocking over the North Atlantic also helps to (a) increase winds from the storm system (pressure gradient) and (b) slow the storm system’s progress to the north and east, sometimes even forcing it out to the south. The offshore tracks for these systems with the block in place allows for cold air to take hold across the Northeast and thus make for rather big snowstorms. The low pressure area forecast to hit southern New England on Monday night and Tuesday will be the third straight storm to undergo bombogenesis, meaning its minimum central air pressure will drop by at least 24 millibars in 24 hours. Such bomb cyclones are typically accompanied by strong winds, as the air rushes in toward the center of the storm. Without the Greenland block, it's unlikely that all the ingredients would come together three times in a row for major East Coast storms. Think of it as a matchmaker: The Greenland block is facilitating a hook up between weather disturbances pinwheeling across North America, and raising the odds that they'll meet and get busy somewhere off the Mid-Atlantic coast. ""This is not unprecedented per se given the pattern in place (e.g., Feb 2010 'Snowmaggedon' in DC/Mid-Atlantic; Dec 2010-Jan 2011 for the Northeast),"" Furtado added. ""These Greenland block patterns (and post-sudden stratospheric warming episodes) tip the scale toward more frequent and/or intense nor’easters."" A string of storms like this one is not unheard of in New England, as the atmosphere can fall into a pattern that produces a storm every four or five days. That's why some months appear to be rainy every weekend while the workweek is sunny and gorgeous. Interestingly, this next nor'easter hitting tonight is likely to help change the current weather pattern, with the Greenland block breaking down somewhat in coming days. What about global warming? Studies show that there are connections between Arctic climate change and midlatitude weather patterns, particularly cold weather outbreaks in Europe, as well as more stubborn, blocking patterns such as the one we're in the grips of now. However, this is still a contested area of climate science, with some studies showing evidence of links between declining Arctic sea ice and the jet stream, and others failing to detect such connections. Judah Cohen, the director of seasonal forecasting at AER, a Verisk company, has been studying the potential links between Arctic climate change and extreme weather in the Northeast and Europe, among other areas. His work shows that as the Arctic warms, the odds of heavy snows in the Northeast somewhat paradoxically goes up. ""So though a heavy snowfall in March is not unheard of or rare, it is the frequency of the heavy snowfalls that seems to be changing,"" he said in an email. ""Also maybe a little more rarer is to have three destructive/disruptive storms in quick succession. But I do think this is consistent with the pattern that follows a polar vortex split over time,"" he said. A recent study Cohen contributed to showed that polar vortex splits have become more frequent as Arctic sea ice has declined and Arctic warming has accelerated. In addition, it's clear, that the impact of nor'easters, including the recent ones, is getting worse due to global warming. This is particularly the case with coastal flooding, since sea level rise is providing storms with a higher launching pad for floods than was the case in previous years. For example, the first of the three storms gave Boston it's third-highest tide level on record, with flooding occurring during at east five high tide cycles up and down the coast from Maine to Connecticut. Also, global warming is causing seas to warm overall, and air temperatures to increase, which results in an uptick in the amount of available water vapor in the air to power major storms like nor'easters. Precipitation extremes, including heavy snow events during the winter, are becoming more common as the climate continues to change. Interestingly, global warming might be giving people the impression that heavy snows don't occur as much anymore, making these nor'easters more surprising. As University of Georgia researcher Marshall Shepherd said in an email: ""The string of nor'easters is having a significant impact, but it is somewhat amusing that cold and nor'easters have garnered so much attention, the changes in our climate have made having winter newsworthy.""","Residents of Southern New England are used to snowstorms, including the classic blizzards that can stalk this region like a hunter tracks prey. Such storms, known as nor'easters for the direction that the wind comes from, can shut down areas from New York Cit…",2018-03-12T16:02:03Z,"{'id': 'mashable', 'name': 'Mashable'}",Third nor'easter in 3 weeks to slam New England: What's going on here?,https://mashable.com/2018/03/12/third-major-noreaster-whats-going-on/,https://i.amz.mshcdn.com/5EipgSFgxc19ThuF03rjNCPvZcA=/1200x630/2018%2F03%2F12%2Fa3%2F5b5fbd5cd7a142afb1c55a56af6bcdb2.3e0ae.jpg,mashable,Mashable,snow storm,1
Anthony Glover,"NASHVILLE, Tenn. -- FOX 17 News is CODE RED as a winter weather advisory for parts of middle Tennessee is issued. The National Weather Service has issued a winter weather advisory for parts of middle Tennessee from 6 p.m. Saturday to noon Sunday. A winter storm warning is in effect for Trigg, Christian and Todd counties in southern Kentucky until 9 a.m. Sunday. Northern Middle Tennessee is expected to see the biggest impact of wintry mix. Rain is expected to change to snow, sleet and freezing rain Saturday. This will continue into Sunday before turning to rain in the afternoon. Up to one inch is expected in areas north of I-40, with 1 to 3"" possible along the northern plateau. Watch FOX 17 News at 9 p.m. for the latest information.","Winter Weather Advisory issued for Middle Tennessee WZTV Winter Storm Diego Track Snow Course Emergency Flight Cancellations: Thousands of North Carolina Planes Grounded Newsweek Intense winter storm tears through Texas, dumping snow and heavy rain CBS News C…",2018-12-08T19:15:00Z,"{'id': None, 'name': 'Fox17.com'}",Winter Weather Advisory issued for Middle Tennessee - WZTV,http://fox17.com/news/local/winter-weather-advisory-issued-for-middle-tennessee-12-08-2018,http://static-35.sinclairstoryline.com/resources/media/9ab50410-6031-4731-8463-0b899061baea-large16x9_1.jpg?1544296249568,,Fox17.com,snow storm,1
Fox News,"A major storm is bringing heavy snow and high winds to a significant portion of the country from Kansas to Chicago that could make it more difficult for travelers heading home this Thanksgiving weekend. The National Weather Service is predicting blizzard-like conditions in some places. ""Dangerous travel conditions caused by heavy snow and reduced visibility are expected to end the holiday weekend,"" NWS said, according to USA Today. Chicago is bracing for heavy snow Sunday afternoon that could cause flight delays and cancellations at O'Hare International Airport, a major hub. ""The combination of extra moisture from Lake Michigan, colder air and strong winds may lead to whiteout conditions and a rapid accumulation of snow in Chicago during the second half of the storm,"" AccuWeather meteorologist Steve Travis said, the paper reported. The snow could also have an impact on travelers into and out of airports in Detroit, Cleveland and Pittsburgh, USA Today reported. The storm could also bring snow to parts of upstate New York and northern New England into Monday. CYBER MONDAY SHOPPING STRATEGIES FOR NABBING GREAT DEALS The Weather Channel reported that snow was falling Saturday in parts of the higher elevations of the West and in parts of the northern Plains. Up to four inches of snowfall was reported as of early Saturday in Georgetown, Idaho and in Rosalia, Washington. The combination of increasing winds, heavy snow and poor visibility will create blizzard conditions in some localities, AccuWeather reported around 11 a.m. Saturday. Roads will become icy and snow-covered along much of the Interstate-80 corridor and portions of I-35, I-39, I-70, I-88, I-90, I-94 and I-196 in the region, AccuWeather reported. AccuWeather said major cities that can expect at least a few inches of snow include: Topeka, Kansas; Omaha and Lincoln, Nebraska; Des Moines and Davenport, Iowa; Kirksville and Kansas City, Milwaukee; Grand Rapids and Lansing, Michigan; Madison, Wisconsin; Missouri; and Rockford and Chicago.",Fox News Major snow storm in central US threatens Thanksgiving holiday weekend travel Fox News A major storm is bringing heavy snow and high winds to a significant portion of the country from Kansas to Chicago that could make it more difficult for travelers h…,2018-11-24T17:40:31Z,"{'id': 'fox-news', 'name': 'Fox News'}",Major snow storm in central US threatens Thanksgiving holiday weekend travel - Fox News,https://www.foxnews.com/weather/major-snow-storm-in-central-u-s-threatens-holiday-weekend-travel,https://static.foxnews.com/foxnews.com/content/uploads/2018/11/Winter-Snow.jpg,fox-news,Fox News,snow storm,1
Nancy Gaarder World-Herald staff writer,"Morning commuters in the Omaha area will come across some slick spots Friday morning, especially at intersections, after the region saw some light snow overnight.
The road conditions were much better than what drivers experienced Thursday in central Nebraska. A stretch of about 145 miles of Interstate 80 from roughly Grand Island to North Platte was closed for several hours Thursday while the storm howled and crews cleared crashes.
It reopened about 7:15 p.m. No severe injuries were reported.
The Nebraska Department of Roads reported Thursday evening that most of the roads in the central and northeast parts of the state were completely covered in ice and snow.
Sign up for World-Herald news alerts
Be the first to know when news happens. Get the latest breaking headlines sent straight to your inbox.
Miserably cold weather is forecast for Friday as temperatures remain locked in the teens and low 20s across the state and strong winds drive down wind chills.
Temperatures should rise a bit over the weekend before plunging again early in the week.
That means people should plan for a windy, cold New Years Eve. In Omaha, strong winds could drop wind chills into the single digits for the citys New Years Eve fireworks show.
Thursday, the Nebraska State Patrol helped more than 100 drivers who had trouble with the weather.
In western Kansas, a person was killed in a storm-related collision between a car and semitrailer truck on Interstate 70, according to WDAF-TV.
About 75 miles of I-70 was closed for hours because of the storm.
The storm similarly caused problems in the Dakotas and northern Minnesota.
Cliff Cole, a meteorologist at the National Weather Service, said the storm didnt produce the widespread high snow totals originally forecast.
For the most part, 5 to 6 inches of snow fell in western and northern Nebraska. Up to a foot of snow had been forecast.
North of Grand Island, there was a report of 8.5 inches in Greeley County, according to Jordan Thies, a meteorologist at the Hastings weather service office.
But strong winds gusting up to 55 mph were enough to pile up drifts between 1 and 3 feet high in some spots.
Winds were expected to be a problem into Friday morning before abating.","Morning commute could be slick in spots; bitter cold spreads across region Omaha World-Herald Snow Blankets Parts Of Northern, Western Minnesota During Winter Storm WCCO - CBS Minnesota Storm whips up blizzards, dumps snow in Dakotas, Minnesota The Associated…",2018-12-28T06:00:00Z,"{'id': None, 'name': 'Omaha.com'}",Morning commute could be slick in spots; bitter cold spreads across region - Omaha World-Herald,https://www.omaha.com/weather/morning-commute-could-be-slick-in-spots-bitter-cold-spreads/article_df844533-5c82-57b7-aa8f-987feb91cdf6.html,https://bloximages.newyork1.vip.townnews.com/omaha.com/content/tncms/assets/v3/editorial/2/5c/25c05b4d-4c23-5a27-9658-7c5cd51a4b15/5c2574405a6f5.image.jpg?crop=1511%2C1133%2C158%2C0&resize=840%2C630&order=crop%2Cresize,,Omaha.com,snow storm,1
KENDRA PIERRE-LOUIS,"Credit Claire O'Neill/The New York Times In the middle of a nor’easter that disrupted travel in the Northeast and inundated areas already drenched from last week’s storm, some New Yorkers and others on the East Coast made a resounding discovery: “thundersnow.” The curious phenomenon, when thunder and lighting are heard and seen during a snowstorm, has been documented since at least the year 1099. But its rarity — a 2009 analysis found that only 0.07 percent of snowfalls are accompanied by thunder — means that it never ceases to excite. The captivating nature of thundersnow was documented in an article in The New York Times on Sept. 24, 1884 : “I don’t believe there has been a thunderstorm that I have witnessed for the past 30 years,” said a gentleman of this city, “which has not given me occasion to ask scores of people if they had ever seen a thunder and lightning snowstorm, and I never met but one yet, besides myself who ever had.” (That gentleman’s stories about thundersnow must have never gotten old.) There are three ways thundersnow can develop in the United States, according to John Nielsen-Gammon, the Texas state climatologist and a professor of atmospheric science at Texas A&amp;M University. The first, which is most common to the central United States, mirrors the way regular thunderstorms are formed: Warmer, moist air close to the ground rises and mixes with colder, denser air higher up in the atmosphere. As the hot air moves up and the cold air moves down, the atmospheric instability can trigger lightning and the thunder that comes with it. In the case of a thundersnow event, air closer to the ground is just warm enough to rise and create atmospheric mixing, but it’s still cold enough that falling snow can stay frozen. This often happens in the Rockies, when the mountains trap pockets of warm air. “The air is cold enough down low that as the frozen precipitation falls out of it, it never encounters a warm enough layer of air to melt,” said Dr. Nielsen-Gammon. So instead of rain and lightning, there’s snow and lightning. The second scenario tends to happen around the Great Lakes in early winter. A thunderstorm develops even though temperatures are very cold, thanks to the relatively warm moist air that comes from the lakes. It’s intertwined with the same conditions that bring the region its lake effect snow. In the third scenario the low pressure of a powerful winter storm creates strong upward motions in the air, generating the atmospheric instability that in a typical thunderstorm would be driven by temperature changes. This is likely what led to New York City’s thundersnow. Even when the conditions are right, you won’t always notice the thunder. Snow is more likely to absorb the light of lightning and the sound of thunder than rain. But thundersnow tends to be accompanied by heavier snowfall, which you may indeed notice when your commute is snarled.","There are three ways thundersnow can develop in the United States, but it always brings the element of surprise.",2018-03-08T00:25:50Z,"{'id': 'the-new-york-times', 'name': 'The New York Times'}",How Thundersnow Happens: With Considerable Difficulty,https://www.nytimes.com/2018/03/07/climate/thundersnow.html,https://static01.nyt.com/images/2018/03/07/climate/cli-thundersnow/cli-thundersnow-facebookJumbo.jpg,the-new-york-times,The New York Times,snow storm,1
Brian Cizek,"TODAY: Plenty of sunshine, milder. High: 46 TONIGHT: Partly cloudy and chilly. Low: 29 MONDAY: Considerable cloudiness with some rain in the afternoon. High: 48 The storm that moved through last night was fast moving, but packed quite the punch! A very heavy band of snow set up right over the Lehigh Valley, dumping over 8 inches of snow in some spots. The Lehigh Valley was the bulls eye in terms of snow totals, with most spots seeing 6""-9"" of snow. As you move either north or south of the Lehigh Valley, snow totals dropped off fairly quickly, as points farther north saw lighter snow, and spots farther south saw some mixing with rain. Today will be a completely different story than yesterday. The storm has moved well off the coast, and high pressure has moved overhead. The high will bring mostly sunny skies for the entire day, and will also bring in some milder air. Temperatures will climb into the mid to upper 40s by this afternoon. Because of this, we will see quite a bit of the snow melt by the time the sun goes down. President's Day will also be a mild one, but we won't see nearly as much sunshine as we will today. Temperatures will reach the upper 40s by the afternon, but a blanket of clouds will roll in during the morning hours as a warm front pushes up from the south. Eventually, we will see some rain and showers move in by the afternoon as that warm front passes to the north. The rain and showers should move out by the late evening hours. As we progress through next week, a very strong ridge of high pressure anchored off the Southeast U.S. Coast will lead to a southwesterly wind flow that will pump some very warm air into our region. This high pressure system should make for dry conditions Tuesday with partly sunny skies and near record breaking warmth. High temperatures Tuesday are expected to top out in the mid to upper 60s. The current record high Tuesday for Allentown is 68 degrees (1930). Wednesday is also expected to be an extremely warm day with a mix of sun and clouds and afternoon highs perhaps getting up to the low 70s! Allentown's current record high for Wednesday is 67 (1953). A cold front is expected to approach from our west late in the day and this may bring some showers. This cold front is then expected to linger across the region overnight Wednesday into Thursday keeping shower chances around along with plenty of clouds. High temperatures are expected to drop off a bit for Thursday and beyond but are still expected to reach the mid to upper 40s. While it will be cooler than the middle of the week, it will still be above the average for this time of the year. Have a great and safe rest of the weekend!","WFMZ Allentown A mild and sunny Sunday will rapidly melt the snow WFMZ Allentown The storm that moved through last night was fast moving, but packed quite the punch! A very heavy band of snow set up right over the Lehigh Valley, dumping over 8 inches of snow …",2018-02-18T12:14:17Z,"{'id': None, 'name': 'Wfmz.com'}",A mild and sunny Sunday will rapidly melt the snow - WFMZ Allentown,http://www.wfmz.com/weather/a-mild-and-sunny-sunday-will-rapidly-melt-the-snow/703564945,https://media.wfmz.com/mara-wfmz-media-us-east-1/photo/2018/02/18/accuphoto_1518955574064_10407778_ver1.0_1280_720.jpeg,,Wfmz.com,snow storm,1
