author,content,description,publishedAt,source,title,url,urlToImage,source_id,source_name,types,yes_disaster
Bradford Betz,"A deadly tornado ripped through Alabama on Sunday, killing at least 23 that was part of a severe storm system that caused catastrophic damage and unleashed other tornadoes around the Southeast.
Among the other fatalities was an 8-year-old girl, according to rescue officials. Her identity was not released. Unconfirmed reports identified a 6-year-old boy as another victim.
Lee County Sheriff Jay Jones told WRBL-TV that the tornado traveled along a state road in Beauregard and that the path of destruction appeared at least a mile long and a quarter mile wide. He said single-family homes and mobile homes were destroyed, adding some homes were reduced to slabs. He had told reporters earlier that several people were taken to hospitals, some with ""very serious injuries.""
A fallen cell tower lies across U.S. Route 280 highway in Lee County, Ala., in the Smiths Station community after what appeared to be a tornado struck in the area Sunday, March 3, 2019. 
 (Mike Haskey/Ledger-Enquirer via AP)
Describing rescue efforts Sunday night, a local mayor told Fox News: ""We had to cut our way in with chainsaws and tractors to get to these people and make sure everyone was okay. We had some elderly people that were trapped in their houses.
""Words cannot describe it. Trailer homes turned upside down, the damage is unbelievable,"" he added.
""So I grabbed my dog and went and got in the closet and I'm sitting there holding the door just in case because it didn't close all the way. And a few minutes later, that's when I could hear all the wind and the house moving,"" another woman told Fox News.
CLICK HERE TO GET THE FOX NEWS APP
The threat of severe weather continued into the late-night hours. A tornado watch was in effect for much of eastern Georgia, including Athens, Augusta and Savannah. The tornado watch also covered a large area of South Carolina, including the cities of Charleston and Columbia.
The Associated Press contributed to this report.","At least 23 dead in devastating Alabama tornado, damage is 'unbelievable' Fox News Tornado Outbreak Hits South, Killing at Least 22 in Alabama The Weather Channel Several dead after tornadoes tear through the South CNN Fatalities Reported in Beauregard, Alaba…",2019-03-04T10:40:00Z,"{'id': 'fox-news', 'name': 'Fox News'}","At least 23 dead in devastating Alabama tornado, damage is 'unbelievable' - Fox News",https://www.foxnews.com/us/at-least-23-dead-in-alabama-tornado,https://static.foxnews.com/foxnews.com/content/uploads/2019/03/AP19063163869869.jpg,fox-news,Fox News,tornado outbreak,1
Kelly Gooch,"Kelly Gooch - Tuesday, March 5th, 2019"" onclick=""window.open(this.href,'win2','status=no,toolbar=no,scrollbars=yes,titlebar=no,menubar=no,resizable=yes,width=640,height=480,directories=no,location=no'); return false;"" rel=""nofollow""&gt;
Print | Email
The East Alabama Medical Center in Opelika treated 63 people in the aftermath of tornadoes that devastated the Southeast, and about 12 people were sent to other hospitals, according to AL.com.
""We conduct disaster drills at least twice a year, and most times they involve a tornado because that's one of the most likely disaster scenarios we all face in Alabama,"" said John Atkinson, the medical center's marketing director. ""Those certainly prepared us for the quick influx of patients.
""But no event in the past 50 years or so compares to what Lee County experienced,"" he said.
The Southeast was hit with multiple tornados over the weekend. Central Alabama had its first tornado warning in the early afternoon March 3, and the storms that followed resulted in at least 23 reported deaths in Lee County, as well as destruction in Alabama, Georgia and Florida, according to The New York Times.
The 340-bed East Alabama Medical Center is about 9 miles from Beauregard and about 20 miles from Smith Station, two Alabama communities where tornadoes hit.
AL.com reported that some physicians and part of the hospital's workforce were watching the weather and arrived at the medical center shortly before patients started arriving.
By the morning of March 4, four of the 63 patients treated at the medical center  remained hospitalized.
More articles on patient flow:
20 people to lose jobs as hurricane-wrecked hospital won't resume baby deliveriesHawaii ambulance breaks down on way to call; patient dies at scenePatient shoots physician at Florida hospital, authorities say
© Copyright ASC COMMUNICATIONS 2019. Interested in LINKING to or REPRINTING this content? View our policies by clicking here.
To receive the latest hospital and health system business and legal news and analysis from Becker's Hospital Review, sign-up for the free Becker's Hospital Review E-weekly by clicking here.","East Alabama hospital well-prepared, treats 63 people in tornado aftermath Becker's Hospital Review Alabama tornadoes: How lessons from deadly 2011 outbreak that killed hundreds help save lives now NBC News Alabama tornadoes: Seven family members among 23 kil…",2019-03-05T15:55:00Z,"{'id': None, 'name': 'Beckershospitalreview.com'}","East Alabama hospital well-prepared, treats 63 people in tornado aftermath - Becker's Hospital Review",https://www.beckershospitalreview.com/patient-flow/east-alabama-hospital-well-prepared-treats-63-people-in-tornado-aftermath.html,https://www.beckershospitalreview.com/images/channels/patient-flow/3.jpg,,Beckershospitalreview.com,tornado outbreak,1
Richard Defendorf,"BEAUREGARD, Ala. (AP) Rescuers prepared Monday to tear through the rubble of mobile homes and houses in search of survivors of a powerful tornado that rampaged through southeast Alabama and killed at least 23 people.
The trail of destruction was at least half a mile wide and overwhelmed rural Lee County's coroners' office, forcing it to call in help from the state.
""The devastation is incredible,"" Lee County Sheriff Jay Jones said.
Drones flying overheard equipped with heat-seeking devices had scanned the area for survivors, but the dangerous conditions halted the search late Sunday, Sheriff Jones said. Rescuers planned to resume the search at daylight Monday.
The Sunday tornado was part of a powerful storm system that also slashed its way across parts of Georgia, South Carolina and Florida.
Levi Baker, who lives near the hard-hit area in Alabama, took a chain saw to help clear a path for ambulances and other first-responder vehicles. He said some houses were demolished and trees were uprooted or snapped in half. One house was swept off its foundation and was sitting in the middle of the road.
""It was just destruction,"" Baker said. ""There were mobile homes gone. Frames on the other side of the road.""
Jones said the twister traveled straight down a county road in the rural community of Beauregard reducing homes to slabs.
The National Weather Service confirmed late Sunday a tornado with at least an F3 rating caused the destruction in Alabama. Although the statement did not give exact wind estimates, F3 storms typically are gauged at wind speeds of between 158-206 mph (254-331 kph).
Wreckage covers the grounds of a mobile home park a day after it was hit by a tornado, in Convent, Louisiana February 24, 2016 in an aerial photo provided by the Louisiana Governor's Office of Homeland Security and Emergency Preparedness. Several tornadoes lashed southern Louisiana and Mississippi on Tuesday, killing at least three people and injuring more than 30 as the storms destroyed dozens of homes and businesses and toppled a water tower, weather and emergency officials said. Hardest hit in Louisiana was the Mississippi River hamlet of Convent, where 90 percent of the estimated 160 mobile homes at the Sugar Hill trailer park were demolished, state police superintendent Colonel Mike Edmonson told a news conference. REUTERS/Louisiana Governor's Office of Homeland Security and Emergency Preparedness/Handout via Reuters FOR EDITORIAL USE ONLY. NOT FOR SALE FOR MARKETING OR ADVERTISING CAMPAIGNS. THIS IMAGE HAS BEEN SUPPLIED BY A THIRD PARTY.THIS PICTURE WAS PROCESSED BY REUTERS TO ENHANCE QUALITY. AN UNPROCESSED VERSION HAS BEEN PROVIDED SEPARATELY
Wreckage covers the grounds of a mobile home park a day after it was hit by a tornado, in Convent, Louisiana February 24, 2016 in an aerial photo provided by the Louisiana Governor's Office of Homeland Security and Emergency Preparedness. Several tornadoes lashed southern Louisiana and Mississippi on Tuesday, killing at least three people and injuring more than 30 as the storms destroyed dozens of homes and businesses and toppled a water tower, weather and emergency officials said. Hardest hit in Louisiana was the Mississippi River hamlet of Convent, where 90 percent of the estimated 160 mobile homes at the Sugar Hill trailer park were demolished, state police superintendent Colonel Mike Edmonson told a news conference. REUTERS/Louisiana Governor's Office of Homeland Security and Emergency Preparedness/Handout via Reuters FOR EDITORIAL USE ONLY. NOT FOR SALE FOR MARKETING OR ADVERTISING CAMPAIGNS. THIS IMAGE HAS BEEN SUPPLIED BY A THIRD PARTY. IT IS DISTRIBUTED, EXACTLY AS RECEIVED BY REUTERS, AS A SERVICE TO CLIENTS
Tropical Depression Isaac is seen as it begins to dissipate over the Midwest U.S. in this September 1, 2012 NASA handout satellite image. The remnants of Hurricane Isaac were grinding slowing northward with its center deep into Missouri and the heavy rain stretching for hundreds of miles east into Illinois amid reports of tornadoes and high winds, meteorologists said. REUTERS/NASA/Handout (UNITED STATES - Tags: ENVIRONMENT) THIS IMAGE HAS BEEN SUPPLIED BY A THIRD PARTY. IT IS DISTRIBUTED, EXACTLY AS RECEIVED BY REUTERS, AS A SERVICE TO CLIENTS. FOR EDITORIAL USE ONLY. NOT FOR SALE FOR MARKETING OR ADVERTISING CAMPAIGNS
NEW ORLEANS, LA - FEBRUARY 07: A woman looks at the wreckage caused by a tornado which touched down along Chef Menture Avenue on February 7, 2017 in New Orleans, Louisiana. According to the weather service 25 people were injured in the aftermath of the tornado. (Photo by Sean Gardner/Getty Images)
NEW ORLEANS, LA - FEBRUARY 07: A little girl plays with a broken stick amongst the debris that was left behind by a tornad on on February 7, 2017 in New Orleans, Louisiana. According to the weather service 25 people were injured in the aftermath of the tornado. (Photo by Sean Gardner/Getty Images)
NEW ORLEANS, LA - FEBRUARY 07: A man stands inside his buisnnes after a tornado ripped off his roof on February 7, 2017 in New Orleans, Louisiana. According to the weather service, 25 people were injured in the aftermath of the tornado. (Photo by Sean Gardner/Getty Images)
NEW ORLEANS, LA - FEBRUARY 07: Cars are covered with bricks after a tornado touched down along Chef Menture Avenue on February 7, 2017 in New Orleans, Louisiana. According to the weather service, 25 people were injured in the aftermath of the tornado. (Photo by Sean Gardner/Getty Images)
NEW ORLEANS, LA - FEBRUARY 07: A woman holds three dogs by a make-shift leash amongst the debris left behind by a tornado on February 7, 2017 in New Orleans, Louisiana. According to the weather service, 25 people were injured in the aftermath of the tornado. (Photo by Sean Gardner/Getty Images)
NEW ORLEANS, LA - FEBRUARY 07: Residents walk down a street along Chef Menture Ave after a tornado touched down in the eastern part of the city on February 7, 2017 in New Orleans, Louisiana. According to the weather service 25 people were injured in the aftermath of the tornado. (Photo by Sean Gardner/Getty Images)
VILONIA, AR - APRIL 29: A police officer walks past an overturned car at a homesite that was destroyed by a tornado on Sunday, April 29, 2014 in Vilonia, Arkansas. After deadly tornadoes ripped through the region leaving more than a dozen dead, Mississippi, Arkansas, Texas, Louisiana and Tennessee are all under watch as multiple storms over the next few days are expected. (Photo by Mark Wilson/Getty Images)
VILONIA, AR - APRIL 29: Volunteer Gina Lowe (C) helps a family move belongings from a home that was destroyed by a tornado on Sunday, April 29, 2014 in Vilonia, Arkansas. After deadly tornadoes ripped through the region leaving more than a dozen dead, Mississippi, Arkansas, Texas, Louisiana and Tennessee are all under watch as multiple storms are expected over the next few days. (Photo by Mark Wilson/Getty Images)
NEW ORLEANS, LA - FEBRUARY 07: A police officer walks through a damaged gas station along Chef Menture Avenue after a tornado touched down in the eastern part of the city on February 7, 2017 in New Orleans, Louisiana. According to the weather service, 25 people were injured in the aftermath of the tornado. (Photo by Sean Gardner/Getty Images)
After nightfall Sunday, the rain had stopped and pieces of metal debris and tree branches littered roadways in Beauregard. Two sheriff's vehicles blocked reporters and others from reaching the worst-hit area. Power appeared to be out in many places.
In a tweet late Sunday, President Donald Trump said: ""To the great people of Alabama and surrounding areas: Please be careful and safe. Tornadoes and storms were truly violent and more could be coming. To the families and friends of the victims, and to the injured, God bless you all!""
Rita Smith, spokeswoman for the Lee County Emergency Management Agency, said about 150 first responders had quickly jumped in to help search the debris after the storm struck in Beauregard. At least one trained canine could be seen with search crews as numerous ambulances and emergency vehicles, lights flashing, converged on the area.
No deaths had been reported Sunday evening from storm-damaged Alabama counties other than Lee County, said Gregory Robinson, spokesman for the Alabama Emergency Management Agency. But he said crews were still surveying damage in several counties in the southwestern part of the state.
Numerous tornado warnings were posted across parts of Alabama, Georgia, Florida and South Carolina on Sunday afternoon as the storm system raced across the region. Weather officials said they confirmed other tornadoes around the region by radar alone and would send teams out Monday to assess those and other storms.
In rural Talbotton, Georgia, about 80 miles (130 kilometers) south of Atlanta, a handful of people were injured by either powerful straight-line winds or a tornado that destroyed several mobile homes and damaged other buildings, said Leigh Ann Erenheim, director of the Talbot County Emergency Management Agency.
News footage showed smashed buildings with rooftops blown away, cars overturned and debris everywhere. Trees all around had been snapped bare of branches.
""The last check I had was between six and eight injuries,"" Erenheim said in a phone interview. ""From what I understand it was minor injuries, though one fellow did say his leg might be broken.""
She said searches of damaged homes and structures had turned up no serious injuries or deaths there.
Henry Wilson of the Peach County Emergency Management Agency near Macon in central Georgia said a barn had been destroyed and trees and power poles had been snapped, leaving many in the area without power.
Authorities in southwest Georgia were searching door-to-door in darkened neighborhoods after a possible tornado touched down in the rural city of Cairo, about 33 miles (53 kilometers) north of Tallahassee, Florida, on Sunday evening. There were no immediate reports of serious injuries.
Authorities said a tornado was confirmed by radar in the Florida Panhandle late Sunday afternoon. A portion of Interstate 10 on the Panhandle was blocked in one direction for a time in Walton County in the aftermath, said Don Harrigan, a meteorologist for the National Weather Service in Tallahassee.
___
Associated Press writers Russ Bynum in Savannah, Georgia; Bill Cormier in Atlanta; and Ryan Kryska in New York contributed to this report.
More from Aol.com:Alabama tornado's deadly strike13-year-old cheerleader mysteriously dies 2 hours after falling ill at competitionWoman brutally mauled to death by her own 2 dogs while playing in front yard","Searches to resume after tornado kills 23 in Alabama AOL Tornado Outbreak Hits South, Killing at Least 23 in Alabama The Weather Channel At least 23 dead after tornadoes touch down in Alabama and Georgia CNN Death toll expected to rise after search continues …",2019-03-04T12:32:10Z,"{'id': None, 'name': 'Aol.com'}",Searches to resume after tornado kills 23 in Alabama - AOL,https://www.aol.com/article/news/2019/03/04/searches-to-resume-after-tornado-kills-23-in-alabama/23683262/,https://o.aolcdn.com/images/dims3/GLOB/legacy_thumbnail/1028x675/format/jpg/quality/85/https%3A%2F%2Fs.yimg.com%2Fhz%2Fimages%2FUS_AHTTP_AP_NEWSBRIEFS%2F026b180852a54bb69d2cba0ffbf28830_original.jpg,,Aol.com,tornado outbreak,1
,"At a Glance An Illinois town took a direct hit from a tornado Saturday. At least 20 people were injured, but there are no reports of fatalities. At least 100 buildings in Taylorville were estimated to be damaged. There were 22 reports of tornadoes in Illinois Saturday. A large tornado tore through Taylorville, Illinois, Saturday, damaging dozens of buildings and injuring at least 30. The tornado struck the town of about 11,200 residents just after 5 p.m. Saturday. Taylorville is about 25 miles southeast of the state's capital, Springfield. (MORE: Tornado Central ) ""There are multiple, I would guess, over a hundred (homes), easily, that are damaged severely from the storm because it took a path almost right through town,"" Taylorville Assistant Fire Chief Andy Goodall said at a news conference Saturday night. Goodall said most of the homes' roofs were gone, including his own, with the north and west sides of town hardest hit. (MORE: Tornadoes Leave 1 Dead in Missouri, Extensive Damage in Oklahoma ) ""I know we had probably 12 or 15 houses, at least, where people were trapped,"" Goodall told the Breeze Courier Saturday night. Above: Damage at a convenience store in Taylorville, Illinois, on Dec. 1, 2018. Downed power lines and trees littered the city, which was preparing for its Twilight Christmas Parade, the Breeze Courier reported. No deaths were reported. Taylorville Memorial Hospital spokesman Michael Leathers told the State Journal Register 21 people were treated for storm-related injuries. Three with more serious injuries were transferred to Memorial Medical Center in Springfield. Gov. Bruce Rauner activated the State Emergency Operations Center. A temporary shelter for victims has been set up at Crossroads Church. Radar image at 5:20 p.m. CST, Saturday, December 1, 2018, near the time an apparent tornado struck Taylorville, Illinois. ""We took the unprecedented step of activating our sirens twice,"" Christian County Emergency Management Agency Director Mike Crews told the Breeze Courier. ""We have a policy not to do that, but we felt that because of the size of the storm, we did do that,"" Crews said. The National Weather Service in Lincoln, Illinois, issued a tornado warning at 4:39 p.m., roughly 41 minutes before the tornado struck Taylorville. At 5:15 p.m., they upgraded to a tornado emergency for the town, a rare warning issued when a damaging tornado has been confirmed, heading for a populated area. Elsewhere in Christian County, a home was shifted off its foundation near the town of Boody, a semi was blown over, and numerous trees and power lines were downed in Stonington. Before tracking into Christian County, a home was damaged near the Montgomery County town of Butler, and a classic cars business was damaged near Staunton, in Macoupin County. Ameren reported just over 2,200 customers without power from the storms as of early Sunday. Twenty miles northwest of Springfield, residents of Beardstown were asked to conserve water after the towns water treatment plant was struck by a suspected tornado. There were 22 reports of tornadoes Saturday in central and southern Illinois, according to the National Weather Service. Preliminary reports of tornadoes on Dec. 1, 2018, in central and southern Illinois. Note, these don't necessarily correspond to the number of tornadoes or their precise tracks, which will be determined by National Weather Service damage surveys. (Reports: NOAA/NWS/SPC) According to NWS-Lincoln, a supercell tracking from the far east St. Louis metro area to just east of Bloomington-Normal, Illinois, may have been responsible for multiple tornadoes, including Taylorville, a distance of roughly 140 miles. Multiple NWS survey teams will examine the damage Sunday in central and southern Illinois to determine the number of tornadoes, their intensities and paths. On Friday and into early Saturday, strong thunderstorms tore across the Plains states, spawning at least three tornadoes that caused extensive damage in Oklahoma and killed one person in a southwestern Missouri.","The Weather Channel Destructive Tornado Strikes Taylorville, Illinois; Over 100 Buildings Damaged, 30 Injured The Weather Channel A large tornado tore through Taylorville, Illinois, Saturday, damaging dozens of buildings and injuring at least 30. The tornado …",2018-12-02T12:27:49Z,"{'id': None, 'name': 'Weather.com'}","Destructive Tornado Strikes Taylorville, Illinois; Over 100 Buildings Damaged, 30 Injured - The Weather Channel",https://weather.com/storms/tornado/news/2018-12-02-illinois-tornadoes-taylorville-1dec18,https://s.w-x.co/taylorville-1dec18-locator.jpg,,Weather.com,tornado outbreak,1
Katie Galioto,"President Donald Trump passed wrecked homes and fallen trees en route to a Baptist church in Alabama, where he thanked volunteers and commented on the destruction after a tornado devastated the area last week. | Carolyn Kaster/AP Photo 
President Donald Trump on Friday extended an unusual gesture as he sought to comfort Alabama residents devastated by a tornado outbreak last weekend he signed Bibles.
Trump offered up his autograph to first responders and survivors at a Baptist church in the eastern part of the state, after tornadoes left a path of destruction nearly a mile wide and killed 23 people last Sunday. 
Story Continued Below
After surveying damage from above in a helicopter ride, Trump arrived in Beauregard, Alabama, a rural community hit the hardest.
Trump passed wrecked homes and fallen trees en route to the Baptist church, where he thanked volunteers and commented on the destruction.
We saw things that you wouldnt believe, he told reporters.
Trump also met privately with relatives of those who were killed by the powerful storm, including a family that lost 10 people to the tornadoes. Later, the president and first lady Melania Trump visited a memorial to the victims, pausing for a moment in front of each of the 23 wooden crosses lined up in a row.
By signing up you agree to receive email newsletters or alerts from POLITICO. You can unsubscribe at any time.
We couldnt get here fast enough, Trump said to volunteers. I wanted to come the day it happened.
A number of local officials, including Alabama Gov. Kay Ivey, joined the president in lauding first responders. Ivey thanked Trump for coming, adding softly: Were stronger together.
Trump said Federal Emergency Management Agency staff will stay in Alabama as long as needed as the state recovers. He took off from Alabama to head to Mar-a-Lago, Florida, for a weekend at his private club.
Nancy Cook contributed to this report.
This article tagged under:
Missing out on the latest scoops? Sign up for POLITICO Playbook and get the latest news, every morning in your inbox.",Trump offered up his autograph to first responders and survivors at a Baptist church in the eastern part of the state.,2019-03-08T20:42:45Z,"{'id': 'politico', 'name': 'Politico'}",Trump signs Bibles during disaster tour of Alabama,https://www.politico.com/story/2019/03/08/trump-alabama-bibles-1213269,https://static.politico.com/ff/89/87f887044593b43d61f6517cba13/190308-donald-trump-ap-773.jpg,politico,Politico,tornado outbreak,1
