author,content,description,publishedAt,source,title,url,urlToImage,source_id,source_name,types,yes_disaster
Mark Torregrossa | mtorregr@mlive.com,"Southern Lower Michigan is placed in an area where tornadoes could occur this evening and overnight. I've found three things that could help Michigan avoid tornadoes tonight. Of course, if these three things don't trend toward thwarting tornadic storms, we could have a few tornadoes tonight. The first weather feature that helps severe weather intensify is counterintuitive. Sunshine is a needed factor often for severe weather. Afternoon and evening sunshine heats the air, making air unstable and ready to rise into a severe thunderstorm. The satellite animation from late morning and early afternoon shows clouds are trying to thin across Lower Michigan. If you see a lot of sunshine this afternoon and evening, lean your expectations to more severe storms tonight, with a possible tornado. If the skies stay quite cloudy, temperatures will probably stay too cool to spark severe storms. In looking at the cloud trend above, sunshine is emerging. The second weather factor is an upper-air pattern that maybe out of sync with the on-the-ground severe weather factors. The upper-air winds have oval shaped segments that have stronger winds. These are called ""jet cores"" by us meteorologists. Here is the upper-air forecast at 8 p.m. tonight: The severe weather regions under the jetstream are not in a position to affect Lower Michigan at 8 p.m. tonight. At 2 a.m. tonight, a situation called a ""coupled jet"" is developing. That's where one part of a jetstream is situated to produce severe weather, and another part of a second jet core is also positioned to produce severe weather. But the coupled jet isn't quite put together just right at 2 a.m. At 8 a.m. Wednesday, the jetstream is put together just right for producing severe weather, but the unstable surface features will have already moved southeast of Michigan. This is why I'm calling it an out-of-sync situation. If the situation truly works out like this, we will probably avoid severe weather in Michigan this evening and tonight. The final item pointing against severe weather is a simple one- the timing of the storms. These thunderstorms are expected after sunset, and mostly in the middle of the night. Severe weather, including tornadoes, can happen in the middle of the night, but that's a rare situation. If you want to monitor the latest severe weather outlook for tonight, click here. Also monitor MLive as the storm develop tonight.",MLive.com 3 things stand in the way of a tornado outbreak in Michigan MLive.com Southern Lower Michigan is placed in an area where tornadoes could occur this evening and overnight. I've found three things that could help Michigan avoid tornadoes tonight. Of c…,2018-09-25T19:13:24Z,"{'id': None, 'name': 'Mlive.com'}",3 things stand in the way of a tornado outbreak in Michigan - MLive.com,https://www.mlive.com/weather/index.ssf/2018/09/3_things_stand_in_the_way_of_a.html,https://image.mlive.com/home/mlive-media/width620/img/weather_impact/photo/24902172-standard.png,,Mlive.com,tornado outbreak,1
Nichole Manna,"A tornado watch is in effect until 10 p.m. for at least 34 counties in North and Central Texas and the First Responder Bowl in Dallas has been canceled.
The watch includes Clay, Jack, Parker, Hood, Palo Pinto, Erath, and Somervell counties. Tarrant County is not on the list. The full list can be found here.
In Tarrant County, a flood advisory has been issued for poor drainage areas. It will expire at 6:45 p.m. Fort Worth was in a severe thunderstorm warning for about 20 minutes. It expired at 4:45 p.m.
Scattered thunderstorms are likely Wednesday afternoon and evening mainly south of Interstate 20 and west of Interstate 35, according to the National Weather Service in Fort Worth.
Some storms may become severe with damaging winds as the main threat. Large hail and a few tornadoes are possible, along with flash flooding in some isolated areas. 
As of Wednesday afternoon, the biggest threat for severe storms exists south of Interstate 20.
The First Responder Bowl, which was scheduled in Dallas between Boise State and Boston College, was canceled as a result of the weather after a delay. It will be ruled a no contest.
Exactly three years ago, North and Central Texas experienced a tornado outbreak. Twelve confirmed twisters touched down in eight counties on this date. Thirteen people were killed. More than half were killed at the Interstate 30 and Highway 190 junction in eastern Dallas County.
The outbreak ranks third in the number of confirmed tornadoes in a 24-hour period in the month of December.
A 2015 Tornado Remembrance that was scheduled in Rowlett today was canceled because of the threat of severe weather.
Thunderstorms should clear up by midnight and Thursday will be sunny with a high near 50. Wind speeds will die down to 10 to 15 mph with some gusts as high as 25 mph, according to the National Weather Service.
Skies will remain clear until Saturday, when theres a 20 percent chance of rain. New Years Eve will bring more possibilities of rain with a high near 52. 
New Years Day will be mostly sunny with a high near 48.","34 counties in North and Central Texas under tornado watch Star-Telegram Reports: Severe storms ignite over Texas, cause cancellation of college bowl game AccuWeather.com Timeline: Risk of severe weather tonight, through morning WFAA.com What to expect and wh…",2018-12-26T20:31:00Z,"{'id': None, 'name': 'Star-telegram.com'}",34 counties in North and Central Texas under tornado watch - Star-Telegram,https://www.star-telegram.com/news/weather/article223576195.html,https://www.star-telegram.com/latest-news/ctviyx/picture223576630/alternates/LANDSCAPE_1140/weather%20update.jpg,,Star-telegram.com,tornado outbreak,1
Travis Fedschun,"As voters head to the polls on Tuesday to cast their votes in the midterm elections, some may need to pack more than an umbrella in parts of the country. While a large portion of the nation is expected to see fair weather on Election Day, the threat of severe weather, including tornadoes, is possible across the Southeast. The National Weather Service's Storm Prediction Center said that a system moving out of Arkansas will bring an ""enhanced risk"" of severe thunderstorms across northeastern Louisiana into Tennessee from Monday night into Tuesday. ""The best chance for large hail, damaging winds, and tornadoes will be across southeastern Arkansas, northern Mississippi, northwestern Alabama, through Tennessee and Kentucky,"" Fox News Senior Meteorologist Janice Dean said Monday. ""Heavy rain could cause flooding over parts of the Ohio and Tennessee River Valley."" Severe weather with the risk of large hail, damaging winds, and tornadoes is possible across the Southeast from Monday into Election Day. (Fox News) Storms could target the cities of Memphis and Nashville in a state where Rep. Marsha Blackburn, R-Tenn., is facing off against Democratic opponent businessman Phil Bredesen for a Senate seat. Further east, the National Weather Service's Atlanta office said that ""strong to severe thunderstorms"" could be possible in the early morning hours on Tuesday in northwest Georgia, and transitioning southeast as the day goes on. The forecast for Tuesday in states with key Senate races. (Fox News) ""Damaging wind gusts and brief tornadoes remain the primary expected severe threats,"" the NWS said. TOP 10 MOST SHOCKING MIDTERM ELECTION ADS: SIBLING BETRAYAL, RACIAL SLURS AND MORE The Peach State is where Georgia’s secretary of state and Republican gubernatorial hopeful Brian Kemp is locked in a close race against Democrat Stacey Abrams, who could become the first black woman to serve as a U.S. governor. Fox News has rated the race as a “toss-up.” Besides the stormy South, a low-pressure system moving over the Great Lakes and an associated cold front will impact parts of the Midwest and Northeast. ""Rain and storms along the trailing cold front will keep the Northeast, Mid-Atlantic, and Southeast rainy and stormy for Election Day,"" Dean said. How could weather impact voters? Certain types of weather can be shown to have an impact on some voters in deciding whether or not to head to the polls, according to research compiled by AccuWeather. ""Weather was found to be, on average, nearly 20 percent of the change in voter turnout based on our analysis,"" AccuWeather Data Scientist and Meteorologist Tim Loftus said. ""Democrats are more weather sensitive, when compared to Republicans, and among the most weather-sensitive were African-Americans, those 65 and older and 18-24 year olds,"" he said. Studies have also shown that how far work or home is from a polling place could impact voter turnout if the weather isn't great, especially if people have to travel on roads that are affected by a storm. The type of weather can also be an issue, according to Dean. Besides roads that could be icy or snow-covered, people may be wary about waiting outside in lines to vote if there is severe weather in the forecast. In extreme cases, weather can cause a delay in an election. In Bay County, Fla., which was devastated by Hurricane Michael in early October, voters have been given one extra day to cast their ballots in the midterm election. Election officials have set up voting ""supercenters"" because traditional polling stations and the staff to run them, just don't exist after the storm tore through the area. ""Thankfully, our forecast Tuesday, for the most part, should not dissuade too many voters, especially across the Western half of the country,"" Dean said Monday. Fox News' Janice Dean and Samuel Chamberlain contributed to this report.","Fox News Severe weather, rain may impact states with key races for Midterm Elections Fox News As voters head to the polls on Tuesday to cast their votes in the midterm elections, some may need to pack more than an umbrella in parts of the country. While a lar…",2018-11-05T18:48:47Z,"{'id': 'fox-news', 'name': 'Fox News'}","Severe weather, rain may impact states with key races for Midterm Elections - Fox News",https://www.foxnews.com/politics/severe-weather-rain-may-affect-states-with-key-races-for-midterm-elections,https://static.foxnews.com/foxnews.com/content/uploads/2018/11/election-day-forecast.png,fox-news,Fox News,tornado outbreak,1
