author,content,description,publishedAt,source,title,url,urlToImage,source_id,source_name,types,yes_disaster
Jeff Berardelli,"The deadliest tornado to hit the U.S. in six years touched down in Alabama Sunday with winds of 170 mph and a path of 27 miles. It killed 23 people and was part of an early severe weather outbreak with 50 preliminary reports of tornadoes.
But while some were quick to point to climate change as a cause of the tornado outbreak, current science isn't definitive about how much climate change influences tornadoes.  
On Monday, Democratic presidential hopeful Sen. Bernie Sanders posted a warning about climate change and tornadoes on Facebook. ""The science is clear, climate change is making extreme weather events, including tornadoes, worse,"" he wrote.
Sanders is correct to say climate change makes extreme weather worse, though how much that applies to tornadoes is unclear.
But climate change seems to be shifting the concentration and range of tornadoes, pushing them into more vulnerable areas. In addition, evidence suggests there will be a more favorable environment for severe weather -- and probably tornadoes -- in a warmer future.
Recent trends in tornadoes
Finding trends in tornado numbers or even intensity is complicated. That's because the U.S. tornado record is rather short (since the 1950s) and prone to many uncertainties since it is compiled through eyewitness reports.
It's logical to assume that with more people living in remote areas now, you would see an uptick in the number of tornadoes since more are being observed. However, a trend isn't discernable – the graph appears flat.
To the naked eye, it appears there is a trend toward less violent tornadoes. But past inconsistencies in determining the strength of tornadoes make the record hard to trust. For instance, there is evidence that tornadoes may have been rated as more powerful than they actually were before the adoption of the Fujita scale in the late 1970s.
The bottom line is that, so far, there is likely no significant trend in the overall number or intensity of tornadoes. But that doesn't  does not tell the whole story.
The science of tornadoes in a warming climate
Strong tornadoes are formed from a combination of warm, moist, rising air and strong ""wind shear."" Wind shear is a change in wind speed and/or direction with height – that helps provide spin to the supercell thunderstorms that aid in tornado formation.
Tornadoes form when certain ingredients are in place including high instability and vertical wind shear meaning winds are changing with height. This slide goes into some of the science of tornado formation and covers some safety tips as well. #SpringSafety#houwx#bcswxpic.twitter.com/MGRKquOIKm
— NWS Houston (@NWSHouston) March 8, 2018
In this warming world, global climate models clearly show warmth and moisture will increase. But climate models also suggest a general decrease in wind shear in the future. So which will win out: The increase in warm-moist air or the modest decrease in shear?
The devil is in the details
Armed with a global climate model ensemble, a team of researchers at Stanford and Purdue Universities in 2013 found there will be ""robust increases in the occurrence of severe thunderstorm environments over the eastern United States"" in response to global warming.
That result shouldn't be surprising given that more warm, moist, unstable air means more energy for thunderstorms. 
But the team also found something unexpected. The computer models showed that a warmer climate would produce an increase in low-level wind shear on days when the air is more unstable. The team said that suggested ""an increasing likelihood of atmospheric conditions that contribute to the most severe events, including tornadoes.""
It's worth noting that in their study, wind shear does decrease, but the drop is concentrated in more stable, less stormy days. So the general decrease in wind shear has no impact on tornadoes.
Extreme tornado outbreaks getting more extreme
A more recent study published in 2016 titled ""More tornadoes in the most extreme U.S. tornado outbreaks"" hints that some of the conclusions of the 2013 study may be happening now.
CBS News sat down with the lead author of the 2016 study, Columbia University Professor Michael K. Tippett. He explained that, ""Extreme meteorological environments associated with severe thunderstorms show consistent upward trends.""
Tippett analyzed the tornado record back to the 1950s and found that, ""The frequency of U.S. outbreaks with many tornadoes is increasing, and it is increasing faster for more extreme outbreaks.""
But Tippett said it is unclear if the increase in tornadoes per outbreak is being caused by climate change. Tippett said that although the trend is being driven by consistent changes in the environment, the changes aren't necessarily the kind that would be expected from climate change.
Specifically, the study found that, during big tornado outbreak days, unstable air isn't increasing as climate change would imply. Instead, it's wind shear that 's increasing. 
Tippett put it this way: ""Either we don't understand the all impacts of climate change or it's not climate change.""
But he cautioned that, in the future, ""It's clear there will be some impact from climate change such as more frequent conditions that are favorable for supercell thunderstorms and an expansion of favored areas northward.""
""Tornado Alley"" is shifting east
In what is likely the most impactful of all the tornado trends, a fall 2018 study concluded ""Tornado Alley"" is spreading eastward from the Plains States toward the more vulnerable, more densely populated Southeast. The study found that may lead to a threefold increase in disaster potential. The shift is happening as drier, more stable air from the desert Southwest shoves thunderstorm formation eastward. 
Tornado Alley moving east over the past couple decades? New study says tornado frequency decreasing on the Plains and increasing in the east. https://t.co/uE1ldwYJqupic.twitter.com/kfR8z4LN2d
— TornadoTitans.com (@TornadoTitans) October 18, 2018
Lead author Victor Gensini told CBS News, ""It's not a big jump to say that climate change is causing this shift east. The hypothesis and computer simulations support what we are observing and what we expect in the future.""",Is the science that links tornadoes to climate change really clear?,2019-03-06T05:44:02Z,"{'id': 'cbs-news', 'name': 'CBS News'}",What we know about tornadoes and climate change,https://www.cbsnews.com/news/alabama-tornadoes-and-climate-change-what-we-know/,https://cbsnews2.cbsistatic.com/hub/i/r/2019/03/05/6c3d9d5a-c152-473b-9040-7d0072539014/thumbnail/1200x630/a0bf33d4aa9d42bc74604822a70e57ef/alabama-tornado-2019-03-05t000550z.jpg,cbs-news,CBS News,tornado outbreak,1
Kathleen Joyce,"As several Midwestern states are digging out from a spring snowstorm, the South is bracing for weekend thunderstorms that could bring tornadoes.
The National Weather Service said strong winds and hail were expected in the South. Tornadoes are also possible Saturday in parts of Louisiana, Mississippi, Alabama, Arkansas and eastern Texas, and then Sunday in Georgia, according to the forecasts.
""Even a weak tornado that hits the right location can still be pretty devastating,"" Adam Baker, a weather service forecaster, said.
'BOMB CYCLONE' SNOW, WIND MAKING TRAVEL DANGEROUS IN MIDWEST
The National Weather Service issued a severe weather statement Saturday for the west-central Nacogdoches and southeastern Cherokee counties in Texas. A tornado warning was issued in the counties, saying residents could see quarter-size hail as well. 
The National Oceanic and Atmospheric Administration issued several weather watches. The center said the area from east Texas to Mississippi may see strong tornadoes were.
“The most dangerous period for tornadoes being between about 2 to 8 pm. CDT,” the center said.
SPRING SNOWSTORM BURIES MIDWEST, TORNADOES POSSIBLE IN SOUTH
ABC 13 reported a large tornado has been spotted near Hearne, Texas. Hailstones the size of baseballs were spotted in parts of Bexar County, Texas, on Saturday.
On Sunday, the threat for severe storms shifts eastward and stretches from the Ohio River Valley to the Southeast, Fox News meteorologist Brandon Noriega said. On Sunday, thunderstorms were likely to hit Augusta, Ga., where the Masters Tournament is being held, the Weather Channel reported.
CLICK HERE TO GET THE FOX NEWS APP
On Friday, the storm hovering over parts of Minnesota, South Dakota and North Dakota was the second “bomb cyclone” storm system to hit the region in a month. The blizzard was blamed for hundreds of vehicle crashes in Minnesota and left behind 25 inches of snow in northeast South Dakota.
The Associated Press contributed to this report.","Southern states brace for severe weather; tornado warnings issued Fox News Southern US in the crosshairs of a dangerous severe weather, tornado outbreak AccuWeather.com NWS: Tornadoes, damaging winds, large hail possible as severe storms near Houston Chron.co…",2019-04-13T18:41:59Z,"{'id': 'fox-news', 'name': 'Fox News'}",Southern states brace for severe weather; tornado warnings issued - Fox News,https://www.foxnews.com/us/southern-states-severe-weather-tornado-warnings,https://static.foxnews.com/foxnews.com/content/uploads/2019/04/694940094001_6025932046001_6025937270001-vs.jpg,fox-news,Fox News,tornado outbreak,1
,"At a Glance
In classic April fashion, a severe weather outbreak is ahead this weekend.
Saturday's threat includes the potential for some strong tornadoes in parts of the South.
A squall line with damaging winds, and some tornadoes may occur Saturday night into Sunday.
Heavy rainfall and flash flooding are also possible.
An outbreak of severe weather is likely this weekend in the South, including the threat of tornadoes, a few of which may be strong. 
As Wesley exits into Canada later Friday into early Saturday, a southward plunge of the jet stream will pivot out of northern Mexico and the Desert Southwest into the Plains states.
Ahead of that jet-stream disturbance, low pressure will form in the South Saturday and gain strength as it pushes northward into the Ohio Valley Sunday. This strengthening low will draw warm, humid air north from the Gulf of Mexico.
Setup for severe thunderstorms this weekend.
This potentially volatile combination of ingredients may give rise to an outbreak of severe thunderstorms across the South this weekend.
Here is what we know right now. Check back with us at weather.com for the latest on this potentially dangerous situation.
Friday's Forecast
Friday night into early Saturday, rain and thunderstorms should be widespread from the southern Plains to the Tennessee Valley. 
A few strong to severe thunderstorms may develop in parts of Texas, far southern Oklahoma, southwestern Arkansas and northwestern Louisiana. The Dallas-Fort Worth area is included in this threat.
The primary concern will be large hail, but damaging wind gusts are also possible.
Friday Night's Severe Thunderstorm Forecast
(Shaded on the map above is the likelihood of severe thunderstorms, according to NOAA's Storm Prediction Center. Note that not all categories apply for the severe weather risk on a particular day.)
Saturday's Forecast
Severe thunderstorms are most likely from eastern Texas into southern Arkansas, northern Louisiana and western Mississippi. Strong tornadoes, damaging winds, hail and locally flooding rainfall are all possible in these areas. The area shaded in purple in the map below shows where the tornado threat is most significant.
Saturday night into early Sunday, severe thunderstorms may sweep ahead of the cold front into Tennessee, eastern Mississippi, southeast Louisiana and western Alabama. Damaging winds and tornadoes are likely. 
(MORE: Nighttime Tornadoes More Than Twice as Likely to Be Deadly)
Saturday's Severe Thunderstorm Forecast
(Shaded on the map above is the likelihood of severe thunderstorms, according to NOAA's Storm Prediction Center. Note that not all categories apply for the severe weather risk on a particular day.)
Sunday's Forecast
Severe thunderstorms are possible from the Gulf Coast into the Ohio valley and parts of the mid-Atlantic states. 
Severe weather is most likely Sunday from eastern Alabama and Georgia into southern Ohio and eastward in western North Carolina and southwestern Virginia.
Damaging winds are the main severe threat, though a few tornadoes are certainly possible. 
Thunderstorms are likely at the Masters Tournament in Augusta, Georgia on Sunday. 
The risk of severe thunderstorms is expected to gradually decrease Sunday night.
Sunday's Severe Thunderstorm Forecast
(Shaded on the map above is the likelihood of severe thunderstorms, according to NOAA's Storm Prediction Center. Note that not all categories apply for the severe weather risk on a particular day.)
How Much Rain?
In the South, Ohio Valley and East, locally heavy rain may trigger flash flooding in areas that have been recently soaked by rain. However, the frontal system's steady eastward advance should put a cap on the magnitude of the flash flood threat.
Areas from northeastern Texas and eastern Oklahoma into the lower Mississippi and lowe Ohio Valleys have the best chance of flash flooding on Saturday.
Check back with us at weather.com for the latest on this upcoming system.","Severe Weather Outbreak Expected This Weekend in the South, Including Threat of Strong Tornadoes The Weather Channel Severe Thunderstorm Warning: Dayton area counties see wind, heavy rain WHIO What is the severe weather threat for DFW this weekend? WFAA Meteo…",2019-04-12T11:30:02Z,"{'id': None, 'name': 'Weather.com'}","Severe Weather Outbreak Expected This Weekend in the South, Including Threat of Strong Tornadoes - The Weather Channel",https://weather.com/forecast/regional/news/2019-04-12-severe-thunderstorm-tornado-wind-hail-weekend-system-mid-april,https://s.w-x.co/Severe_prim_0412am.jpg,,Weather.com,tornado outbreak,1
Sarah Kaplan and Katie Mettler,"BEAUREGARD, Ala. — Seven members of a single family were among the 23 killed in one of the regions hit hardest by deadly tornadoes that tore through the Southeast, officials said Tuesday.
The names of the victims in Lee County, Alabama were released at a morning news conference two days after the tornadoes flattened homes and businesses.
The oldest was 89, and the youngest was a 6-year-old boy named Armondo ‘‘AJ’’ Hernandez, county coroner Bill Harris said.
The seven family members were connected by marriage.
‘‘Just keep those families in your prayers,’’ Harris said. ‘‘I can’t thank this community enough for jumping in there.’’
President Trump said he plans to visit Alabama on Friday.
‘‘Its been a tragic situation,’’ Trump said from the Roosevelt Room Tuesday afternoon. ‘‘But a lot of good work is being done.’’
Officials worked throughout the day Monday to identify the dead, determine cause of death and notify the victims’ families.
‘‘I learned early that afternoon my resources would be overwhelmed,’’ the coroner said.
He activated a statewide network of coroners who voluntarily came to Lee County to help expedite the process. By 10 p.m. Monday night, all the victims’ bodies had been released to their families so they could begin funeral preparations.
Three members of the Stenson family were killed. When the storm hit on Sunday, Eric Stenson, 38, had been visiting his parents, Henry and Florel Stenson, 65 and 63 respectively. All three were killed.
‘‘He was a good guy,’’ Dusty Bell, 38, said of Eric Stenson. The two were neighbors growing up and played baseball together. Stenson, Bell said, was a ‘‘really good’’ shortstop.
Another victim, 53-year-old David Dean, was known around town as ‘‘Roaddog.’’ How the man got this nickname remains a mystery to Wes Jones, 36, who said Dean had an infectious laugh and deep capacity for love. ‘‘He was so funny,’’ Jones said of Dean. ‘‘There was nothing bad when he was around.’’
As many as eight community members are still unaccounted for, officials said at the news conference. Search and rescue crews will continue combing through debris Tuesday looking for signs of life from people and animals.
Hardly anyone was left untouched by the storm. Even if they survived or their home was left standing, they knew someone else who wasn’t as lucky.
‘‘It’s just a weird feeling where you don’t have no control. Nothing,’’ said Bruce Britt, 52.
The tornado passed within a few miles of his home; he, his wife and daughter weathered the storm in their laundry room.
‘‘And then you know that some people lost their lives,’’ he said, shaking his head. ‘‘It’s terrible, but you really can’t put into words how bad it really is.’’",Seven members of one family are among the 23 dead in Sunday’s tornado outbreak. Trump announces that he will head to Alabama on Friday.,2019-03-05T22:54:13Z,"{'id': None, 'name': 'Bostonglobe.com'}",Tornado outbreak takes the lives of seven members of the same family in Alabama,https://www.bostonglobe.com/news/nation/2019/03/05/tornado-outbreak-takes-lives-seven-members-same-family-alabama/M8FDxAmm2YYysbtQTBTrtN/story.html,https://www.bostonglobe.com/rf/image_585w/Boston/2011-2020/2019/03/05/BostonGlobe.com/National/Images/repeats-b549b322-3f92-11e9-9361-301ffb5bd5e6.jpg,,Bostonglobe.com,tornado outbreak,1
Hemant Mehta,"I know we like pointing out the bizarre Christian reactions when a natural disaster destroys a community but spares a Bible… as if that’s a sign of God’s love. But this is a new one. 
The recent outbreak of tornadoes in Alabama decimated one family’s house. Everything, that is, except a closet where the grandmother used to pray. 
Jason Smith, a member of the Billy Graham Rapid Response Team, shared the image on Facebook, where it quickly went viral.
Listen to me please. I just left a family who survived the tornado in this house and the only left standing is this closet. It’s the grandmother’s prayer closet, and the whole family survived. Are you kiddin me!!! My God is awesome!!! Shout somebody! –Jason–
If that’s the case, then that same “awesome” God has also killed 23 people and injured 97 others. God also destroyed their home. But the closet is still there… so yay?
Thankfully, no one in that family was hurt, but giving God credit for not taking down a few pieces of wood while ignoring the damage you also believe is part of God’s plan is a mark of religious delusion. It’s the same mindset that praises God after a plane crash because there’s a single survivor — you’re missing the point.
It makes me wonder what it would take for these people to stop giving God credit for this nothing-burger. If a family member perished in the disaster, would they still be praising God? If the closet fell but other parts of the house stayed up, would they be upset about it? 
Smith should just admit he’s grasping for any good news he can find instead of pretending God is sending a sign to the people of Alabama. No one deserves praise for destroying all-but-one thing.
(Thanks to Johanna for the link)",God doesn't deserve praise for destroying everything else.,2019-03-26T17:00:13Z,"{'id': None, 'name': 'Patheos.com'}","After Tornado Wrecks AL Town, Chaplain Praises God for Not Touching Prayer Room",https://friendlyatheist.patheos.com/2019/03/26/after-tornado-wrecks-al-town-chaplain-praises-god-for-not-touching-prayer-room/,https://wp-media.patheos.com/subdomain/sites/8/2019/03/54520642_2556767887672488_7783644745208692736_n-768x432.jpg,,Patheos.com,tornado outbreak,1
The Associated Press,"BEAUREGARD, Ala. (AP) A candlelight vigil and grief counseling are being planned as students return to school in an Alabama community where nearly two dozen people died in a tornado outbreak.
Churches are planning an event that will include candlelight remembrances and prayer on Monday night at Beauregard High School in rural east Alabama. An organizer, Angela Bush, tells WSFA-TV that people need hope amid the devastation.
A grief counselor met with teachers Monday to assist them in helping students as classes resume Tuesday in the Lee County school system that includes Beauregard.
Severe weather that included a powerful EF4 tornado devastated parts of the Southeast on March 3, killing 23 people in Beauregard. The dead include 10 members of one extended family and range in age from 6 to 89.
Most Read Nation &amp; World Stories","BEAUREGARD, Ala. (AP) — A candlelight vigil and grief counseling are being planned as students return to school in an Alabama community where nearly two dozen people died in a tornado outbreak. Churches are planning an event that will include candlelight reme…",2019-03-11T17:37:13Z,"{'id': None, 'name': 'Seattletimes.com'}","Vigil, grief counseling planned for tornado community",https://www.seattletimes.com/nation-world/nation/vigil-grief-counseling-planned-for-tornado-community/,https://static.seattletimes.com/wp-content/uploads/2019/03/urn-publicid-ap-org-46216ccfb46a4409b1e3f6186aeba57aAlabama_Tornado_21040-1200x630.jpg,,Seattletimes.com,tornado outbreak,1
