author,content,description,publishedAt,source,title,url,urlToImage,source_id,source_name,types,yes_disaster
Reuters Editorial,"JAKARTA (Reuters) - At least 30 people were killed when a strong earthquake and tsunami hit the city of Palu on Indonesia’s Sulawesi island on Friday, a hospital official told Metro TV in a report broadcast on Saturday. A tsunami up to two meters (six feet) high swept through Palu at dusk after the sleepy but growing tourist resort was rocked by a 7.5 magnitude earthquake. Amateur footage shown by local TV stations, which could not immediately be authenticated by Reuters, showed waters crashing into houses along Palu’s shoreline, scattering shipping containers and flooding into a mosque in the city. “Bodies of victims were found in several places, because they were hit by the rubble of collapsing buildings or swept by tsunami... but we are still collecting data,” Sutopo Purwo Nugroho, National Disaster Mitigation Agency spokesman said on Saturday. Doctor Komang Adi Sujendra told Metro TV that 30 people were killed and their bodies taken to his hospital, adding another 12 injured needed orthopaedic surgery. National Disaster Mitigation Agency spokesman Nugroho declined to give an official death toll. The Palu area was hit by a lighter quake earlier on Friday, which destroyed some houses, killed one person and injured at least 10 in the fishing town of Donggala, closest to the epicenter, authorities said. The U.S. Geological Survey put the magnitude of the second quake at a strong 7.5, after first saying it was 7.7. The quake and tsunami caused a power outage that cut communications around Palu. On Saturday, authorities were still having difficulties coordinating rescue efforts without power and communications as the area was rocked by aftershocks. Metro TV played an amateur footage which showed water remaining from the tsunami, a collapsed bridge, large cracks in roads and buildings badly damaged. Tezar Kodongan, a resident of Palu who took one of the videos, told the TV station some of the city landmarks were broken. “There is no evacuation yet in the disaster area,” Kodongan added. More than 600,000 people live in Donggala and Palu. Reporting by Gayatri Suroyo, Kanupriya Kapoor, Fransiska Nangoy and Fanny Potkin; Editing by Michael Perry","At least 30 people were killed when a strong earthquake and tsunami hit the city of Palu on Indonesia's Sulawesi island on Friday, a hospital official told Metro TV in a report broadcast on Saturday.",2018-09-29T02:34:27Z,"{'id': 'reuters', 'name': 'Reuters'}","Quake, tsunami kills at least 30 on Indonesia's Sulawesi island",https://www.reuters.com/article/us-indonesia-quake/quake-tsunami-kills-at-least-30-on-indonesias-sulawesi-island-idUSKCN1M900U,https://s1.reutersmedia.net/resources/r/?m=02&d=20180929&t=2&i=1309295347&w=1200&r=LYNXNPEE8S010,reuters,Reuters,quake,1
Reuters Editorial,"PALU, Indonesia (Reuters) - At least 384 people were killed, many swept away as giant waves crashed onto beaches, when a major earthquake and tsunami hit the Indonesian island of Sulawesi, authorities said on Saturday. Hundreds of people had gathered for a festival on the beach in the city of Palu on Friday when waves as high as six meters (18 feet) smashed onshore at dusk, sweeping many to their deaths and destroying anything in their path. The tsunami followed a 7.5 magnitude earthquake. “When the (tsunami) threat arose yesterday, people were still doing their activities on the beach and did not immediately run and they became victims,” Sutopo Purwo Nugroho, the spokesman for Indonesia’s disaster mitigation agency BNPB said in a briefing in Jakarta. “The tsunami didn’t come by itself, it dragged cars, logs, houses, it hit everything on land,” Nugroho said, adding that the tsunami had traveled across the open sea at speeds of 800 kph (497 mph) before striking the shoreline. Some people climbed trees to escape the tsunami and survived, he said. Amateur footage shown by local TV stations showed waves crashing into houses along Palu’s shoreline, scattering shipping containers and flooding into a mosque in the city. Photos confirmed by authorities showed bodies being lined up along the street on Saturday, some in bags and some with their faces covered with clothes. Around 16,700 people were evacuated to 24 centers in Palu. Aerial photographs released by the disaster agency showed many buildings and shops destroyed, bridges twisted and collapsed and a mosque surrounded by water. Graphic: Sulawesi map - tmsnrt.rs/2OYa4YD DEATH TOLL SEEN RISING Aftershocks continued to rock the coastal city on Saturday. The series of earthquakes were felt in an area with 2.4 million people. Indonesia’s Agency for the Assessment and Application of Technology (BPPT) said in statement the energy released by Friday’s massive quake was around 200 times the power of the atomic bomb dropped on Hiroshima in World War Two. The geography of the city, which sits at the end of a long, narrow bay, could have magnified the size of the tsunami, it said. Nugroho described the damage as “extensive” and said thousands of houses, hospitals, shopping malls and hotels had collapsed. A bridge was washed away and the main highway to Palu was cut off due to a landslide. Bodies of some victims were found trapped under the rubble of collapsed buildings, he said, adding 540 people were injured and 29 were missing. Dozens of injured people were being treated in makeshift medical tents set up outdoors, TV images showed. Nugroho said the casualties and the damage could be greater along the coastline 300 km (190 miles) north of Palu, an area called Donggala, which is closer to the epicenter of the quake. Communications “were totally crippled with no information” from Donggala, Nugroho said. More than 600,000 people live in Donggala and Palu. “We’re now getting limited communications about the destruction in Palu city, but we have heard nothing from Donggala and this is extremely worrying. There are more than 300,000 people living there,” the Red Cross said in a statement, adding that its staff and volunteers were heading to the affected areas. “This is already a tragedy, but it could get much worse,” it said. Vice President Jusuf Kalla said the death toll could rise to thousands. PRESIDENT TO VISIT DISASTER AREA Indonesia’s meteorological and geophysics agency BMKG issued a tsunami warning after the quake, but lifted it 34 minutes later. The agency on Saturday was widely criticized for not informing that a tsunami had hit Palu, though officials said waves had come within the time the warning was issued. In amateur footage shared on social media a man on the upper floor of a building can be heard shouting frantic warnings of the approaching tsunami to people on the street below. Within minutes a wall of water crashes onto the shore, carrying away buildings and cars. Reuters was not able to immediately authenticate the footage. The quake and tsunami caused a major power outage that cut communications around Palu making it difficult for authorities to coordinate rescue efforts. The military has started sending in cargo planes with aid from Jakarta and other cities, authorities said, but evacuees still badly need food and other basic necessities. The city’s airport has been reopened only for relief efforts and will remain closed until Oct. 4 for commercial flights, Nugroho said. The airport’s runway and air traffic control tower were damaged in the quake, authorities said. President Joko Widodo was scheduled to visit evacuation centers in Palu on Sunday. Indonesia sits on the Pacific Ring of Fire and is regularly hit by earthquakes. In August, a series of major quakes killed more than 500 people in the tourist island of Lombok and destroyed dozens of villages along its northern coast. Palu was hit by tsunami in 1927 and 1968, according to BNPB. Reporting by Reuters stringer in PALU, Agustinus Beo Da Costa and Gayatri Suroyo, Fransiska Nangoy and Kanupriya Kapoor in JAKARTA; Editing by Michael Perry and Alex Richardson","At least 384 people were killed, many swept away as giant waves crashed onto beaches, when a major earthquake and tsunami hit the Indonesian island of Sulawesi, authorities said on Saturday.",2018-09-29T16:30:24Z,"{'id': 'reuters', 'name': 'Reuters'}","Hundreds killed by Indonesian quake, tsunami, with toll seen rising",https://www.reuters.com/article/us-indonesia-quake/hundreds-killed-by-indonesian-quake-tsunami-with-toll-seen-rising-idUSKCN1M900U,https://s3.reutersmedia.net/resources/r/?m=02&d=20180929&t=2&i=1309353505&w=1200&r=LYNXNPEE8S046,reuters,Reuters,quake,1
Luke Plunkett,"Continuing in the fine recent tradition of games like Dusk and Ion Maiden, WRATH: Aeon of Ruin is an upcoming shooter that is being built using original Quake tech.
Its by 3D Realmswho own the name, if not the personnel and legacy of the original Duke Nukem creatorsand it looks cool as hell.
Its currently slated for release in Summer 2019.","Continuing in the fine recent tradition of games like Dusk and Ion Maiden, WRATH: Aeon of Ruin is an upcoming shooter that is being built using the original Quake engine. Read more...",2019-03-07T23:00:00Z,"{'id': None, 'name': 'Kotaku.com'}",2019 Game Is Out Here Looking Just Like 1996's Quake,https://kotaku.com/2019-game-is-out-here-looking-just-like-1996s-quake-1833137973,"https://i.kinja-img.com/gawker-media/image/upload/s--2zLZaqhf--/c_fill,fl_progressive,g_center,h_900,q_80,w_1600/g1mhijefvxsbpn8uaqgd.jpg",,Kotaku.com,quake,1
Alexandra Ulmer,"CARACAS (Reuters) - A major earthquake of magnitude 7.3 struck Venezuela’s eastern coast, home to largely poor fishing communities, on Tuesday afternoon, shaking buildings as far away as Colombian capital Bogota and knocking power out in parts of Trinidad. But the quake’s depth - 76.5 miles (123 km) below the surface - appeared to have mitigated the damage. Venezuelan officials said there were no immediate reports of injuries and two sources at state oil company PDVSA [PDVSA.UL] told Reuters the OPEC member’s refineries and oil fields were operating normally. PDVSA did not immediately comment. Venezuela is not in a good shape to deal with a natural disaster. It is already wrestling with a crippling economic crisis with medicine running short, hospitals barely able to function and some severe shortages of basics such as chicken and milk. The tremor - one of the country’s strongest ever - hit at 5.31 p.m. (2131 GMT). Along Venezuela’s picturesque palm tree-dotted northern coast, residents said the long quake was terrifying and frightened people into dashing into the streets. “I had gotten into bed to watch the news on TV and my bed started to move as if it was made of water,” said Elia Sanchez, a doctor in Cumana, the capital of the eastern state of Sucre that was the closest to the coastal epicenter. “We had to go down nine floors, it felt like it would never end.” Rosymer Rodriguez, also in Cumana, said she could not see any significant damage but that people were still fearful. “There are still people in the street. There are people packing bags in case there are aftershocks,” said Rodriguez. Damage in Caracas was limited, but the quake did tilt the top five floors of an abandoned 45-story skyscraper known as the ‘Tower of David’, Interior Minister Nestor Reverol said. The tower, originally intended to be a bank center but abandoned since 1994 and later occupied by squatters for years, dominates Caracas’ skyline. It features in the U.S. television spy drama “Homeland”. Pictures after the quake showed the building’s top floors, which are unfinished, leaning sideways. Out east, the governor of Sucre called for calm. “Do not fall victim to psychological terror, messages about a tsunami and all that,” said governor Edwin Rojas, who belongs to President Nicolas Maduro’s Socialist Party. The Information Ministry did not respond to a request for comment for additional information. ANDES, CARIBBEAN HIT The quake was felt in capital Caracas, neighboring Colombia and nearby island nations like Trinidad and Tobago, and St. Lucia, to the west and north. In Trinidad and Tobago, there were initial reports of some cracks to buildings, cars damaged when concrete debris fell on them, and loss of electricity. Traffic jams formed on highways in Port of Spain, but there were no immediate reports of casualties there either. Colombia’s government said the country was unharmed too, although workers dashed out of high-rise blocks in the mountainous capital Bogota. “It was a moment of panic, we thought the worst,” said Jimena Valencia, a 29-year-old administrator in the north of Bogota. The U.S. Pacific Tsunami Center canceled an earlier warning of a possible tsunami along the coast near the epicenter, some 190 kilometers (118 miles) from Cumana. United States Geological Survey geophysicist Jessica Turner said the quake’s depth would have dampened some of the shaking. “A 7.3 magnitude quake is going to cause some damage, particularly as in this area, structures are vulnerable. The Earth is able to absorb some of the energy, but a 7.3 quake produces a lot of energy,” she said by telephone. Additional reporting by Vivian Sequera, Brian Ellsworth, Shaylim Castro, Corina Pons and Mayela Armas in Caracas, Sandra Maler in Washington, Helen Murphy in Bogota, Linda Hutchinson-Jafar in Port of Spain, and Marianna Parraga in Mexico City; Writing by Alexandra Ulmer; Editing by Peter Cooney, Rosalba O'Brien and Sandra Maler","Reuters Powerful quake hits Venezuela coast, damage limited Reuters CARACAS (Reuters) - A major earthquake of magnitude 7.3 struck Venezuela's eastern coast, home to largely poor fishing communities, on Tuesday afternoon, shaking buildings as far away as Colo…",2018-08-22T01:33:38Z,"{'id': 'reuters', 'name': 'Reuters'}","Powerful quake hits Venezuela coast, damage limited - Reuters",https://uk.reuters.com/article/us-venezuela-quake/magnitude-7-quake-hits-northern-venezuela-coast-usgs-idUKKCN1L6278,https://s2.reutersmedia.net/resources/r/?m=02&d=20180822&t=2&i=1296098320&w=1200&r=LYNXNPEE7L02H,reuters,Reuters,quake,1
Pelmorex Weather Networks Inc.,"OREGON QUAKE | Concerns over the 'Big One' Digital writers theweathernetwork.com Wednesday, August 22, 2018, 7:39 AM - An offshore earthquake with a magnitude of 6.2 hit 302 km (188 miles) west of Bandon, Oregon, on Wednesday, the United States Geological Survey (USGS) said. The quake was recorded at a depth of about 10 km, according to the USGS website and was located approximately 600 km to the nearest point in British Columbia. No immediate tsunami warning was posted and government officials in B.C. also assured no tsunami threat for the province Wednesday morning. A 6.2 magnitude earthquake struck approximately 400 km off the Oregon coast and approximately 600 km to the nearest point in BC. Tsunami NOT expected https://t.co/2MCsB9qOHa — Emergency Info BC (@EmergencyInfoBC) August 22, 2018 THE BIG ONE? Although nothing came of this particular tremor, people on the west coast of North America, including British Columbia, know they live in a seismically active zone, and that one day, a serious quake will strike. Its' been said that an earthquake measuring a magnitude 9.0 or greater could occur in the next 50 years in British Columbia. (SEE ALSO: Prime Minister Justin Trudeau to visit first responders, evacuees of B.C. wildfires ) The government is continually working to apply seismic upgrades across B.C. from school renovations to new construction projects being subject to follow updated quake-resistant requirements. Read more on how millions of dollars are spent on preparing for the next Canadian 'Big One'. WEDNESDAY'S QUAKE LOOK BACK (JANUARY): TSUNAMI WARNINGS TRIGGERED IN B.C. AFTER BIG ALASKAN QUAKE","The Weather Network Massive quake hits west of Oregon, about 600 km from BC The Weather Network Wednesday, August 22, 2018, 7:39 AM - An offshore earthquake with a magnitude of 6.2 hit 302 km (188 miles) west of Bandon, Oregon, on Wednesday, the United States…",2018-08-22T12:12:59Z,"{'id': None, 'name': 'Theweathernetwork.com'}","Massive quake hits west of Oregon, about 600 km from BC - The Weather Network",https://www.theweathernetwork.com/news/articles/oregon-earthquake-no-tsunami-warning-600-kilometres-from-british-columbia-sparks-concerns-over-the-big-one/109836,http://smedia.twnmm.com/storage.filemobile.com/storage/33292045,,Theweathernetwork.com,quake,1
Reuters Editorial,"TOKYO (Reuters) - A coal-fired power plant supplying half of Japan’s northern Hokkaido island was damaged in a powerful earthquake that struck earlier on Thursday, the country’s industry ministry said. Hokkaido Electric Power ( 9509.T ), the plant’s operator, said earlier it shut down all its remaining fossil fueled plants in the immediate aftermath of the quake, leaving all of its 2.95 million customers without power. The 350 megawatt (MW) capacity No.1 unit and the 600 MW No.2 unit at the Tomato-Atsuma plant operated by Hokkaido Electric Power ( 9509.T ) have been damaged, the ministry said, without specifying the nature of the damage. Hokkaido Electric is preparing to restart the plant’s 700 MW No.4 unit, the ministry said, without saying when power supplies would resume. Reporting by Osamu Tsukimori; Writing by Aaron Sheldrick; Editing by Kenneth Maxwell","A coal-fired power plant supplying half of Japan's northern Hokkaido island was damaged in a powerful earthquake that struck earlier on Thursday, the country's industry ministry said.",2018-09-06T02:54:28Z,"{'id': 'reuters', 'name': 'Reuters'}",Japan government says quake-hit Hokkaido's main power plant damaged,https://www.reuters.com/article/us-japan-quake-hokkaido-elecpwr/japan-government-says-quake-hit-hokkaidos-main-power-plant-damaged-idUSKCN1LM09N,https://s4.reutersmedia.net/resources_v2/images/rcom-default.png,reuters,Reuters,quake,1
id-Software,"Join GitHub today GitHub is home to over 20 million developers working together to host and review code, manage projects, and build software together. Sign up",Quake-III-Arena - Quake III Arena GPL Source Release,2018-04-17T08:51:43Z,"{'id': None, 'name': 'Github.com'}",Quake III Arena (GPL Source Release),https://github.com/id-Software/Quake-III-Arena,https://avatars3.githubusercontent.com/u/1395534?s=400&v=4,,Github.com,quake,1
Owen S. Good,"Quake Champions ’ latest update in early access is gonna kick it old-school: Custom games will now have a “No Abilities” mode that throws it back to the days of vanilla Quake, for all the get-off-my-lawn types who want to brag about their true skills in arena shooters. The March update, live right now, also returns the one-shot kill Instagib mode, as well as two-on-two ranked play. There are also some Easter-themed cosmetics as we move into springtime for Quakeguy. The updates coincide with the release of the Scalebearer Pack beginning tomorrow. For $4.99, it gives players early access to the game (through Steam and Bethesda.net), Scalebearer and Ranger (Quakeguy) as permanently unlocked playable champions, and three days to play as anyone else in the cast of characters. Quake Champions is modeling itself as a free-to-play game, where the roster is “rented” either by earning in-game currency or bought outright for real money. So the No Abilities mode neutralizes any skills special to a champion and reduces everyone to the basic running, gunning and jumping of the original game. As always, the “Champions Pack” is still on sale for $29.99, which gives players access to everything, plus other in-game bonuses. The Quake websie has more information. Quake Champions is available for Windows PC. It was announced at E3 2016 and went into early access in August 2017.","Step right up, ‘Quake dads’ who want to brag about their skills",2018-03-15T17:15:01Z,"{'id': 'polygon', 'name': 'Polygon'}",Quake Champions’ new update turns off hero abilities,https://www.polygon.com/2018/3/15/17125332/quake-champions-march-update,https://cdn.vox-cdn.com/thumbor/ohqj9rhcqSzo6qwRXQAWvok0fG0=/0x7:1276x675/fit-in/1200x630/cdn.vox-cdn.com/uploads/chorus_asset/file/10432501/Screen_Shot_2018_03_15_at_12.59.10_PM.png,polygon,Polygon,quake,1
Don Sweeney,"A light earthquake shook Southern California early Thursday, marking the latest in a burst of seismic and volcanic activity along the Ring of Fire. The 4.0-magnitude quake took place just after 2 a.m. about 31 miles southeast of Anaheim, according to the U.S. Geological Survey. It follows a 6.2-magnitude quake in Japan on Wednesday and a 7.9-magnitude quake in Alaska on Tuesday that prompted a quickly canceled tsunami warning for the West Coast. Significant earthquakes in Indonesia and Chile also have been reported this week. In addition, volcanic eruptions in the Philippines, Indonesia, Bali and Japan continue to spew ash and lava, forcing the evacuation of tens of thousands of people. The eruption Tuesday of Mount Kusatsu-Shirane in Japan killed a soldier and injured more than a dozen people, including several at a nearby ski resort. The United Nations Office for Disaster Risk Reduction on Tuesday tweeted a warning that the Ring of Fire was “active.” What is the Ring of Fire? The Ring of Fire refers to a sprawling, horseshoe-shaped geological disaster zone in the Pacific, according to ABC News. The ring stretches 25,000 miles from New Zealand through Indonesia, the Philippines and Japan to Alaska, Canada and the West Coast down to South America. It contains 452 volcanoes and several tectonic plates in the earth’s crust. Fitting together like a puzzle, the tectonic plates constantly shift and collide, producing earthquakes. Scientists say the recent series of quakes and volcanic eruptions are merely business as usual for the Ring of Fire. “It just so happens that these events are occurring at the same time in different parts of the region,” Chris Elders, a geology expert from Curtin University in Australia, told the BBC. “There’s not necessarily a relationship between them.” Janine Krippner, a New Zealand volcanologist based in the United States, reminded people that “It’s not referred to as the ‘ring of fire’ because it sits there doing nothing.” Krippner told the BBC that while satellite imagery and the internet have made people around the world more aware of eruptions and seismic activity, that doesn’t mean they’ve actually become more common.","Washington Times Another quake rattles the West Coast. What's going on with the Ring of Fire? Sacramento Bee A light earthquake shook Southern California early Thursday, marking the latest in a burst of seismic and volcanic activity along the Ring of Fire. Th…",2018-01-25T15:27:00Z,"{'id': None, 'name': 'Sacbee.com'}",Another quake rattles the West Coast. What's going on with the Ring of Fire? - Sacramento Bee,http://www.sacbee.com/news/nation-world/world/article196577489.html,http://pics.mcclatchyinteractive.com/news/nation-world/world/pef8d3/picture196577474/alternates/LANDSCAPE_1140/APTOPIX%20Philippines%20Volcano,,Sacbee.com,quake,1
