author,content,description,publishedAt,source,title,url,urlToImage,source_id,source_name,types,yes_disaster
BBC News,"Image copyright Getty Images Image caption Emergency teams say there is now little hope of finding any more survivors Thousands of Iranians have spent a second night outdoors in near-freezing temperatures after a devastating earthquake hit the west of the country. The government is scrambling to get aid to the worst-hit area in the mountainous province of Kermanshah, where hundreds of homes were destroyed. More than 400 people were killed and about 7,000 injured when the quake hit near the Iran-Iraq border on Sunday. Iran has declared Tuesday a national day of mourning. President Hassan Rouhani is due to visit the region. Iranian officials said 413 people had died in the country. In the more sparsely populated areas across the border in Iraq, officials said nine people had died and several hundred were injured. Iranian state TV said thousands of survivors were spending another night in makeshift camps or in the open. Many whose homes were still intact were frightened of returning because of dozens of aftershocks. ""It is a very cold night... we need help. We need everything. The authorities should speed up their help,"" said one homeless young woman in Sarpol-e-Zahab, where most of the victims died. One aid agency said 70,000 people needed shelter and the UN said it was ""ready to assist if required"". Later on Monday, Iranian emergency officials said the search for any more survivors was largely over. Image copyright EPA Image caption Temporary hospitals have been set up in some areas Image copyright EPA Image caption medical centres have been struggling to cope with the number of injured Maj Gen Mohammad Ali Jafari, head of the elite Islamic Revolutionary Guards Corps (IRGC), said that the immediate needs were tents, water and food. ""Newly constructed buildings... held up well, but the old houses built with earth were totally destroyed,"" he told state TV while visiting the affected region. The Iranian Red Crescent said many areas lacked water and electricity and that aid supplies were being hampered by blocked roads. Iranian army helicopters were taking part in the relief effort. About 30 Red Crescent teams are working in the earthquake zone, the official Irna news agency reported. Media caption The moment the Iran-Iraq quake hits Darbandikhan Dam control room Authorities said that more than 30,000 houses had been damaged and at least two villages completely destroyed. The 7.3-magnitude quake - the deadliest in the world this year - struck at 21:18 local time (18:18 GMT) about 30km (19 miles) south of Darbandikhan, near the north-eastern border with Iran, the US Geological Survey (USGS) said. Tremors were felt as far away as Turkey, Israel and Kuwait. In Sarpol-e-Zahab on Monday a woman and her baby were pulled alive from rubble, Iranian media said. The town's main hospital was badly damaged and was struggling to treat hundreds of injured people, state TV reported.",Thousands of Iranian endure near-freezing conditions without shelter after Sunday's earthquake.,2017-11-14T04:31:17Z,"{'id': 'bbc-news', 'name': 'BBC News'}",Iran quake survivors endure second night without shelter,http://www.bbc.co.uk/news/world-middle-east-41977714,https://ichef-1.bbci.co.uk/news/1024/cpsprodpb/A5FD/production/_98739424_gettyimages-873452506.jpg,bbc-news,BBC News,quake,1
Ryan F. Mandelbaum,"A powerful earthquake struck Taiwan today, causing damage and a partially collapsed hotel building, sources report. The USGS reports that the magnitude 6.4 quake struck 21 kilometers (13 miles) north of the city of Hualien at 10:50 U.S. Eastern Time, at a shallow 9.5 kilometers (6 miles) below the surface. No tsunami warnings have been issued. The English-language Taiwan News and the BBC report that a number of buildings have collapsed in Hualien City, including a roof of a hotel. There are no reports of injuries yet. Residents as far away as Taipei (around 120 kilometers (75 miles) north) could feel tremors. This is the second powerful earthquake in the area in just a few days. A magnitude 6.1 earthquake struck in nearly the same spot on Sunday (Monday Taiwan time). Taiwan’s location on the geologically active Pacific Ring of Fire means they’re no stranger to tremors. Many of the country’s buildings are built to withstand some shaking. With a quake of this size there’s always the potential for aftershocks. “We haven’t seen any large enough here to record yet,” John Bellini from the USGS told Gizmodo. “But don’t have the local instrumentation they would have. I wouldn’t be surprised for there to be a number of aftershocks in the next couple of days.” This story is developing. We will update the post when we know more. [via Taiwan News and USGS ]","A powerful earthquake struck Taiwan today, causing damage and a partially collapsed hotel building, sources report. Read more...",2018-02-06T17:26:00Z,"{'id': None, 'name': 'Gizmodo.com'}","Powerful Earthquake Hits Taiwan, Partially Collapses Hotel",https://gizmodo.com/powerful-earthquake-hits-taiwan-partially-collapses-ho-1822765351,"https://i.kinja-img.com/gawker-media/image/upload/s--y5ecF7qr--/c_fill,fl_progressive,g_center,h_900,q_80,w_1600/bgggn48tuy7jf7tmflvo.png",,Gizmodo.com,quake,1
THOMAS ERDBRINK,"Iranian officials put the epicenter of the quake inside Iran, near the border town of Ezgeleh. The region is a patchwork of farms and is home to many Kurds, a large ethnic minority in Iran. Initial reports from the Kurdish region of Iraq indicated less damage and fewer deaths on that side of the border. In Sulaimaniya, the second-largest city in Iraq’s Kurdish region, residents described feeling heavy tremors but said there was no notable building damage. Residents in the oil-rich town of Kirkuk, some 50 miles to the west, reported similar damage. The earthquake was felt as far as the Mediterranean coast of Israel. Shiite pilgrims in the Iraqi city of Kerbala, for the annual religious commemoration of Arba’een, posted videos of people gathering on the streets after the earthquake occurred. Iran lies on dozens of fault lines and is prone to quakes. In 2012, a double earthquake in the north of the country killed 300 people. When ordinary Iranians learned of the government’s lackluster relief efforts, some started organizing aid groups themselves. In 2003, more than 20,000 people were killed and an ancient citadel was destroyed in the southern city of Bam. After that quake, the United States, which does not maintain normal diplomatic relations with Iran, sent several planeloads of aid. Continue reading the main story","Ayatollah Ali Khamenei, Iran’s supreme leader, urged rescuers to keep looking for survivors after a 7.3 magnitude earthquake near the western border.",2017-11-13T06:54:39Z,"{'id': 'the-new-york-times', 'name': 'The New York Times'}",Iran-Iraq Earthquake Kills More Than 200 Near Border,https://www.nytimes.com/2017/11/13/world/middleeast/iran-iraq-earthquake.html,https://static01.nyt.com/images/2017/11/14/world/14iran-1/14iran-1-facebookJumbo.jpg,the-new-york-times,The New York Times,quake,1
JOSE A. DEL REAL,"The state is also prone to all kinds of natural disasters, not just quakes. The earthquakes dont faze me at all, Mr. Sulczynski said. Ive lived through a couple of volcano explosions where our town was covered in ash. Yeah, its always kind of interesting, I suppose. In fact, he said, his main complaint is much more prosaic. The only thing that kind of gets me once in a while, especially when Im working a lot, is the winters, when its dark, he said. You go to work, sit in an office all day, and then you get out and its still dark. I get pretty grumpy. But he also deeply enjoys life in his coastal town, he said; he can kite-ski, kayak, surf, hike. He particularly enjoys long rides along scenic Alaska highways on his motorcycle. Like many Alaskans, he was born elsewhere, moved to Alaska on a lark, and has fallen in love with the state. He grew up in San Jose, Calif., and moved to Homer 18 years ago to be closer to his wifes family (they have since divorced). His hometown was suburbia at its finest, or worst, depending on your take, he said. Its a great place for me to visit and to vacation for a week. But the millions of people and freeways and traffic and strip malls and all that Im just so over it. He said he would never move back: Alaska is home. Once youve been an Alaskan long enough, you really dont belong anywhere else.","Well, sure, the earth tried to swallow his S.U.V., but Tomasz Sulczynski still had a plane to catch. Alaskans proud of their resilience in the face of a surfeit of natural disasters applauded.",2018-12-03T01:24:34Z,"{'id': 'the-new-york-times', 'name': 'The New York Times'}","In Unfazed Alaska, a Major Quake Is Just a Bump in the Road",https://www.nytimes.com/2018/12/02/us/alaska-earthquake-sinkhole.html,https://static01.nyt.com/images/2018/12/03/us/03alaska1/03alaska1-facebookJumbo.jpg,the-new-york-times,The New York Times,quake,1
THOMAS FULLER,"With the median price of a home in California now above $500,000, estimates of the potential uncovered losses in an earthquake run into the hundreds of billions of dollars. Economists say a large earthquake could have serious repercussions for local California banks. And with one-fifth of America’s $10 trillion in mortgage debt held in California, Fannie Mae or Freddie Mac, the government mortgage finance giants that guarantee much of America’s mortgage debt, are also exposed to the risk, economists say. Those who have lived through major earthquakes recount how damaging they can be, even to ordinary wood-structure homes, which are considered among the safest. Art Polan and his wife were still sleeping when the Northridge earthquake struck their two-story home in 1994. Bookshelves crashed to the floor, and the china in the kitchen spilled out of closets. “The house was totaled,” Mr. Polan said. The insurance payout he received was not enough to rebuild the house, so with the help of a federal loan, he moved and built elsewhere. Cindy Watter remembers the Napa earthquake of 2014 sounding like “a runaway train full of howling beasts was outside my back door.” Her two-story Victorian home, built in 1895, had relatively light damage, but her neighbors were not as lucky. One house burned to the ground because of a gas fire. “Lots of people around here took a real financial hit and couldn’t afford to fix up their houses, so they sold them and moved away,” Ms. Watter said. “I still have earthquake insurance because, well, you never know.” Insurance is not a panacea, experts say. Even if every building in California were insured, a large earthquake could nonetheless have a devastating impact on the economy.","Experts warn that California property, both commercial and residential, is vastly underinsured. “What are we going to do when no one has insurance and everyone has damage?”",2018-08-31T18:40:07Z,"{'id': 'the-new-york-times', 'name': 'The New York Times'}","In Quake-Prone California, Alarm at Scant Insurance Coverage",https://www.nytimes.com/2018/08/31/us/california-earthquake-insurance.html,https://static01.nyt.com/images/2018/08/30/us/00quakeinsurance-01/00quakeinsurance-01-facebookJumbo.jpg,the-new-york-times,The New York Times,quake,1
"Matt Rivers, Jo Shelley and Ben Westcott, CNN","(CNN) Desperation is growing in the stricken Indonesian city of Palu, as residents faced a fifth day without adequate supplies of food and clean drinking water, amid a sharp rise in the official death toll following Friday's devastating earthquake and tsunami. Indonesia's national disaster agency said the number of people killed in the disaster had risen to 1,234 on Tuesday. The toll is expected to continue to climb in the coming days as bodies continue to be retrieved from under the rubble. The situation for those left alive has grown increasingly dire, as families scramble to get even the most basic of goods. On Tuesday, motorists lined up for hours around the block in the blazing sun, standing among the ruins and debris, in the hope of obtaining a small amount of gas. At the last available gas pump in town, large group of men crowd around a single overworked attendant. In his hand is a wad of cash nearly too big to grip. Money though is of little use when their is nothing left to buy. Roads to Palu -- a city of 350,000 people -- remain blocked and aid has been slow to trickle in. Indonesian vessels carrying food and water has still yet to arrive. Indonesian military have been patrolling the streets in Palu over the past 24 hours to crack down looting by desperate survivors, searching for limited supplies and goods. An official from the International Federation of the Red Cross and Red Crescent described the situation on the ground as ""nightmarish."" Bodies of victims remain unburied on the side of the roads. In a public cemetery on the outskirts of the city, workers are digging a mass grave the size of a football pitch to try to bury as many bodies as quickly as possible before disease begins to spread. Almost 200 bodies are in this pit alone, with more still being added every hour. A few ID cards lie on the ground next to the pit, but not all bodies have been identified before they were laid to rest. Amid the long wait for supplies and aid, the desperate search continues for survivors with reports of more than 700 houses buried under a mudslide in a nearby town, which still remain unexplored. 'I need to get the kids out of here' An estimated 2.4 million people have been affected by the disaster, according to Indonesian National Board for Disaster Management spokesman Sutopo Purwo Nugroho. He said Tuesday that 799 were injured, and more than 61,000 people have been displaced. In total, Sutopo said 66,000 homes had been destroyed so far. Desperate to leave the scene of the disaster and escape the treat of looting, thousands of locals were queuing at Palu airport with children and belongings in the hope of a way out. ""People are trying to get stuff from my house so I needed to get the kids out of here... they're trying to rob us,"" one local woman told CNN Monday as she waited in line at the airport. While some residents are battling to escape the surrounding area, international aid organizations and Indonesian military are trying their hardest to reach as much of the region as possible. Palates of supplies are en route to the affected area courtesy of the organization like the Red Cross, who sent seven tons of logistical supplies from Jakarta on Tuesday. Countries from around the world have begun to announce aid packages for Indonesia as well. Australia, one of the country's closest neighbors, said it had already provided $500,000 of support immediately through the Indonesian Red Cross. ""Australia has some expertise and has resources in particular areas we can deploy, and we are looking to see how we can best fit the need,"" Australian Prime Minister Scott Morrison said Tuesday. The United States announced it had released $100,000 in initial disaster assistance on Monday, according to a state department spokesman. But on the ground, there's little evidence so far of the pledged aid with shipments expected to arrive in the days ahead.","Desperation is growing in the stricken Indonesian city of Palu, as residents faced a fifth day without adequate supplies of food and clean drinking water, amid a sharp rise in the official death toll following Friday's devastating earthquake and tsunami.",2018-10-02T08:09:11Z,"{'id': 'cnn', 'name': 'CNN'}","More than 1,200 were killed in Indonesia quake and tsunami",https://www.cnn.com/2018/10/02/asia/indonesia-palu-tsunami-earthquake-intl/index.html,https://cdn.cnn.com/cnnnext/dam/assets/181002151513-03-palu-tuesday-super-tease.jpg,cnn,CNN,quake,1
Andrew Freedman,"A magnitude 7.9 earthquake struck about 170 miles southeast of Kodiak, Alaska early Tuesday morning, sending residents of the picturesque island fleeing to higher ground to avoid tsunami waves. The quake also prompted tsunami alerts along the West Coast of the U.S. and Hawaii, but those were canceled after data showed damaging waves were not expected. Since the first quake hit there have been several aftershocks, some of which have been strong earthquakes themselves, with a magnitude of up to 5.3 on the Richter Scale. Reports indicated water fluctuating by up to 1 foot in a channel that feeds into Kodiak Harbor, but no large, damaging waves. SEE ALSO: 2017 was one of Earth's top 3 hottest years on record, which should come as no surprise Tsunamis are caused by earthquakes, when sudden shifts in the seafloor displace enough water to set in motion waves at the surface that can travel across an ocean in a matter of hours. The magnitude 7.9 earthquake occurred along a ""strike-slip"" fault, where two plates grind past one another. These earthquakes don't typically give rise to large tsunamis, since they tend to involve horizontal, rather than vertical, motion. This morning's 7.9 earthquake occurred along a strike-slip fault. The horizontal movement of the two plates in a strike-slip fault, typically limits the threat of tsunami's pic.twitter.com/o7kgwNHqxS — Greg Diamond (@gdimeweather) January 23, 2018 Alaska has a long history of powerful earthquakes and tsunamis. People who live along the coast are well aware of the need to get to higher ground during a tsunami threat. Experts are warning of the continued threat of aftershocks, some of which could be as strong as magnitude 6.0. Alaska's Kodiak Police Department told residents in a video posted 20 minutes ago to evacuate their homes and move to ground at least 100 ft or higher amid tsunami alert. pic.twitter.com/biU8XaEnr3 — NBC Nightly News with Lester Holt (@NBCNightlyNews) January 23, 2018 This quake was on the stronger side, but was not the strongest earthquake on record to strike the state. In 1964, Alaska was hit by an earthquake of magnitude 9.2 intensity. This remains the most powerful earthquake in North American history, and it caused widespread damage in south-central Alaska, along with about 140 deaths.","A magnitude 7.9 earthquake struck about 170 miles southeast of Kodiak, Alaska early Tuesday morning, sending residents of the picturesque island fleeing to higher ground to avoid tsunami waves. The quake also prompted tsunami alerts along the West Coast of th…",2018-01-23T15:26:06Z,"{'id': 'mashable', 'name': 'Mashable'}",Powerful undersea earthquake prompts Alaska residents to scramble for higher ground,http://mashable.com/2018/01/23/alaska-powerful-earthquake-tsunami/,https://i.amz.mshcdn.com/Q1Lk_uJ5M_JChq2H5hF_JdoofcE=/1200x630/2018%2F01%2F23%2F22%2F5c1e1c2b571f4946b2c31b51873f2730.e0afb.jpg,mashable,Mashable,quake,1
https://www.facebook.com/bbcnews,"A powerful 6.4-magnitude earthquake south of the island of Zakynthos has been felt across western Greece. The tremor, which struck at 01:54 on Friday (22:54 GMT) caused no injuries but some damage to the local pier as well a 13th Century monastery, reports said. A series of aftershocks were felt in the hours after the quake and local schools were shut for the day. The quake was centred 34km south-west of Zakynthos in the Ionian Sea. It was felt as far afield as western Italy, Albania, Libya and the capital Athens, Greek media said. Zakynthos was hit by a 7.3-magnitude quake in 1953, destroying most of the buildings of the island. Since then all buildings have been fortified to protect against further tremors. However, first pictures on Friday showed a large crack in the ground at the island's port.",The tremor caused no injuries but some damage to a local pier as well a 13th Century monastery.,2018-10-26T07:07:44Z,"{'id': 'bbc-news', 'name': 'BBC News'}",Zakynthos earthquake: Greek island shaken by 6.4 tremor,https://www.bbc.co.uk/news/world-europe-45988853,https://ichef.bbci.co.uk/news/1024/branded_news/BCA5/production/_104039284_zakynthosquake.png,bbc-news,BBC News,quake,1
https://www.facebook.com/bbcnews,"Image copyright European Photopress Agency Image caption Authorities say about 1,500 people have been left homeless A rare earthquake that struck South Korea on Wednesday was the second-strongest on record, authorities said. The 5.4 magnitude tremor hit the south-eastern port city of Pohang in the afternoon, and dozens of aftershocks have occurred since. It has left at least 57 people injured and more than 1,500 homeless. In an unprecedented step, the education ministry has postponed the nationwide college entrance exam which had been scheduled for Thursday. South Korean news agency Yonhap said it was the first time a natural disaster had forced a rescheduling of the crucial exam which students and parents spend months preparing for. Image copyright AFP/Getty Images Image caption Officials say more than 1,000 buildings and vehicles have been damaged South Korea rarely experiences tremors, but seismic activity is very closely monitored because a spike is often the first sign that North Korea has carried out a nuclear test. Last year, a magnitude 5.8 earthquake hit the nearby city of Geongju, but the damage from Wednesday's quake has been more severe. More than 1,000 buildings, homes and vehicles have been destroyed or damaged.","In an unprecedented step, authorities have delayed the all-important nationwide college entrance exam.",2017-11-16T05:03:47Z,"{'id': 'bbc-news', 'name': 'BBC News'}",South Korea quake was second-strongest on record,http://www.bbc.co.uk/news/world-asia-42007298,https://ichef-1.bbci.co.uk/news/1024/cpsprodpb/21BD/production/_98773680_a3396f1b-a2f5-4b9b-b922-8a0d47429e99.jpg,bbc-news,BBC News,quake,1
Tom McKay,"A Japanese nuclear power station in Hokkaido is operating on emergency power after the region was hit by a 6.7-magnitude quake in the early hours of Thursday morning, Reuters reported. However, though the event carries unsettling overtones of the Fukushima Daiichi nuclear disaster in 2011, authorities say there is currently no danger of any similar radioactive release occurring. 100 people are injured and 19 missing following the quake on Thursday, Reuters reported, citing Japanese broadcaster NHK. The seismic event knocked out local power, forcing Hokkaido Electric Power’s Tomari nuclear plant to switch to emergency generators to keep its three reactors from overloading. Reuters wrote: The station’s fuel rods are being cooled with emergency power supplied by diesel generators, Chief Cabinet Secretary Yoshihide Suga told reporters on Thursday. There were no radiation irregularities at the plant, Suga said, citing the operator. The atomic regulator said the diesel generators have enough fuel to last seven days. The Fukushima incident occurred after an earthquake off the coast of Tōhoku prefecture on Honshu, Japan’s largest island, caused a tsunami. The disaster killed some 19,000 people, as well as knocked out power to and swamped backup generators at the Fukushima facility. The result was three nuclear meltdowns and hydrogen-air explosions that spread a radioactive plume up to 25 miles away, as well as resulted in authorities dumping massive amounts of contaminated material into the oceans. Scientists say most of that radiation quickly faded or was otherwise diluted. Most, but not all, also agree that there is likely a low risk to public health outside of the immediate region of the plant. The primary danger is to the thousands of workers involved in its cleanup. On Wednesday, the New York Times reported, the Japanese government acknowledged the first death of a worker from radiation exposure at the plant, a subcontractor for its operator Tokyo Electric Power Company that developed lung cancer in 2016. Japan idled all of its 54 nuclear power facilities after the incident, but seven have since been reactivated “after a protracted relicensing process,” Reuters wrote. The Conversation wrote last year that the Japanese government estimated the total cost of the Fukushima at around $188 billion, while polls indicated the Japanese public had lost faith in the safety of nuclear power. The cleanup effort at the facility still generates huge amounts of nuclear waste, and Tokyo Electric doesn’t expect to begin clearing fuel debris from the destroyed reactor cores until into the next decade. According to Reuters, Prime Minister Shinzo Abe told reporters that he is coordinating emergency response for the earthquake on Thursday. A government spokesman added that a Mitsubishi Steel Manufacturing plant in the city of Muroran also caught fire, but is being brought under control. [ Reuters ]","A Japanese nuclear power station in Hokkaido is operating on emergency power after the region was hit by a 6.7-magnitude quake in the early hours of Thursday morning, Reuters reported. However, though the event carries unsettling overtones of the Fukushima Da…",2018-09-06T03:30:00Z,"{'id': None, 'name': 'Gizmodo.com'}","Japanese Nuclear Plant on Emergency Power After Quake, But Little Risk of Fukushima-Type Event",https://gizmodo.com/japanese-nuclear-plant-on-emergency-power-after-quake-1828847260,"https://i.kinja-img.com/gawker-media/image/upload/s--jvW0PLQ5--/c_fill,fl_progressive,g_center,h_900,q_80,w_1600/lrg5yg80lvgd4qsftppm.jpg",,Gizmodo.com,quake,1
