author,content,description,publishedAt,source,title,url,urlToImage,source_id,source_name,types,yes_disaster
Reuters Editorial,"PALU, Indonesia (Reuters) - Indonesian authorities scrambled on Monday to get aid and rescue equipment into quake-hit Sulawesi island, and prepared to bury some of the more than 800 dead, while shaken survivors streamed out of the area in search of food and shelter. The confirmed death toll of 832 looked certain to rise as rescuers slowly reached devastated outlying communities hit on Friday by a 7.5 magnitude earthquake and subsequent tsunami waves as high as six meters (20 feet). Dozens of people were reported to be trapped in the rubble of several hotels and a mall in the small city of Palu, 1,500 km (930 miles) northeast of Jakarta, with hundreds more feared buried in landslides that engulfed villages. President Joko Widodo told reporters in Jakarta getting those people out was a priority. “The evacuation is not finished yet, there are many places where the evacuation couldn’t be done because of the absence of heavy equipment, but last night equipment started to arrive in Palu,” Widodo said. “We’ll send as much food supplies as possible today with Hercules planes, directly from Jakarta, there are several,” he said, referring to C-130 military transport aircraft. The national search and rescue agency said one woman was rescued overnight in the Palu neighborhood of Balaroa, where houses were swallowed up when the earthquake caused soil liquefaction. Most of the confirmed deaths were in Palu, a city of about 380,000 people, where authorities were preparing a mass grave to bury some of the dead as soon as they were identified. However, nearly three days after the quake, the extent of the disaster has yet to be made clear with authorities bracing for the death toll to climb sharply - perhaps into the thousands - as connections with remote areas up and down the coast are restored. Of particular concern is Donggala, a region of 300,000 people north of Palu and close to the epicenter of the quake, and two other districts, which have been cut off from communications since Friday. Along with Palu, these districts have a combined population of about 1.4 million. Five foreigners - three French, one South Korean and one Malaysian - were among the missing. Sulawesi is one of the earthquake-prone archipelago nation’s five main islands and sits astride fault lines. Numerous aftershocks have rattled the region. Graphic: Sulawesi map - tmsnrt.rs/2OYa4YD FUEL AND RICE Footage of the ruined city of Palu showed a crumpled mess of houses, cars and trees mashed together, with rooftops and roads split asunder. Officials say rescuers need heavy equipment to shift slabs of broken concrete but access to many areas has been hampered by damaged roads, landslides and collapsed bridges. A Reuters witness said queues at petrol stations on the approaches to Palu stretched for kilometers. Convoys carrying food, water and fuel headed towards the city while a stream of residents headed out. The state energy company said it was airlifting in 4,000 liters of fuel, while Indonesia’s logistics agency said it would send hundreds of tonnes of rice. Finance Minister Sri Mulyani Indrawati said the government had allocated 560 billion rupiah ($37.58 million) for disaster recovery, media reported. Military aircraft were sent to bring people out of Palu, where crowds were waiting at the airport, military official Bambang Sudewo told Metro TV. “All military planes are deployed to support this,” he said. It was hoped up to 1,500 people could be taken out every day, with children, women and the injured the priority, he said. Indonesia, which sits on the seismically active Pacific Ring of Fire, is all too familiar with earthquakes and tsunamis. A quake off Sumatra island in 2004 triggered a tsunami across the Indian Ocean that killed 226,000 people in 13 countries, including more than 120,000 in Indonesia. Questions are sure to be asked why warning systems set up after that disaster appear to have failed on Friday, and why more people in coastal areas had not moved to higher ground after a big quake, even in the absence of an official warning. Sutopo Purwo Nugroho, spokesman for the National Disaster Mitigation Agency, told reporters on Sunday none of Indonesia’s tsunami buoys, one type of instrument used to detect the waves, had been operating since 2012. He blamed a fall-off in funding. The meteorological and geophysics agency BMKG issued a tsunami warning after the quake but lifted it 34 minutes later, drawing criticism it had been too hasty. However, officials estimated the waves had hit while the warning was in force. The head of Indonesia’s investment board said on Twitter Widodo had agreed to accept international help and he would coordinate private sector help from around the world. Neighbors including Australia, Thailand and China have offered help, while the European Union announced 1.5 million euros ($1.74 million) in immediate aid. Reporting by Reuters stringer in PALU, Fergus Jensen, Fanny Potkin, Tabita Diela, Agustinus Beo Da Costa, Gayatri Suroyo and Fransiska Nangoy in JAKARTA, and Kanupriya Kapoor in MAMUJU; Writing by Robert Birsel; Editing by Lincoln Feast and Paul Tait","Indonesian authorities scrambled on Monday to get aid and rescue equipment into quake-hit Sulawesi island, and prepared to bury some of the more than 800 dead, while shaken survivors streamed out of the area in search of food and shelter.",2018-10-01T05:59:32Z,"{'id': 'reuters', 'name': 'Reuters'}","Indonesia rushes aid to Sulawesi as death toll from quake, tsunami passes 830",https://www.reuters.com/article/us-indonesia-quake/indonesia-rushes-aid-to-sulawesi-as-death-toll-from-quake-tsunami-passes-830-idUSKCN1MB12Z,https://s1.reutersmedia.net/resources/r/?m=02&d=20181001&t=2&i=1309988684&w=1200&r=LYNXNPEE901C2,reuters,Reuters,quake,1
Fathin Ungku,"PALU, Indonesia (Reuters) - Children in the Indonesian city of Palu began returning to school on Monday to tidy up their classrooms and to help gather data on how many of them will be coming back 10 days after a major earthquake and tsunami hit their city. The 7.5 magnitude quake on Sept. 28 brought down many buildings in the small city on Sulawesi island, 1,500 km (30 miles) northeast of Jakarta, while tsunami waves smashed into its beachfront. But the biggest killer was probably soil liquefaction, which happens when a powerful quake turns the ground into a liquid mire and which obliterated several Palu neighborhoods. The official death toll is 1,763 but bodies are still being recovered. No one knows how many people are missing, especially in the areas hit by liquefaction, but it could be as high as 5,000, the national disaster agency said. At one state high school, teenagers dressed in gray and white uniforms swept up broken glass in the classrooms. Trophies had fallen from a broken school showcase and the basketball court was cracked. “It’s sad to see our school like this,” said Dewi Rahmawati, 17, who expects to graduate next year and wants to study economics at university. The students found out that they had to turn up to school through messages on Facebook and WhatsApp. School principal Kasiludin said authorities told all teachers to show up for work from Monday to collect information on student numbers. “We won’t force the students to come back because many are traumatized. But we must start again soon to keep their spirits up and so they don’t fall behind,” he said. The school had lost at least seven students and one teacher, he said. GRAPHIC: Catastrophe in Sulawesi - tmsnrt.rs/2OqQlUo POSITIVE THINKING At the SMP Negeri 15 Palu middle school, fewer than 50 of its 697 students showed up. School principal Abdul Rashid said he was aware of four students killed in the quake. “Classes haven’t started. We’re only collecting data to find out how many students are safe,” he said. “I’m still waiting for the Ministry of Education to give us instructions on when to begin classes. For now, I don’t think we’re ready. Many children are traumatized and frightened.” One boy chatting in the school compound with friends said he was disappointed that so few of his class mates had shown up. “I haven’t heard from so many of them. I want to think positively; I hope they are OK,” said Muhamad Islam Bintang Lima, dressed in the school uniform of white shirt and navy blue trousers. Most of the dead from the quake and tsunami were in Palu, the region’s main urban center. Figures for more remote areas are trickling in but they seem to have suffered fewer deaths than the city. Sulawesi is one of Indonesia’s five main islands. The archipelago sees frequent earthquakes and occasional tsunamis. In 2004, a quake off Sumatra island triggered a tsunami across the Indian Ocean that killed 226,000 people in 13 countries, including more than 120,000 in Indonesia. A spokesman for the national disaster mitigation agency said on Sunday searches for bodies would stop on Thursday. Debris would be cleared and areas hit by liquefaction would be turned into parks, sports venues and other public spaces, the spokesman said. Indonesia is hosting an International Monetary Fund/World Bank meeting on the resort island of Bali this week, which has drawn some criticism from the political opposition. “What is the benefit for us Indonesian people, especially in this time of catastrophe,” Fadli Zon, deputy speaker of parliament from the opposition nationalist Gerindra party, said on Twitter, taking issue with government spending on the meeting. The government has allocated $37 million to help victims of the earthquake. GRAPHIC: Destruction in Palu - tmsnrt.rs/2IDFukK Writing by Robert Birsel; Editing by Paul Tait",Children in the Indonesian city of Palu began returning to school on Monday to tidy up their classrooms and to help gather data on how many of them will be coming back 10 days after a major earthquake and tsunami hit their city.,2018-10-08T05:39:19Z,"{'id': 'reuters', 'name': 'Reuters'}","Children return to schools in Indonesia quake city to clean up, find friends",https://www.reuters.com/article/us-indonesia-quake/children-return-to-schools-in-indonesia-quake-city-to-clean-up-find-friends-idUSKCN1MI05S,https://s3.reutersmedia.net/resources/r/?m=02&d=20181008&t=2&i=1312403206&w=1200&r=LYNXNPEE9705P,reuters,Reuters,quake,1
,"A magnitude 7.5 earthquake rocked Indonesias Sulawesi island, near the city of Palu, on Friday. The quake triggered a 20-foot-tall tsunami that swept across Palu and the surrounding area. The death toll has climbed past 800, but authorities say they fear it could grow, as the desperate search for survivors continues. One survivor told reporters: ""The ground rose up like a spine and suddenly fell."" Officials said hundreds could still be buried in the mud and debris. Several towns remain cut off because roads and bridges were damaged or destroyed, hindering rescue and recovery efforts. (MORE: The Latest from the Aftermath ) Indonesian President Joko ""Jokowi"" Widodo toured Palu, home to 380,000 people, on Sunday. ""There are many challenges,"" Jokowi said. ""We have to do many things soon, but conditions do not allow us to do so."" Jokowi also said there are also shortages of fuel, electricity and food. The quake and tsunami were the latest natural disasters to hit Indonesia, which is frequently struck by earthquakes, volcanic eruptions and tsunamis because of its location on the ""Ring of Fire,"" an arc of volcanoes and fault lines in the Pacific Basin. In December 2004, a massive magnitude 9.1 earthquake off Sumatra island in western Indonesia triggered a tsunami that killed 230,000 people in a dozen countries. Last month, a powerful quake on the island of Lombok killed 505 people.","The Weather Channel Photos from Deadly Indonesia Earthquake, Tsunami Show Incredible Devastation The Weather Channel A magnitude 7.5 earthquake rocked Indonesia's Sulawesi island, near the city of Palu, on Friday. The quake triggered a 20-foot-tall tsunami th…",2018-10-01T11:38:11Z,"{'id': None, 'name': 'Weather.com'}","Photos from Deadly Indonesia Earthquake, Tsunami Show Incredible Devastation - The Weather Channel",https://weather.com/news/news/2018-10-01-indonesia-earthquake-tsunami-photos,https://s.w-x.co/pt-indonesia6.jpg,,Weather.com,quake,1
Fathin Ungku,"PALU, Indonesia (Reuters) - Indonesia scrambled on Monday to get help into quake-hit Sulawesi island as survivors streamed away from their ruined homes and accounts of devastation filtered out of remote areas, including the death of 34 children at a Christian camp. The confirmed death toll of 844 was certain to rise as rescuers reached devastated outlying communities hit on Friday by a 7.5 magnitude earthquake and subsequent tsunami waves as high as six metres (20 feet). Dozens of people were reported to be trapped in the rubble of several hotels and a mall in the small city of Palu, 1,500 km (930 miles) northeast of Jakarta. Hundreds more were feared buried in landslides that engulfed villages. Of particular concern is Donggala, a region of 300,000 people north of Palu and close to the epicentre of the quake, and two other districts, where communication had been cut off. The four districts have a combined population of about 1.4 million. One woman was recovered alive from ruins overnight in the Palu neighbourhood of Balaroa, where about 1,700 houses were swallowed up when the earthquake caused soil to liquefy, the national rescue agency said. “We don’t know how many victims could be buried there, it’s estimated hundreds,” said Sutopo Purwo Nugroho, spokesman for the National Disaster Mitigation Agency. All but 23 of the confirmed deaths were in Palu, a city of about 380,000 people, where workers were preparing a mass grave to bury the dead as soon as they were identified. Nearly three days after the quake, the extent of the disaster was not known with authorities bracing for the toll to climb - perhaps into the thousands - as connections with remote areas up and down the coast are restored. Aid worker Lian Gogali, who had reached Donggala district by motorcycle, said hundreds of people facing a lack of food and medicine were trying to get out, but evacuation teams had yet to arrive and roads were blocked. “It’s devastating,” she told Reuters by text. Indonesian Red Cross spokeswoman Aulia Arriani said a church in an area of Sigi, south of Palu, had been engulfed in mud and debris. Officials said the area suffered liquefaction, when the shock of the quake temporarily destabilises the soil. “My volunteers found 34 bodies... children who had been doing a bible camp,” Arriani said. Sulawesi is one of the earthquake-prone archipelago nation’s five main islands and sits astride fault lines. Numerous aftershocks have rattled the region. Pictures showed expanses of splintered wood, washed-up cars and trees mashed together, with rooftops and roads split asunder. Access to many areas is being hampered by damaged roads, landslides and collapsed bridges. AIRPORT CHAOS A Reuters witness said queues at petrol stations on the approaches to Palu stretched for miles. Convoys carrying food, water and fuel awaited police escorts to prevent pilfering before heading towards the city while residents streamed out. The state energy company said it was airlifting in 4,000 litres of fuel, while Indonesia’s logistics agency said it would send hundreds of tonnes of rice. The government has allocated 560 billion rupiah ($37.58 million) for the recovery. The government has played down worries about looting though witnesses have seen incidents. Chief security minister Wiranto said more than 2,800 troops had been deployed and plans were in place to send in a further 2,000 police. The government would accept offers of help from 18 countries and it had also commandeered 20 excavators from mines and plantations to help with a shortage of equipment to dig through wreckage and clear blocked roads, he said. Nearly 60,000 people were displaced, many terrified by powerful aftershocks, and they needed tents, water and sanitary facilities, while the power utility was working to restore electricity, he said. Commercial flights have yet to resume but military aircraft were taking people out of Palu. About 3,000 people thronged the small airport hoping to get out and officers struggled to keep order. “I’d get a plane anywhere. I’ve been waiting for two days. Haven’t eaten, barely had a drink,” said 44-year-old food vendor Wiwid. Indonesia is all too familiar with earthquakes and tsunamis. A quake in 2004 triggered a tsunami across the Indian Ocean that killed 226,000 people in 13 countries, including more than 120,000 in Indonesia. Palu sits astride the Palu-Koro fault, which runs north-south along the edge of Palu Bay. Geologists estimate segments of the fault have a slip that is among the highest in Indonesia, at 4 cm (1.6 inches) a year, exposing the area to a higher risk of quakes. Questions are sure to be asked why warning systems set up after the 2004 disaster appear to have failed. Disaster agency spokesman Nugroho told reporters on Sunday none of Indonesia’s tsunami buoys, one device used to detect waves, had been operating since 2012. He blamed a lack of funds. The meteorological and geophysics agency BMKG issued a tsunami warning after the quake but lifted it 34 minutes later, drawing criticism it had been too hasty. However, officials estimated the waves had hit while the warning was in force. Graphic: Sulawesi map - tmsnrt.rs/2OYa4YD Additional reporting by Reuters stringer in PALU, Fergus Jensen, Fanny Potkin, Tabita Diela, Agustinus Beo Da Costa, Gayatri Suroyo and Fransiska Nangoy in JAKARTA; Writing by Robert Birsel; Editing by Paul Tait and Nick Macfie","Reuters Desperate Indonesians flee quake zone, with scale of disaster unclear Reuters PALU, Indonesia (Reuters) - Indonesia scrambled on Monday to get help into quake-hit Sulawesi island as survivors streamed away from their ruined homes and accounts of devas…",2018-10-01T12:45:41Z,"{'id': 'reuters', 'name': 'Reuters'}","Desperate Indonesians flee quake zone, with scale of disaster unclear - Reuters",https://uk.reuters.com/article/uk-indonesia-quake/desperate-indonesians-flee-quake-zone-with-scale-of-disaster-unclear-idUKKCN1MB12Q,https://s2.reutersmedia.net/resources/r/?m=02&d=20181001&t=2&i=1310064279&w=1200&r=LYNXNPEE901RG,reuters,Reuters,quake,1
Fathin Ungku,"PALU, Indonesia (Reuters) - Children in the Indonesian city of Palu began returning to school on Monday to tidy up their classrooms and to help gather data on how many of them will be coming back 10 days after a major earthquake and tsunami hit their city. The 7.5 magnitude quake on Sept. 28 brought down many buildings in the small city on Sulawesi island, 1,500 km (30 miles) northeast of Jakarta, while tsunami waves smashed into its beachfront. But the biggest killer was probably soil liquefaction, which happens when a powerful quake turns the ground into a liquid mire and which obliterated several Palu neighborhoods. The official death toll is 1,763 but bodies are still being recovered. No one knows how many people are missing but it is at least in the hundreds. At one state high school, teenagers dressed in gray and white uniforms swept up broken glass in the classrooms. Trophies had fallen from a broken school showcase and the basketball court was cracked. “It’s sad to see our school like this,” said Dewi Rahmawati, 17, who expects to graduate next year and wants to study economics at university. The students found out that they had to turn up to school through messages on Facebook and WhatsApp. School principal Kasiludin said authorities told all teachers to show up for work from Monday to collect information on student numbers. “We won’t force the students to come back because many are traumatized. But we must start again soon to keep their spirits up and so they don’t fall behind,” he said. The school had lost at least seven students and one teacher, he said. GRAPHIC: Catastrophe in Sulawesi - tmsnrt.rs/2OqQlUo POSITIVE THINKING At the SMP Negeri 15 Palu middle school, fewer than 50 of its 697 students showed up. School principal Abdul Rashid said he was aware of four students killed in the quake. “Classes haven’t started. We’re only collecting data to find out how many students are safe,” he said. “I’m still waiting for the Ministry of Education to give us instructions on when to begin classes. For now, I don’t think we’re ready. Many children are traumatized and frightened.” One boy chatting in the school compound with a few friends said he was disappointed that so few of his class mates had shown up. “I want school to start as soon as possible so I can find out how my friends are doing,” said Muhamad Islam Bintang Lima, dressed in the school uniform of white shirt and navy blue trousers. “I haven’t heard from so many of them. I want to think positively; I hope they are OK.” Most of the dead from the quake and tsunami were in Palu, the region’s main urban center. Figures for more remote areas are trickling in but they seem to have suffered fewer deaths than the city. Sulawesi is one of Indonesia’s five main islands. The archipelago sees frequent earthquakes and occasional tsunamis. In 2004, a quake off Sumatra island triggered a tsunami across the Indian Ocean that killed 226,000 people in 13 countries, including more than 120,000 in Indonesia. A spokesman for the national disaster mitigation agency said on Sunday searches for bodies would stop on Thursday. Debris would be cleared and areas hit by liquefaction would be turned into parks, sports venues and other public spaces, the spokesman said. GRAPHIC: Destruction in Palu - tmsnrt.rs/2IDFukK Writing by Robert Birsel; Editing by Paul Tait",Children in the Indonesian city of Palu began returning to school on Monday to tidy up their classrooms and to help gather data on how many of them will be coming back 10 days after a major earthquake and tsunami hit their city.,2018-10-08T02:40:30Z,"{'id': 'reuters', 'name': 'Reuters'}",Schools in Indonesia quake city begin counting how many children will be back,https://www.reuters.com/article/us-indonesia-quake/schools-in-indonesia-quake-city-begin-counting-how-many-children-will-be-back-idUSKCN1MI05S,https://s3.reutersmedia.net/resources/r/?m=02&d=20181008&t=2&i=1312365901&w=1200&r=LYNXNPEE9702P,reuters,Reuters,quake,1
